paper_id,title,authors,abstract,doi,year,venue,url,keyword,source_file,source_repos,abstract_quality,format_excluded,scope_excluded,c2,c3,fulltext_flag,c2_and_c3,disposition,advances_to_fulltext,primary_reason,val_reason,keyword_conditioned_context,keyword_conditioned_paragraph_count,focus_keyword,embedding_model,text_view,cluster_method,cluster,cluster_theme_terms,umap_x,umap_y,distance_to_centroid,representative_rank,is_representative_top3,medoid_rank,lda_topic,lda_topic_probability,lda_topic_words,cluster_label_candidate,cluster_summary_candidate,facet_population_or_context,facet_stakeholder_or_population,facet_method_or_lens,facet_artifact_or_domain,facet_contribution_or_outcome,nearest_papers
40a2d86cd488,Elements of a design method - a basis for describing and evaluating design methods,"Gericke, K. (1); Eckert, C. (2); Stacey, M. (3)","Method development is at the heart of design research as methods are a formalised way to express knowledge about how aspects of design could or should be done. However, assuring that methods are in fact used in industry has remained a challenge. Industry will only use methods that they can understand and that they feel will give them benefit reliably. To understand the challenges involved in adopting a method, the method needs to be seen in context: it does not exist in isolation but forms a part of an ecosystem of methods for tackling related design problems. A method depends on the knowledge and skills of the practitioners using it: while a description of a method is an artefact that is a formalisation of engineering knowledge, a method in use constitutes a socio-technical system depending on the interaction of human participants with each other as well as with the description of the method, representations of design information and, often, tools for carrying out the method's tasks. This paper argues that crucial factors in the adoption of methods include how well they are described and how convincingly they are evaluated. The description of a method should cover itscore idea, therepresentationsin which design information is described, theprocedureto be followed, itsintended use, and thetoolsit uses. The account of a method's intended use should cover itspurpose, the situations or product types within itsscope, itscoverageof kinds of problems within its scope, itsexpected benefitandconditionsfor its use. The different elements need to be evaluated separately as well as the method as an integrated whole. While verification and validation are important for some elements of methods, it is rarely possible to prove the validity of a method. Rather the developers of methods need to gather sufficient evidence that a method will work within a clearly articulated scope. Most design methods do not have binary success criteria, and their usefulness in practice depends as much on simplicity and usability as on the outcomes they produce. Evaluation should focus on how well they work, and how they can be customised and improved.",10.1017/dsj.2022.23,,Design Science,,Design methods,design_methods.csv,engineering_village,full,False,False,True,True,True,True,advance_criteria,True,"Studies design methods as formalized knowledge and proposes elements to describe/evaluate them, satisfying C2 and likely defining method constructs, warranting full-text review.","The paper appears to analyze and describe elements of design methods as a basis for evaluating methods, suggesting design knowledge is central, but the truncated abstract does not clearly confirm a literature synthesis or explicit definition.",,0,Design methods,tfidf-svd,overall,hdbscan,-1,noise / outliers,7.9504766,5.9103274,,-1,True,-1,3,0.9969396926050821,"elements, description, scope, focus, problems, understand, need, described",Noise / Outliers,These papers were not assigned to a dense DBSCAN cluster.,,,,,,"[{'paper_id': '5389fb1cc38b', 'title': 'Elements of a design method – a basis for describing and evaluating design methods', 'cluster': -1, 'distance': 0.0002487564436877143}, {'paper_id': 'b5d968168f35', 'title': 'A Framework of Design Method Corroboration', 'cluster': -1, 'distance': 0.7027491497421581}, {'paper_id': '9fbb38d67689', 'title': 'Analysis of methods of creating new technical systems', 'cluster': -1, 'distance': 0.8068159913982275}, {'paper_id': 'd330bde18c87', 'title': 'Languaging design methods', 'cluster': -1, 'distance': 0.8539868739321921}, {'paper_id': '60c69d24c5a3', 'title': 'Evaluating the efficacy and effectiveness of design methods: A systematic review and assessment framework', 'cluster': -1, 'distance': 0.8557402767693774}]"
d330bde18c87,Languaging design methods,"Gray, C.M. (1)","Design methods have been integral to design studies research, with initial goals of bringing rationality and objectivity to design activities, later shifting to the creation and provision of methods as tools to encourage more reflective, meaningful, and socially responsible design practices. However, little research exists that describes how methods are created, what knowledge is used to inform this creation, or connects elements of methods to performance by designers. In this research note, I describe performative, codification-oriented, and presentation-oriented stances towards design methods, articulating a vocabulary that languages aspects of methods. I describe areas where this vocabulary may support design researchers, including building new design methods, informing descriptive accounts of methods in use, and supporting the creation of a theory of method. All rights reserved Elsevier.",10.1016/j.destud.2021.101076,,Design Studies,,Design methods,design_methods.csv,engineering_village,full,False,False,True,True,True,True,advance_criteria,True,"Examines how design methods are created and the knowledge informing them, and proposes its own stances/definitions of design methods, plausibly satisfying C2 and C3.","Although this research note appears centrally concerned with design methods and describes stances toward them, the abstract does not clearly state that these stances are synthesized from prior literature or that it explicitly defines a design-knowledge construct, so it should be checked in full text.",,0,Design methods,tfidf-svd,overall,hdbscan,-1,noise / outliers,7.925277,5.111901,,-1,True,-1,4,0.9850322637748632,"focus, methods methods, embodied, architectural, concept, flexibility, structures, systemic",Noise / Outliers,These papers were not assigned to a dense DBSCAN cluster.,,,,,,"[{'paper_id': '0a373ca87142', 'title': 'Surveying a Landscape of Ethics-Focused Design Methods', 'cluster': -1, 'distance': 0.7693936600086448}, {'paper_id': '7e095752d24c', 'title': 'Think-4-EmCoDe framework: Highlighting key qualities in embodied co-design techniques for children', 'cluster': -1, 'distance': 0.796887700540813}, {'paper_id': 'b2234ef79a5a', 'title': ""Tracing situated effects of innovative design methods: inexperienced designers' practices"", 'cluster': -1, 'distance': 0.8070680871850137}, {'paper_id': '878cf959ac53', 'title': 'Designerly Research Methods and Researcherly Design Methods', 'cluster': -1, 'distance': 0.8078762154647215}, {'paper_id': '9fbb38d67689', 'title': 'Analysis of methods of creating new technical systems', 'cluster': -1, 'distance': 0.822849932576216}]"
5ba50396ff25,What is a Convention in Interactive Narrative Design?,"Koenitz, H. (1); Roth, C. (1); Dubbelman, T. (1); Knoller, N. (1)","This paper reports on an aspect of a long-term project to create a body of evidence-based interactive narrative design methods. In this context, we discuss aspects of formal design descriptions as a basis for a quantitative approach to verify the effects of design choices on the experience of audiences. Specifically, we discuss the notion of ‘design conventions’ by acknowledging earlier usages of the term and the related discourse in video game studies.",10.1007/978-3-319-71027-3_29,,"Interactive Storytelling. 10th International Conference on Interactive Digital Storytelling, ICIDS 2017. Proceedings: LNCS 10690",,Design methods,design_methods.csv,engineering_village,full,False,False,True,True,True,True,advance_criteria,True,"Examines the notion of 'design conventions' in interactive narrative design, discussing prior usages and offering its own framing of the construct, plausibly satisfying C2 and C3; flagged for full-text confirmation.","This appears to analyze writing and design methods for playable stories with design knowledge as a plausible topic, but the abstract does not clearly show a literature-based synthesis or an explicit definition, so full text is needed.",,0,Design methods,tfidf-svd,overall,hdbscan,-1,noise / outliers,10.367354,5.3533273,,-1,True,-1,2,0.9760212635427085,"focus methods, centred, innovative, participatory, students, practices, literature, concept",Noise / Outliers,These papers were not assigned to a dense DBSCAN cluster.,,,,,,"[{'paper_id': '714b3f6f8ac7', 'title': 'Degrees of Interaction: Towards a Classification', 'cluster': -1, 'distance': 0.576949748110978}, {'paper_id': '7ebbe03ea0d8', 'title': 'Autobiographical design in HCI research: designing and learning through use-it-yourself', 'cluster': -1, 'distance': 0.8440174863592087}, {'paper_id': 'b841f16ac5b3', 'title': 'Design methods for real time software', 'cluster': -1, 'distance': 0.8951684200973161}, {'paper_id': '60c69d24c5a3', 'title': 'Evaluating the efficacy and effectiveness of design methods: A systematic review and assessment framework', 'cluster': -1, 'distance': 0.8972837315835016}, {'paper_id': 'dbf31702e533', 'title': 'Patterns for living lab practice: describing key know-how to promote service co-creation with users', 'cluster': -1, 'distance': 0.9147236079780157}]"
dbf31702e533,Patterns for living lab practice: describing key know-how to promote service co-creation with users,"Akasaka, Fumiya (1); Yasuoka, Mika (2); Nakatani, Momoko (1); Kimura, Atsunobu (1); Ihara, Masayuki (1)","'Value co-creation' among actors related to service provision is one of the key concepts in service design. Living Lab (LL) is a co-creative service design methodology in which designers and users collaboratively design services. In LL, users are actively involved in service design processes over long periods. Because LL is a design methodology based on longterm co-creation with users, its practices involve more direct and indirect communication and collaboration with users than typical service design does. Therefore, in order to make value co-creation successful in LL projects, it is crucial for designers to use not only knowledge of service design methods, but also practical know-how related to 'facilitating long-term cocreation with users.' Such know-how is not always shared, however, among LL practitioners, because it is often buried in their experiences. Thus, LL practice currently places heavy reliance on the practitioners’ intuition and experience. Therefore, to support LL practitioners, it is essential to extract key knowhow on how to achieve successful LL projects from experienced practitioners, and to describe such knowhow. This would allow us to share and reuse knowhow in planning and running an LL project. Hence, the purpose of this study is to extract such key knowhow for LL practice and describe it in an easy-to-reuse manner. We first developed a workshop to extract key know-how for LL practice. In this study, we held the workshop twice and could extract 30 items of key know-how. Subsequently, we described the extracted key know-how as 'patterns' by using the pattern language framework, and we developed a booklet listing the 30 patterns in an easy-to-reuse manner. The booklet can be used by LL practitioners to refer to and reuse the key know-how for LL practice. Through an evaluation, we confirmed that the developed booklet is useful for LL practitioners for referring to and using LL know-how. © 2020, Fuji Technology Press. All rights reserved.",10.20965/ijat.2020.p0769,2020,International Journal of Automation Technology,,Design methods,design_methods.csv,engineering_village|semantic_scholar,full,False,False,True,True,True,True,advance_criteria,True,"Develops patterns describing key know-how for Living Lab service co-creation, synthesizing design knowledge into patterns (C2) and defining LL/co-creation constructs (C3 plausible), warranting full-text review.","The paper appears to articulate patterns/know-how for living lab service co-creation practice, suggesting a synthesis/categorization of design knowledge from practice or prior work, but the truncated abstract does not clearly confirm any explicit definition or adaptation.",,0,Design methods,tfidf-svd,overall,hdbscan,-1,noise / outliers,8.126086,4.514946,,-1,True,-1,5,0.9918687408893766,"architecture, value, key, practitioners, non, formation, service, education",Noise / Outliers,These papers were not assigned to a dense DBSCAN cluster.,,,,,,"[{'paper_id': '27b32c0d515d', 'title': 'Advancing service design research with design science research', 'cluster': -1, 'distance': 0.6162714565866898}, {'paper_id': '7e095752d24c', 'title': 'Think-4-EmCoDe framework: Highlighting key qualities in embodied co-design techniques for children', 'cluster': -1, 'distance': 0.85823387197245}, {'paper_id': 'd330bde18c87', 'title': 'Languaging design methods', 'cluster': -1, 'distance': 0.8628065047901274}, {'paper_id': 'b5d968168f35', 'title': 'A Framework of Design Method Corroboration', 'cluster': -1, 'distance': 0.8656716348661748}, {'paper_id': '1416cd2b88de', 'title': 'Cross-disciplinary system value overview towards value-oriented design', 'cluster': -1, 'distance': 0.8899913121316625}]"
49719118a4a0,Progressive collapse of structures – review and outlook,"Starossek, U. (1)","The difference between progressive collapse, related to mechanisms of collapse, and disproportionate collapse, related to design, is outlined. Various mechanisms of collapse are described, which helps to clarify conceptual relationships. Ordinary design procedures are inadequate for preventing disproportionate collapse. The reasons for this are explained. After defining the terms collapse resistance and robustness, a pragmatic design approach for achieving collapse resistance of general structures is outlined. In this approach, the design objectives are established in a decision-making process. Concerning design methods, segmentation is available in addition to alternative load paths. The former method can be preferable in case of large initial local failure. This pragmatic approach can be developed into model guidelines for the design of general structures against disproportionate collapse. In contrast, it is found that current design regulations apply only to buildings of small to medium size and not to structures in general. © 2019 Taylor & Francis Group, London, UK.",10.1201/9780429426506-364,2019,"Advances in Engineering Materials, Structures and Systems: Innovations, Mechanics and Applications - Proceedings of the 7th International Conference on Structural Engineering, Mechanics and Computation, 2019",,Design methods,design_methods.csv,engineering_village,full,False,False,True,True,True,True,advance_criteria,True,"Reviews and clarifies conceptual distinctions and definitions (collapse resistance, robustness) and outlines design approaches, plausibly synthesizing and defining constructs; flagged to confirm from full text.","This review explicitly clarifies and defines collapse-related concepts, describes conceptual relationships, and outlines a pragmatic design approach, satisfying both synthesis/definition and explicit definitional criteria.",,0,Design methods,tfidf-svd,overall,hdbscan,-1,noise / outliers,7.261614,4.107096,,-1,True,-1,4,0.9865009014335328,"focus, methods methods, embodied, architectural, concept, flexibility, structures, systemic",Noise / Outliers,These papers were not assigned to a dense DBSCAN cluster.,,,,,,"[{'paper_id': '95c2b3d44aff', 'title': 'Multiple forms of applications and impacts of a design theory -ten years of industrial applications of C-K theory', 'cluster': -1, 'distance': 0.864817867155834}, {'paper_id': '9fbb38d67689', 'title': 'Analysis of methods of creating new technical systems', 'cluster': -1, 'distance': 0.8668753558267662}, {'paper_id': 'b5d968168f35', 'title': 'A Framework of Design Method Corroboration', 'cluster': -1, 'distance': 0.8929262771126265}, {'paper_id': '9de0e13a7156', 'title': 'Towards functional de novo designed proteins.', 'cluster': -1, 'distance': 0.8960269806196068}, {'paper_id': '4592ed134f14', 'title': 'The relation between brain-learning physiology and conceptualization methods in the design process of architecture students1', 'cluster': -1, 'distance': 0.9065691817618597}]"
4934044e5959,Constraint management for concept ideation in conceptual design,"Liu, Ang (1); Wang, Yuchen (1); Teo, Ivan (1); Lu, Stephen (2)","Constraint plays a critical role in swaying the direction of concept ideation in conceptual design. Design constraints should be differentiated from design objectives because they play different roles in influencing ideation. Constraint management is a very challenging task in conceptual design because they are mostly abstract, subjective, and dynamic. This paper focuses on constraint management for the sake of concept ideation. In this work, design constraints are modeled as the initial and boundary conditions of concept ideation. A new classification scheme is proposed to classify various design constraints into four categories: input internal constraint, system internal constraint, input external constraint, and system external constraint. A new concept ideation process is prescribed to generate more constraint-compliant concepts, through biologically inspired design. Some existing design methods, such as Domain Structure Matrix and Concept Map, are incorporated into the proposed process. A case study is presented to showcase how to follow the proposed method to redesign a robotic vacuum cleaner to make it more compliant with stricter design constraints. © 2018 CIRP",10.1016/j.cirpj.2018.11.006,2019,CIRP Journal of Manufacturing Science and Technology,,Design methods,design_methods.csv,engineering_village|semantic_scholar,full,False,False,True,True,True,True,advance_criteria,True,"Studies design constraints in conceptual design, proposes a new classification scheme and differentiates/defines constraints versus objectives, plausibly satisfying C2 and C3.","The paper appears centrally concerned with conceptual design constraints and proposes a classification scheme for constraints, but the abstract truncation does not let us confirm whether this is a synthesis from prior work or an original definitional treatment, so full text is needed.",,0,Design methods,tfidf-svd,overall,hdbscan,-1,noise / outliers,9.386356,4.285198,,-1,True,-1,4,0.9883704340246453,"focus, methods methods, embodied, architectural, concept, flexibility, structures, systemic",Noise / Outliers,These papers were not assigned to a dense DBSCAN cluster.,,,,,,"[{'paper_id': '6e06768bb26b', 'title': 'Design as Research in Landscape Architecture', 'cluster': -1, 'distance': 0.8530806995984523}, {'paper_id': '799b06403189', 'title': 'State of the Art on Robust Design Methods for Additive Manufacturing', 'cluster': -1, 'distance': 0.8698338015794125}, {'paper_id': '8ade38cacb53', 'title': 'Architectural Design Method of Architectural Engineering', 'cluster': -1, 'distance': 0.8740173797201463}, {'paper_id': '0a373ca87142', 'title': 'Surveying a Landscape of Ethics-Focused Design Methods', 'cluster': -1, 'distance': 0.8892649124985134}, {'paper_id': 'da2bb1488305', 'title': 'Rigor in MIS Survey Research: In Search of Ideal Survey Methodological Attributes', 'cluster': -1, 'distance': 0.895633432777122}]"
b841f16ac5b3,Design methods for real time software,K. Jackson,"A definition of the term 'design' and its application to real time software, is given. A group of well known software design methods are analysed, including: Yourdon, SSADM, CORE, JSD, HOOD, MASCOT3. The author concludes that most design methods ignore architectural design, attempt to bypass it, or have just a single form of it. MASCOT and HOOD are the only two which address architectural design directly. Of these, HOOD provides only a limited subset of MASCOT. MASCOT itself has potential for enhancement to enable it to cope with the very largest of embedded real time systems.<>",,1990,,,Design methods,design_methods.csv,ieee|semantic_scholar,full,False,False,True,True,False,True,advance_criteria,True,"Defines the term 'design' and analyzes/compares a set of named software design methods, treating design methods as the topic of study and providing a definition.","This appears to discuss a user interface design methodology and its implications for systems design methods, with design methods as the topic, but the abstract only summarizes ongoing study findings and does not clearly show synthesis or explicit definitions.",,0,Design methods,tfidf-svd,overall,hdbscan,-1,noise / outliers,9.223236,5.246058,,-1,True,-1,2,0.9689425180265536,"focus methods, centred, innovative, participatory, students, practices, literature, concept",Noise / Outliers,These papers were not assigned to a dense DBSCAN cluster.,,,,,,"[{'paper_id': '8ade38cacb53', 'title': 'Architectural Design Method of Architectural Engineering', 'cluster': -1, 'distance': 0.6652883224407841}, {'paper_id': 'd330bde18c87', 'title': 'Languaging design methods', 'cluster': -1, 'distance': 0.8246360882503445}, {'paper_id': '0a373ca87142', 'title': 'Surveying a Landscape of Ethics-Focused Design Methods', 'cluster': -1, 'distance': 0.8249195262932707}, {'paper_id': '9fbb38d67689', 'title': 'Analysis of methods of creating new technical systems', 'cluster': -1, 'distance': 0.8559039629261094}, {'paper_id': '878cf959ac53', 'title': 'Designerly Research Methods and Researcherly Design Methods', 'cluster': -1, 'distance': 0.8585642917609101}]"
721f009574ce,On integration of interface design methods: Can debates be resolved?,Y. Lin; W. J. Zhang; R. J. Koubek; R. R. Mourant,"There have been many debates on how to design the human–computer interface (HCI). Often, one can find that different views in a debate are simply because these views are attached to different aspects which embody the same thing. In other words, prior to giving an effective judgment of a debate, one needs to establish an understanding of the ‘total’ aspects of a thing the debate is about. Following this line of thinking, in this paper, we propose an understanding of the ‘total’ aspects of designing HCI, which is called the total interface design framework. We then judge several debates under this framework with the purpose of exemplifying the judgment process for any other debate related to designing HCI. At the end, the debates used for exemplifying our judgment process can be resolved. The effectiveness of the total interface design framework for integrating the different HCI approaches is also demonstrated.",10.1016/j.intcom.2005.11.008,2006,,,Design methods,design_methods.csv,ieee|semantic_scholar,full,False,False,True,True,True,True,advance_criteria,True,"Proposes a 'total interface design framework' to integrate and reconcile HCI design method debates, synthesizing across views and offering its own framework definition.","Proposes a total interface design framework to integrate and judge debates among HCI design methods, suggesting synthesis of design-method perspectives, but whether it explicitly defines or adapts a design-knowledge construct is unclear from the abstract alone.",,0,Design methods,tfidf-svd,overall,hdbscan,-1,noise / outliers,8.752523,6.728627,,-1,True,-1,0,0.979054762966983,"service, product, dsr, virtual, step, methodology, focus methods, community",Noise / Outliers,These papers were not assigned to a dense DBSCAN cluster.,,,,,,"[{'paper_id': '66218ff443f6', 'title': 'Deliberated Evolution: Stalking the View Matcher in Design Space', 'cluster': -1, 'distance': 0.8585991812292115}, {'paper_id': '60c69d24c5a3', 'title': 'Evaluating the efficacy and effectiveness of design methods: A systematic review and assessment framework', 'cluster': -1, 'distance': 0.8818427540922174}, {'paper_id': 'bee7b59885fa', 'title': 'Adapting the FBS Model of Designing for Usage-Driven Innovation Processes', 'cluster': -1, 'distance': 0.8904408783119235}, {'paper_id': '885a1eee70e3', 'title': 'The Design of Business Models: What, How and Why', 'cluster': -1, 'distance': 0.8925639112069153}, {'paper_id': 'b2234ef79a5a', 'title': ""Tracing situated effects of innovative design methods: inexperienced designers' practices"", 'cluster': -1, 'distance': 0.8982204911157231}]"
