paper_id,title,authors,abstract,doi,year,venue,url,keyword,source_file,source_repos,abstract_quality,format_excluded,scope_excluded,c2,c3,fulltext_flag,c2_and_c3,disposition,advances_to_fulltext,primary_reason,val_reason,pdf_found,pdf_extract_method,full_text_chars,paragraph_count,matched_paragraph_count,discussion_found,discussion_paragraph_count,extraction_terms,keyword_conditioned_paragraph_count,focus_keyword,embedding_model,text_view,cluster_method,cluster,cluster_theme_terms,umap_x,umap_y,distance_to_centroid,representative_rank,is_representative_top3,medoid_rank,lda_topic,lda_topic_probability,lda_topic_words,cluster_label_candidate,cluster_summary_candidate,facet_population_or_context,facet_stakeholder_or_population,facet_method_or_lens,facet_artifact_or_domain,facet_contribution_or_outcome,nearest_papers
7fb79f6d2f73,"PEDAGOGICAL DESIGN: CONCEPT, PRINCIPLES, MODELS",G.М. Ussainova; V. I. Kazarenkov,"The article describes the issues of developing the learning process through digital technologies. The concept of"" pedagogical design"" is analyzed, the definitions given to this term are differentiated, and the basic principles are described. Several samples of foreign models necessary for the development of pedagogical design are given. In particular, the specific features and effectiveness of the ADDIE model in education are analyzed. A model of pedagogical design of a course consisting of 4 modules based on the ADDIE model is shown. Also, the pedagogical designer classifies the tasks to be solved and defines them. Reigeluth identifies three main characteristics that meet all the principles of pedagogical design theory. In the article, the concept of pedagogical design is considered, first of all, the creative activity of a teacher in creating, transforming and accompanying an information and educational environment in which the student is convenient to develop his psychological individual characteristics and achieve high results. And, secondly, this is the direction of pedagogical science associated with the study and development of strategies, learning scenarios and the creation of conditions for managing educational events with the help of various tools that ensure the mandatory achievement of the set goal with successful training. The article presents the structure and content of pedagogical design in the course of training from the author's point of view.",,2023,"МАТЕМАТИКАНЫ, ФИЗИКАНЫ ЖӘНЕ ИНФОРМАТИКАНЫ ОҚЫТУДЫҢ ӨЗЕКТІ МӘСЕЛЕЛЕРІ",https://www.semanticscholar.org/paper/1a8fe4b63d8b32fd0df817839f391b3a8d909fb4,Design theory,design_theory.csv,semantic_scholar,full,False,False,True,True,True,True,advance_criteria,True,"Analyzes the concept of pedagogical design, differentiates definitions, and describes principles/models, satisfying C2 and likely C3; flagged to confirm definitional adaptation.","The article analyzes and differentiates definitions of pedagogical design, describes principles, reviews models, and presents its own model, so it clearly synthesizes and defines design-related constructs.",False,,0,0,0,False,0,design knowledge; design expertise; design rationale; design pattern; design patterns; design principle; design principles; design guideline; design guidelines; design heuristic; design heuristics; design procedure; design procedures; design rule; design rules; design framework; design frameworks; design method; design methods; design theory,0,Design theory,tfidf-svd,method,kmeans,1,"decision, blended, curriculum, pedagogical, synchronous learning, computer, dss, calibration",5.9671135,-3.1638658,0.5536157796217283,6,False,6,6,0.9689600233715211,"method theory, product, concepts, decision, management, problem, course, theories",Design Science / Synchronous Learning / Decision,"This cluster focuses on Education / Learning, with contribution types coded as Theoretical, Methodological, Artifact/System.",Education / Learning,,,,"Theoretical, Methodological, Artifact/System","[{'paper_id': '9049c4d2bbec', 'title': 'Towards a design theory of blended learning curriculum', 'cluster': 1, 'distance': 0.5652182613437019}, {'paper_id': 'c0372ed4d123', 'title': 'Web-based information systems: Developing a design theory', 'cluster': 0, 'distance': 0.6737852410164188}, {'paper_id': '804431d6f285', 'title': 'Concepts and definitions for product recovery: Analysis and clarification of the terminology used in academia and industry', 'cluster': 6, 'distance': 0.7414177056437283}, {'paper_id': 'd2fba2826d90', 'title': 'Design Principles for Platform-Enabled Knowledge Commons with an Expository Instantiation', 'cluster': 2, 'distance': 0.7435305788448345}, {'paper_id': '92fd41483399', 'title': 'Design exemplars for synchronous e-learning: A design theory approach', 'cluster': 1, 'distance': 0.7685925550289223}]"
c1db52f69aae,Editorial: A Critical Look at Theories in Design Science Research,J. Iivari,"This editorial critically reviews design theories, kernel theories, and substantive technological theories in design science research (DSR) within information systems (IS). The review identifies four different but interrelated interpretations of “design theory” for the design product. In the case of kernel theories, it pays attention to the softening of their scientific status that undermines the status of design theories as well. Substantive technological theories refer to intermediating theories between abstract descriptive/explanatory kernel theories and design. The editorial suggests that DSR in IS (DSRIS) has great potential to contribute design-oriented, explanatory/predictive, substantive technological theories. Overall, the review illustrates excessive use of the word “theory” in DSR. This is in line with the alleged “theory fetish” of information systems.",,2020,Journal of the AIS,https://www.semanticscholar.org/paper/2ded85743bbacd8b2e71f387fbcaaf83d269d8eb,Design theory,design_theory.csv,semantic_scholar,full,False,False,True,True,False,True,advance_criteria,True,"Editorial critically reviews and distinguishes design theories, kernel theories, and substantive technological theories in DSR, synthesizing and defining these design-knowledge constructs from prior literature.","The editorial critically reviews and differentiates interpretations of design theory and related constructs in DSR, satisfying C2, but any explicit adapted or original definition for C3 is not clearly stated in the abstract.",False,,0,0,0,False,0,design knowledge; design expertise; design rationale; design pattern; design patterns; design principle; design principles; design guideline; design guidelines; design heuristic; design heuristics; design procedure; design procedures; design rule; design rules; design framework; design frameworks; design method; design methods; design theory,0,Design theory,tfidf-svd,method,kmeans,6,"theories, product, recovery, technique innovation, method theory, kernel, science, management",7.254645,-5.779668,0.1827985158423473,1,True,1,8,0.9709653189079357,"method theory, theories, science, methodology, engineering, management, practice, sonification",Design Science / Technique Innovation / Method Theory,"This cluster focuses on theories, product, involving Designers, using Design Science as the main methodological or conceptual lens, with contribution types coded as Theoretical, Artifact/System, Methodological.",,Designers,Design Science,,"Theoretical, Artifact/System, Methodological","[{'paper_id': '0bca44c18d6c', 'title': 'Tinkering, tailoring, and bricolage: Implications for theories of Design', 'cluster': 6, 'distance': 0.2491324000951849}, {'paper_id': 'c9175ef9ebfe', 'title': 'Management design theories', 'cluster': 6, 'distance': 0.39384754303340097}, {'paper_id': 'beaf258777e6', 'title': 'What is the value of design theory?', 'cluster': 6, 'distance': 0.5202582515752672}, {'paper_id': '103eb1a8586b', 'title': 'Incommensurability and multi-paradigm grounding in design science research: Implications for creating knowledge', 'cluster': 6, 'distance': 0.5850795134881586}, {'paper_id': 'fd05a25a5e94', 'title': 'Four Criteria for Design Theories', 'cluster': 6, 'distance': 0.6937987028392456}]"
79d31b954d2a,THE LOGICS OF DOUBLE PROOF IN PROOF OF CONCEPT: A DESIGN THEORY-BASED MODEL OF EXPERIMENTATION IN THE UNKNOWN,Caroline Jobin; S. Hooge; P. le Masson,"Abstract The literature on design distinguishes between exploration-based experimentation and validation-based experimentation. This typology relies on an assumption that exploration and validation cannot and should not be performed simultaneously in the same experimentation. By contrast, some practitioners, such as les Sismo, propose that proof of concept might combine these two logics. This raises the question of what design logic might enable this type of combination of exploration and validation. We first use design theory to build an experimentation design framework. This framework highlights a typology of proof logics in experimentation related to proof of the known and proof of the unknown. Second, we show that these proof models are supported by les Sismo's cases and describe a diversity of arrangements of exploration and validation mechanisms: sequential, parallel, and combinational. Through the formalisation of proof of concept as a double proof (proof of the known and proof of the unknown), we show that proof of concept can be more than a tool for the go/no-go decision by gradually validating propositions, questioning the relevance of propositions, and discovering new propositions to be investigated and tested.",,2021,Proceedings of the Design Society,https://www.semanticscholar.org/paper/2f013a55be5284205856b2e343329e282bcbdb09,Design theory,design_theory.csv,semantic_scholar,full,False,False,True,True,True,True,advance_criteria,True,"Uses design theory to distinguish and synthesize experimentation logics and build an experimentation design framework, satisfying C2 and plausibly defining constructs, warranting full-text review.","It uses design theory to build an experimentation design framework about proof-of-concept logics, which indicates synthesis/categorization of a design-knowledge construct, but any explicit adapted or original definition is not clear from the abstract alone.",False,,0,0,0,False,0,design knowledge; design expertise; design rationale; design pattern; design patterns; design principle; design principles; design guideline; design guidelines; design heuristic; design heuristics; design procedure; design procedures; design rule; design rules; design framework; design frameworks; design method; design methods; design theory,0,Design theory,tfidf-svd,method,kmeans,0,"method theory, space, humanism, concept, scale, software engineering, code, instructional",5.3916764,-4.0086417,0.6746837190983274,18,False,18,6,0.957137689336031,"method theory, product, concepts, decision, management, problem, course, theories",Design Science / Method Theory / Software Engineering,"This cluster focuses on Education / Learning, involving Designers, Practitioners, using Case Study as the main methodological or conceptual lens, with recurring attention to Tool, with contribution types coded as Theoretical, Methodological, Empirical.",Education / Learning,"Designers, Practitioners",Case Study,Tool,"Theoretical, Methodological, Empirical","[{'paper_id': '64230bcb1202', 'title': 'Chimera heuristics: Generative rational heuristics for the unknown from design theory', 'cluster': 1, 'distance': 0.6766965435768459}, {'paper_id': 'b21a9b4cc5ef', 'title': 'C-K design theory: an advanced formulation', 'cluster': 0, 'distance': 0.7508046336998958}, {'paper_id': '7fb79f6d2f73', 'title': 'PEDAGOGICAL DESIGN: CONCEPT, PRINCIPLES, MODELS', 'cluster': 1, 'distance': 0.7727583546045698}, {'paper_id': 'd250dc6eb9d9', 'title': 'Systems Thinking and Design Thinking: The Search for Principles in the World We Are Making', 'cluster': 0, 'distance': 0.8105636154268218}, {'paper_id': '6194ef223969', 'title': 'A typology of Urban Design theories and its application to the shared body of knowledge', 'cluster': 6, 'distance': 0.8198457689616168}]"
d2fba2826d90,Design Principles for Platform-Enabled Knowledge Commons with an Expository Instantiation,M. Ramakrishnan; Shirley Gregor; Anup Shrestha; J. Soar,"Knowledge commons play a pivotal role in knowledge creation and sharing in the digital economy.
The motivation for this research was the opportunity to develop a knowledge commons for IT service
management (ITSM) practitioners. To obtain guidance to design the knowledge commons, we
critically reviewed commons design principles (DPs) that were based on a well-established
economics theory. We observed that the commons DPs had significant gaps when applied to IS
practice. Hence, we developed an alternate set of DPs that we refer to as platform-enabled knowledge
commons (PEKC) DPs that are relevant to IS practice. This paper discusses the development of
PEKC DPs and applies them in instantiating an IS artifact, Service-Symphony. Service-Symphony is
a purpose-built, public-facing knowledge repository developed for the benefit of ITSM practitioners
and students. Our research followed the design science research (DSR) paradigm and contributes to
the body of knowledge by establishing a multigrounded design theory comprising meta-requirements
and DPs. To bridge theory and practice, we assessed the reusability of PEKC DPs through focus
group interviews with IS architects. Our case study illustrates the complete life cycle of DPs covering
conceptualization, initial formulation, iterative refinement, application to an important real-world
instantiation, and evaluation by a group of independent IS practitioners.",,2023,Journal of the AIS,https://www.semanticscholar.org/paper/3e67cd0d0c79603b5118e7a44b1153b4cd7553ad,Design theory,design_theory.csv,semantic_scholar,full,False,False,True,True,False,True,advance_criteria,True,"Critically reviews existing commons design principles and develops an alternate set of design principles, satisfying both C2 synthesis and C3 original definition/adaptation.","The paper critically reviews prior commons design principles and develops an alternate set of principles for platform-enabled knowledge commons, which satisfies synthesis/categorization, but an explicit definition of the construct is not clear from the abstract alone.",False,,0,0,0,False,0,design knowledge; design expertise; design rationale; design pattern; design patterns; design principle; design principles; design guideline; design guidelines; design heuristic; design heuristics; design procedure; design procedures; design rule; design rules; design framework; design frameworks; design method; design methods; design theory,0,Design theory,tfidf-svd,method,kmeans,2,"management, commons, digital, method theory, literature, review, pluralism, online communities",8.45434,-4.7719736,0.5193105875065578,5,False,5,8,0.8071303508887088,"method theory, theories, science, methodology, engineering, management, practice, sonification",Value-Sensitive Design / Method Theory / Online Communities,"This cluster focuses on Privacy / Security, involving Designers, using Design Science, Case Study as the main methodological or conceptual lens, with contribution types coded as Theoretical, Methodological, Artifact/System.",Privacy / Security,Designers,"Design Science, Case Study",,"Theoretical, Methodological, Artifact/System","[{'paper_id': '288676f720a1', 'title': 'A design theory for digital platforms supporting online communities: a multiple case study', 'cluster': 2, 'distance': 0.6661375035103461}, {'paper_id': '0ecb6c9b7eeb', 'title': 'Pluralism in Knowledge Management: a Review', 'cluster': 2, 'distance': 0.6991622655835645}, {'paper_id': '2c8a6e74557f', 'title': 'The tacit knowledge of entrepreneurial design: Interrelating theory, practice and prescription in entrepreneurship research', 'cluster': 0, 'distance': 0.7371668893104877}, {'paper_id': '7fb79f6d2f73', 'title': 'PEDAGOGICAL DESIGN: CONCEPT, PRINCIPLES, MODELS', 'cluster': 1, 'distance': 0.7435305788448345}, {'paper_id': '41443180c5b4', 'title': 'Service Ecosystem Design: Propositions, Process Model, and Future Research Agenda', 'cluster': 3, 'distance': 0.7476053196059897}]"
68bf6cd63875,Design epistemology as innovation in public health research,A. Estany,"The idea of design has reached our theories of epistemology: a field that, at first glance, seems to be quite far removed from the analysis of practical situations. However, we should bear in mind that epistemology has shifted from an a priori perspective to a naturalized one, in the sense that we cannot engage in epistemology without taking into account the empirical results of science when it comes to configuring methodological models. The objective is to explore just how far design epistemology (DE) can be adopted as a methodological framework for research in biomedical sciences and in some of their applications as public health. To this end, we will analyze different approaches to DE and related terms and expressions such as “design thinking”, “design theory” and “designedly ways of knowing”. One of the issues that we need to address is precisely the polysemy that exists in the field of design, related to many different concepts. Thus, it seems impossible not to engage in a certain amount of conceptual analysis before we can embark on the study of the role of DE in public health research. Another of the questions that we will consider here is where to place biomedical sciences within the field of academic knowledge and research. The disciplines involved in this field of research range from biology to medicine and also to the applications of these knowledges, as in the case of public health. We will examine some of the definitions provided by international organizations and we will locate public health within the framework of healthcare services and their organization. Finally, we will see how DE can offer proposals and solutions to the challenges that a phenomenon as complex as public health currently faces. That is, we will measure up DE proposals against public health research needs.",,2020,,https://www.semanticscholar.org/paper/49d0d80cace9913bdeabbd7376508b67572245a8,Design theory,design_theory.csv,semantic_scholar,full,False,False,True,True,True,True,advance_criteria,True,"Explicitly explores design epistemology as a methodological framework, likely defining/adapting the construct; flagged to confirm C2/C3 in full text.","The paper studies ethical design theory and creative design activity and may adapt or define a construct such as generative ethics, but the abstract is too vague to confirm C2 or C3 without the full text.",False,,0,0,0,False,0,design knowledge; design expertise; design rationale; design pattern; design patterns; design principle; design principles; design guideline; design guidelines; design heuristic; design heuristics; design procedure; design procedures; design rule; design rules; design framework; design frameworks; design method; design methods; design theory,0,Design theory,tfidf-svd,method,kmeans,3,"framing, service, problem, actors, taking, interstitial, social, account",7.4358487,-2.9246876,0.6484875631567101,7,False,7,8,0.9362705162752529,"method theory, theories, science, methodology, engineering, management, practice, sonification",Framing / Service / Problem,"This cluster focuses on framing, service, with contribution types coded as Theoretical, Methodological, Empirical.",,,,,"Theoretical, Methodological, Empirical","[{'paper_id': '3f7b5dc9fc40', 'title': 'Concerning the Epistemology of Design: The Role of the Eco-Cognitive Model of Abduction in Pragmatism', 'cluster': 0, 'distance': 0.44439544750492876}, {'paper_id': '554b27236356', 'title': 'Technique Innovation', 'cluster': 6, 'distance': 0.781792318449716}, {'paper_id': '0bca44c18d6c', 'title': 'Tinkering, tailoring, and bricolage: Implications for theories of Design', 'cluster': 6, 'distance': 0.7971231655816694}, {'paper_id': 'a1a2a51ae22e', 'title': 'Incommensurability in design science: Which comes first-Theory or artefact?', 'cluster': 0, 'distance': 0.8064313983242601}, {'paper_id': 'ceac90427122', 'title': 'Design-oriented human-computer interaction', 'cluster': 1, 'distance': 0.86199333791782}]"
fd05a25a5e94,Four Criteria for Design Theories,P. Hodges; Stan Ruecker; C. Scaletsky; Jaime Rivera; R. Faller; A. Geppert,"Abstract The goal of this paper is to demonstrate that the adoption of the four criteria we outline will strengthen future design theories and encourage existing design theories to expand or reconfigure in useful directions. We propose four criteria for design theory creation and evaluation. These are (1) the theory should have substantial design applications, and be applicable to any topic; (2) the theory should use propositions—if-then language—as a way of describing, explaining, and predicting actual and existing aspects of designing; (3) where appropriate, a new theory should accept and adopt propositions and language contained in other design theories; and (4) the theory should accommodate, or at least acknowledge, generative activity. We are not proposing a new general design theory—this paper outlines a strong approach to studying and building theory. Please also note that this essay does not pretend to exhaust a topic that has been discussed for at least the last 50 years.",,2017,,https://www.semanticscholar.org/paper/4c0eb75439b4fdadc1743f7ff41d8e9adb2c7eb8,Design theory,design_theory.csv,semantic_scholar,full,False,False,True,True,False,True,advance_criteria,True,"Proposes and synthesizes criteria for design theory creation and evaluation, treating design theory as the topic and defining what design theories should be, satisfying C2 and C3.","The paper appears to articulate evaluative criteria for design theories as a design-knowledge topic, but the truncated abstract does not clearly show a synthesis from prior literature or an explicit definition, so full text is needed.",False,,0,0,0,False,0,design knowledge; design expertise; design rationale; design pattern; design patterns; design principle; design principles; design guideline; design guidelines; design heuristic; design heuristics; design procedure; design procedures; design rule; design rules; design framework; design frameworks; design method; design methods; design theory,0,Design theory,tfidf-svd,method,kmeans,6,"theories, product, recovery, technique innovation, method theory, kernel, science, management",7.078702,-5.924311,0.5419904624746718,7,False,7,8,0.9718713802026866,"method theory, theories, science, methodology, engineering, management, practice, sonification",Design Science / Technique Innovation / Method Theory,"This cluster focuses on theories, product, involving Designers, using Design Science as the main methodological or conceptual lens, with contribution types coded as Theoretical, Artifact/System, Methodological.",,Designers,Design Science,,"Theoretical, Artifact/System, Methodological","[{'paper_id': 'c1db52f69aae', 'title': 'Editorial: A Critical Look at Theories in Design Science Research', 'cluster': 6, 'distance': 0.6937987028392456}, {'paper_id': 'c9175ef9ebfe', 'title': 'Management design theories', 'cluster': 6, 'distance': 0.7188834822254271}, {'paper_id': '83d1ebe7d6c0', 'title': 'Design Theory in Information Systems', 'cluster': 0, 'distance': 0.7397534226600657}, {'paper_id': 'c2c57ac5453e', 'title': 'Theory construction in design research. Criteria, approaches, and methods.', 'cluster': 6, 'distance': 0.7541859482653501}, {'paper_id': 'beaf258777e6', 'title': 'What is the value of design theory?', 'cluster': 6, 'distance': 0.7789367601973367}]"
