paper_id,title,authors,abstract,doi,year,venue,url,keyword,source_file,source_repos,abstract_quality,format_excluded,scope_excluded,c2,c3,fulltext_flag,c2_and_c3,disposition,advances_to_fulltext,primary_reason,val_reason,pdf_found,pdf_extract_method,full_text_chars,paragraph_count,matched_paragraph_count,discussion_found,discussion_paragraph_count,extraction_terms,keyword_conditioned_paragraph_count,focus_keyword,embedding_model,text_view,cluster_method,cluster,cluster_theme_terms,umap_x,umap_y,distance_to_centroid,representative_rank,is_representative_top3,medoid_rank,lda_topic,lda_topic_probability,lda_topic_words,cluster_label_candidate,cluster_summary_candidate,facet_population_or_context,facet_stakeholder_or_population,facet_method_or_lens,facet_artifact_or_domain,facet_contribution_or_outcome,nearest_papers
bacdc4f76eea,Work system principles: towards a justified design theory on the grounds of socio-instrumental pragmatism,"Petersson, Johan","The aim of the paper is to explore a possible theoretical foundation for the `work system approach'. The concept of work systems has been suggested as the core object of study in the field of information systems. The scope of the work system approach is determined by pragmatic relevance and high comprehensibility, with the goal of being applicable for professionals in both IT and business as well as IS researchers. This approach has, however, been criticized for having theoretical shortcomings. In this paper, a theoretical foundation is suggested and explored by relating it to work practice theory and its roots in socio-instrumental pragmatism. The results show that it is both possible and fruitful to ground the work system approach theoretically in socio-instrumental actions.",10.1145/1479190.1479200,2008,Proceedings of the 3rd International Conference on the Pragmatic Web: Innovating the Interactive Society,https://doi.org/10.1145/1479190.1479200,Design theory,design_theory.bib,acm|engineering_village|semantic_scholar,full,False,False,True,True,True,True,advance_criteria,True,"Explores and develops a theoretical foundation for the work system design theory drawing on prior work and socio-instrumental pragmatism, treating design theory as the object of study and proposing its own justification.","The paper appears to theorize work system principles as a foundation for the work system approach, but the truncated abstract does not clearly confirm a synthesis from prior literature or an explicit definition, so full text is needed.",True,pdfplumber,39748,27,10,False,0,design knowledge; design expertise; design rationale; design pattern; design patterns; design principle; design principles; design guideline; design guidelines; design heuristic; design heuristics; design procedure; design procedures; design rule; design rules; design framework; design frameworks; design method; design methods; design theory,8,Design theory,tfidf-svd,method,kmeans,4,"methodology, conceptual, ecc, mechanical, game, theoretical, military, method theory",5.9902477,-4.893227,0.5574096957704555,6,False,6,7,0.9769213014905282,"method theory, architecture, cognitive, characteristics, theoretical, literature, scientists, fields",Method Theory / Methodology / Conceptual,"This cluster focuses on methodology, conceptual, with recurring attention to Game, with contribution types coded as Theoretical, Methodological, Artifact/System.",,,,Game,"Theoretical, Methodological, Artifact/System","[{'paper_id': '056ae4e01610', 'title': 'Beyond the old game design: a new design paradigm in Game Studies through C-K Theory', 'cluster': 4, 'distance': 0.6628695032976344}, {'paper_id': '6ecb18a5b139', 'title': 'TO THE PROBLEM OF FORMING THE CATEGORIAL AND CONCEPTUAL APPARATUS OF THE COURSE “HISTORY AND METHODOLOGY OF DESIGN DESIGN”', 'cluster': 4, 'distance': 0.7609457536566108}, {'paper_id': 'af66a447ca7c', 'title': 'Digital Panopticon: How Remote Work Monitoring Shapes Employee Behavior and Motivation', 'cluster': 2, 'distance': 0.7658713754082952}, {'paper_id': 'c0372ed4d123', 'title': 'Web-based information systems: Developing a design theory', 'cluster': 0, 'distance': 0.7697982833988125}, {'paper_id': '83d1ebe7d6c0', 'title': 'Design Theory in Information Systems', 'cluster': 0, 'distance': 0.7909387967752468}]"
dc61c8a1dcd6,Multiscale Design Strategies in a Landscape Architecture Classroom,"Lupfer, Nic and Fowler, Hannah and Valdez, Alyssa and Webb, Andrew and Merrill, Jeremy and Newman, Galen and Kerne, Andruid","We derive a theory of multiscale design through a study of a landscape architecture studio classroom. We find that processes of designing, to meet a site's situated needs, involve creating and connecting representations across levels, such as overview and detail. We introduce multiscale design theory, which works to understand how designers explore, juxtapose, and synthesize relationships across levels of scale. We identify three design strategies landscape architecture students use to work with scale: multiply, map, and shift perspective. We combine these strategies with prior literature, across fields, to initiate a theory of multiscale design.",10.1145/3196709.3196812,2018,Proceedings of the 2018 Designing Interactive Systems Conference,https://doi.org/10.1145/3196709.3196812,Design theory,design_theory.bib,acm|semantic_scholar,full,False,False,True,True,True,True,advance_criteria,True,"Derives multiscale design theory from a study and combines strategies with prior literature, introducing its own theory/definition of design strategies, plausibly satisfying C2 and C3.","It derives and introduces a theory of multiscale design, identifies design strategies, and combines them with prior literature, indicating both synthesis from existing work and an original definitional/theoretical contribution.",True,pdfplumber,19799,16,6,False,0,design knowledge; design expertise; design rationale; design pattern; design patterns; design principle; design principles; design guideline; design guidelines; design heuristic; design heuristics; design procedure; design procedures; design rule; design rules; design framework; design frameworks; design method; design methods; design theory,4,Design theory,tfidf-svd,method,kmeans,0,"method theory, space, humanism, concept, scale, software engineering, code, instructional",7.551153,-4.104791,0.6730276138192803,16,False,16,6,0.9639951032518509,"method theory, product, concepts, decision, management, problem, course, theories",Design Science / Method Theory / Software Engineering,"This cluster focuses on Education / Learning, involving Designers, Practitioners, using Case Study as the main methodological or conceptual lens, with recurring attention to Tool, with contribution types coded as Theoretical, Methodological, Empirical.",Education / Learning,"Designers, Practitioners",Case Study,Tool,"Theoretical, Methodological, Empirical","[{'paper_id': '363ca9685308', 'title': 'Cognitive Architecture and Instructional Design: 20 Years Later', 'cluster': 0, 'distance': 0.5807675978757871}, {'paper_id': '2c8a6e74557f', 'title': 'The tacit knowledge of entrepreneurial design: Interrelating theory, practice and prescription in entrepreneurship research', 'cluster': 0, 'distance': 0.7073128108593771}, {'paper_id': '056ae4e01610', 'title': 'Beyond the old game design: a new design paradigm in Game Studies through C-K Theory', 'cluster': 4, 'distance': 0.7858085437656566}, {'paper_id': '5b52ec143fa6', 'title': 'The ECC Methodology for Architecture Design Theory and Practices Research', 'cluster': 4, 'distance': 0.7949969882215926}, {'paper_id': '4025e28730c1', 'title': 'Conceptual foundations of design problem solving', 'cluster': 2, 'distance': 0.8141198222181784}]"
a21900f84443,Undesigning technology: considering the negation of design by design,"Pierce, James","Motivated by substantive concerns with the limitations and negative effects of technology, this paper inquires into the negation of technology as an explicit and intentional aspect of design research within HCI. Building on theory from areas including philosophy and design theory, this paper articulates a theoretical framework for conceptualizing the intentional negation of technology (i.e., the undesign of technology), ranging from the inhibition of particular uses of technology to the total erasure or foreclosure of technology. The framework is then expanded upon to articulate additional areas of undesigning, including self-inhibition, exclusion, removal, replacement, restoration, and safeguarding. In conclusion a scheme is offered for addressing questions concerning the disciplinary scope of undesign in the context of HCI, along with suggestions for ways that undesigning may be more strongly incorporated within HCI research.",10.1145/2207676.2208540,2012,Proceedings of the SIGCHI Conference on Human Factors in Computing Systems,https://doi.org/10.1145/2207676.2208540,Design theory,design_theory.bib,acm,full,False,False,True,True,True,True,advance_criteria,True,"Articulates a theoretical framework for undesign building on design theory, plausibly defining/conceptualizing a design construct; flagged to confirm synthesis and definition in full text.","This longitudinal case study examines what evidence novice designers use to justify decisions, which plausibly relates to design rationale and knowledge in practice, but the abstract does not clearly show synthesis or explicit definition.",True,pdfplumber,48804,32,10,False,0,design knowledge; design expertise; design rationale; design pattern; design patterns; design principle; design principles; design guideline; design guidelines; design heuristic; design heuristics; design procedure; design procedures; design rule; design rules; design framework; design frameworks; design method; design methods; design theory,6,Design theory,tfidf-svd,method,kmeans,6,"theories, product, recovery, technique innovation, method theory, kernel, science, management",6.1418,-5.4794617,0.6883050682655034,9,False,9,8,0.9653816689956889,"method theory, theories, science, methodology, engineering, management, practice, sonification",Design Science / Technique Innovation / Method Theory,"This cluster focuses on theories, product, involving Designers, using Design Science as the main methodological or conceptual lens, with contribution types coded as Theoretical, Artifact/System, Methodological.",,Designers,Design Science,,"Theoretical, Artifact/System, Methodological","[{'paper_id': '03fd54829f02', 'title': 'Digisprudence: the design of legitimate code', 'cluster': 0, 'distance': 0.6308365779869451}, {'paper_id': '0bca44c18d6c', 'title': 'Tinkering, tailoring, and bricolage: Implications for theories of Design', 'cluster': 6, 'distance': 0.7164738043227932}, {'paper_id': 'ceac90427122', 'title': 'Design-oriented human-computer interaction', 'cluster': 1, 'distance': 0.7177349359014467}, {'paper_id': '02f3ae017acb', 'title': 'Design Theory and Method of Complex Products: A Review', 'cluster': 0, 'distance': 0.7763680301669621}, {'paper_id': '1728dd2afe4b', 'title': 'Design theory in practice – Making design science research more transparent', 'cluster': 6, 'distance': 0.795825455190291}]"
ceac90427122,Design-oriented human-computer interaction,"Fallman, Daniel","We argue that HCI has emerged as a design-oriented field of research, directed at large towards innovation, design, and construction of new kinds of information and interaction technology. But the understanding of such an attitude to research in terms of philosophical, theoretical, and methodological underpinnings seems however relatively poor within the field. This paper intends to specifically address what design 'is' and how it is related to HCI. First, three candidate accounts from design theory of what design 'is' are introduced; the conservative, the romantic, and the pragmatic. By examining the role of sketching in design, it is found that the designer becomes involved in a necessary dialogue, from which the design problem and its solution are worked out simultaneously as a closely coupled pair. In conclusion, it is proposed that we need to acknowledge, first, the role of design in HCI conduct, and second, the difference between the knowledge-generating Design-oriented Research and the artifact-generating conduct of Research-oriented Design.",10.1145/642611.642652,2003,Proceedings of the SIGCHI Conference on Human Factors in Computing Systems,https://doi.org/10.1145/642611.642652,Design theory,design_theory.bib,acm|engineering_village,full,False,False,True,True,True,True,advance_criteria,True,"Examines what design 'is' for HCI, introduces and synthesizes candidate accounts from design theory and relates them to HCI, satisfying C2 and likely C3.","The abstract compares four underlying models of design expertise and brings in themes from wider expertise literature toward an integrative approach, indicating synthesis of design-expertise constructs from prior work, but any explicit definition or adaptation is not clear from the abstract alone.",True,pdfplumber,44058,29,10,False,0,design knowledge; design expertise; design rationale; design pattern; design patterns; design principle; design principles; design guideline; design guidelines; design heuristic; design heuristics; design procedure; design procedures; design rule; design rules; design framework; design frameworks; design method; design methods; design theory,6,Design theory,tfidf-svd,method,kmeans,1,"decision, blended, curriculum, pedagogical, synchronous learning, computer, dss, calibration",6.6801567,-2.4911861,0.68251069753463,9,False,9,5,0.962495782744493,"method theory, games, computer, need, theoretical, address, field, directed",Design Science / Synchronous Learning / Decision,"This cluster focuses on Education / Learning, with contribution types coded as Theoretical, Methodological, Artifact/System.",Education / Learning,,,,"Theoretical, Methodological, Artifact/System","[{'paper_id': 'a21900f84443', 'title': 'Undesigning technology: considering the negation of design by design', 'cluster': 6, 'distance': 0.7177349359014467}, {'paper_id': '554b27236356', 'title': 'Technique Innovation', 'cluster': 6, 'distance': 0.7355142182217393}, {'paper_id': 'd19f5f66d2ba', 'title': 'A Survey of Definition and its Role in Strengthening Design Theory', 'cluster': 0, 'distance': 0.761151256284978}, {'paper_id': '0a130c0971e9', 'title': 'Feedforward as an essential active principle of engagement in computer games', 'cluster': 1, 'distance': 0.7853552904838912}, {'paper_id': 'c0372ed4d123', 'title': 'Web-based information systems: Developing a design theory', 'cluster': 0, 'distance': 0.7937363359413678}]"
8abe5ed83bac,"DESIGN PROCESS: FRAMES, METAPHORS, AND GAMES.","Lanzara, Giovan Francesco (1)","A perspective on the design process is here presented and discussed emphasizing design as a problem-setting activity. It is argued that the functional analysis and the problem-solving models of design do not give account of some of the most crucial aspects of a designer's work. Design is here considered to be a process of creative inquiry taking place through transactions and conversations among multiple social actors in cooperative or competitive situations. Cognitive activities such as framing, evoking, metaphor-making, and behavioral strategies such as bargaining, concerting, reconciling, transacting are shown to be relevant to a sound design theory and practice.",,1983,,,Design theory,design_theory.csv,engineering_village,full,False,False,True,True,True,True,advance_criteria,True,"Presents and discusses a perspective on the design process as problem-setting, framing design knowledge as the topic and offering its own conceptualization; flagged to confirm synthesis/definition in full text.","This appears to be a conceptual/theoretical discussion of design as problem-setting involving frames, metaphors, and games, but the abstract does not clearly show a synthesis from prior literature or an explicit definition, so full text is needed.",False,,0,0,0,False,0,design knowledge; design expertise; design rationale; design pattern; design patterns; design principle; design principles; design guideline; design guidelines; design heuristic; design heuristics; design procedure; design procedures; design rule; design rules; design framework; design frameworks; design method; design methods; design theory,0,Design theory,tfidf-svd,method,kmeans,3,"framing, service, problem, actors, taking, interstitial, social, account",7.9981112,-3.4875336,0.23563971014037777,1,True,1,9,0.9881572942196347,"problem, method theory, inquiry, multiple, solving, situations, account, aspects",Framing / Service / Problem,"This cluster focuses on framing, service, with contribution types coded as Theoretical, Methodological, Empirical.",,,,,"Theoretical, Methodological, Empirical","[{'paper_id': '74beefd3ed50', 'title': 'The design process: frames, metaphors, and games', 'cluster': 3, 'distance': 0.0014954510492096729}, {'paper_id': 'c3005cf4cf75', 'title': 'Design as interactions of problem framing and problem solving', 'cluster': 3, 'distance': 0.7659027309727333}, {'paper_id': '85c3a6761bcc', 'title': 'Designing Process Guidance Systems', 'cluster': 3, 'distance': 0.8105762269849439}, {'paper_id': '20f56bbbd10c', 'title': '2. Interstitial Design Processes: How Design Thinking and Social Design Processes Bridge Theory and Practice in TPC Pedagogy', 'cluster': 3, 'distance': 0.8801868032595471}, {'paper_id': '68bf6cd63875', 'title': 'Design epistemology as innovation in public health research', 'cluster': 3, 'distance': 0.8839397754231485}]"
74beefd3ed50,"The design process: frames, metaphors, and games","Lanzara, G.F. (1)","A perspective on the design process is here presented and discussed which emphasizes design as a problem-setting activity. It is argued that the functional analysis and the problem-solving models of design do not give account of some of the most crucial aspects of a designer's work. Design is here considered to be a process of creative inquiry taking place through transactions and conversations among multiple social actors in cooperative or competitive situations. Cognitive activities such as framing, evoking, metaphor-making, and behavioral strategies such as bargaining, converting, reconciling, transacting are shown to be relevant to a sound design theory and practice.",,,"Systems Design For, With and By the Users. Proceedings of the IFIP WG9.1 Working Conference",,Design theory,design_theory.csv,engineering_village,full,False,False,True,True,True,True,advance_criteria,True,"Discusses and synthesizes perspectives on the design process (framing, metaphor-making), treating design knowledge/process as the topic of study and offering a definitional view of design, satisfying C2 and plausibly C3.","It explicitly reviews four categories of models of motivational design and related strategies, principles, and processes from prior work, satisfying C2, but no clear definition or adapted definition is stated in the abstract.",False,,0,0,0,False,0,design knowledge; design expertise; design rationale; design pattern; design patterns; design principle; design principles; design guideline; design guidelines; design heuristic; design heuristics; design procedure; design procedures; design rule; design rules; design framework; design frameworks; design method; design methods; design theory,0,Design theory,tfidf-svd,method,kmeans,3,"framing, service, problem, actors, taking, interstitial, social, account",7.908716,-3.3365088,0.24562919542450956,2,True,2,9,0.9879993702692216,"problem, method theory, inquiry, multiple, solving, situations, account, aspects",Framing / Service / Problem,"This cluster focuses on framing, service, with contribution types coded as Theoretical, Methodological, Empirical.",,,,,"Theoretical, Methodological, Empirical","[{'paper_id': '8abe5ed83bac', 'title': 'DESIGN PROCESS: FRAMES, METAPHORS, AND GAMES.', 'cluster': 3, 'distance': 0.0014954510492096729}, {'paper_id': '85c3a6761bcc', 'title': 'Designing Process Guidance Systems', 'cluster': 3, 'distance': 0.8059972361278472}, {'paper_id': 'c3005cf4cf75', 'title': 'Design as interactions of problem framing and problem solving', 'cluster': 3, 'distance': 0.8169973556720946}, {'paper_id': '20f56bbbd10c', 'title': '2. Interstitial Design Processes: How Design Thinking and Social Design Processes Bridge Theory and Practice in TPC Pedagogy', 'cluster': 3, 'distance': 0.8748943433517873}, {'paper_id': '68bf6cd63875', 'title': 'Design epistemology as innovation in public health research', 'cluster': 3, 'distance': 0.8792998490026125}]"
ec380d04cf61,GENERAL DESIGN THEORY.,"Yoshikawa, Hiroyuki (1); Tomiyama, Tetsuo (1); Kumazawa, Masami (1)","General design theory aims at elucidating the designer's designing process. A set-theoretical theory has been proposed, and recently the properties of the concept set was investigated. The theory was extended by giving restriction on the set, that is compactized by a newly proposed topology. The new topology was estimated as a set of concept conducted by physical laws which man established through experience.",,1985,"Journal of the Faculty of Engineering, the University of Tokyo, Series A",,Design theory,design_theory.csv,engineering_village,full,False,False,True,True,True,True,advance_criteria,True,"General design theory explicitly aims to elucidate the designer's design process and proposes/extends a formal theory of design, addressing design knowledge as its topic.","The paper discusses the status and implications of instructional design theory for authoring systems, suggesting possible engagement with design-theory constructs, but the abstract does not clearly establish a synthesis or explicit definition from title and abstract alone.",False,,0,0,0,False,0,design knowledge; design expertise; design rationale; design pattern; design patterns; design principle; design principles; design guideline; design guidelines; design heuristic; design heuristics; design procedure; design procedures; design rule; design rules; design framework; design frameworks; design method; design methods; design theory,0,Design theory,tfidf-svd,method,kmeans,0,"method theory, space, humanism, concept, scale, software engineering, code, instructional",5.245149,-4.531215,0.5950791690612718,7,False,7,2,0.9699973560251504,"concept, method theory, meta, theoretical, existing, typology, conceptual, article",Design Science / Method Theory / Software Engineering,"This cluster focuses on Education / Learning, involving Designers, Practitioners, using Case Study as the main methodological or conceptual lens, with recurring attention to Tool, with contribution types coded as Theoretical, Methodological, Empirical.",Education / Learning,"Designers, Practitioners",Case Study,Tool,"Theoretical, Methodological, Empirical","[{'paper_id': 'a285258b5545', 'title': 'Extended general design theory. I. Compactification of concept space', 'cluster': 0, 'distance': 0.3407421483600892}, {'paper_id': 'f0dd2d28f3d2', 'title': 'Research methods for design theory', 'cluster': 0, 'distance': 0.7353497246144981}, {'paper_id': 'f652405808cb', 'title': 'A Theory of Decision Support System Design for User Calibration', 'cluster': 1, 'distance': 0.7531305340024755}, {'paper_id': 'beaf258777e6', 'title': 'What is the value of design theory?', 'cluster': 6, 'distance': 0.7554308666809009}, {'paper_id': '7fb79f6d2f73', 'title': 'PEDAGOGICAL DESIGN: CONCEPT, PRINCIPLES, MODELS', 'cluster': 1, 'distance': 0.8093800569935875}]"
