paper_id,title,authors,abstract,doi,year,venue,url,keyword,source_file,source_repos,abstract_quality,format_excluded,scope_excluded,c2,c3,fulltext_flag,c2_and_c3,disposition,advances_to_fulltext,primary_reason,val_reason,pdf_found,pdf_extract_method,full_text_chars,paragraph_count,matched_paragraph_count,discussion_found,discussion_paragraph_count,extraction_terms,keyword_conditioned_paragraph_count,focus_keyword,embedding_model,text_view,cluster_method,cluster,cluster_theme_terms,umap_x,umap_y,distance_to_centroid,representative_rank,is_representative_top3,medoid_rank,lda_topic,lda_topic_probability,lda_topic_words,cluster_label_candidate,cluster_summary_candidate,facet_population_or_context,facet_stakeholder_or_population,facet_method_or_lens,facet_artifact_or_domain,facet_contribution_or_outcome,nearest_papers
0bca44c18d6c,"Tinkering, tailoring, and bricolage: Implications for theories of Design","Hovorka, Dirk S. (1); Germonprez, Matt (2)","Current structural specifications for design theory and guidelines for Design Science fall short of creating theories that account for user tinkering, secondary design tailoring, and the interactions of supporting kernel theories. This paper offers an expansion of design theory conceptualization by incorporating aspects of design which occur in everyday technology use. Currently, design theory is focused solely on the artifact while obscuring the teleological information processes for which they are designed. We propose the addition of environments which can organize kernel theories and provide insight regarding interaction and influence of kernel theory in different use contexts. In addition, the modification of information artifacts and processes as users tinker with, and tailor systems is a necessary aspect of design theory specifications.",,2009,"15th Americas Conference on Information Systems 2009, AMCIS 2009",,Design theory,design_theory.csv,engineering_village,full,False,False,True,True,False,True,advance_criteria,True,"Explicitly expands and reconceptualizes design theory and Design Science specifications, treating design theory as its topic and proposing its own expanded conceptualization, satisfying C2 and C3.","The paper appears to reconceptualize design theory by proposing additions to its structure, but the abstract does not clearly show a synthesis from prior literature or an explicit definition, so full text is needed.",False,,0,0,0,False,0,design knowledge; design expertise; design rationale; design pattern; design patterns; design principle; design principles; design guideline; design guidelines; design heuristic; design heuristics; design procedure; design procedures; design rule; design rules; design framework; design frameworks; design method; design methods; design theory,0,Design theory,tfidf-svd,method,kmeans,6,"theories, product, recovery, technique innovation, method theory, kernel, science, management",7.032964,-5.382341,0.2803673976595671,2,True,2,8,0.9678543868262147,"method theory, theories, science, methodology, engineering, management, practice, sonification",Design Science / Technique Innovation / Method Theory,"This cluster focuses on theories, product, involving Designers, using Design Science as the main methodological or conceptual lens, with contribution types coded as Theoretical, Artifact/System, Methodological.",,Designers,Design Science,,"Theoretical, Artifact/System, Methodological","[{'paper_id': 'c1db52f69aae', 'title': 'Editorial: A Critical Look at Theories in Design Science Research', 'cluster': 6, 'distance': 0.2491324000951849}, {'paper_id': '103eb1a8586b', 'title': 'Incommensurability and multi-paradigm grounding in design science research: Implications for creating knowledge', 'cluster': 6, 'distance': 0.47553190205829565}, {'paper_id': '1728dd2afe4b', 'title': 'Design theory in practice – Making design science research more transparent', 'cluster': 6, 'distance': 0.6383797253166965}, {'paper_id': '9f9f7295ec8c', 'title': 'Affordance based design: a relational theory for design', 'cluster': 2, 'distance': 0.6516654536571792}, {'paper_id': 'c0372ed4d123', 'title': 'Web-based information systems: Developing a design theory', 'cluster': 0, 'distance': 0.6768761844299069}]"
0ecb6c9b7eeb,Pluralism in Knowledge Management: a Review,"Sheffield, J. (1)","The purpose of this article is to review the role of simultaneous application of multiple perspectives, or pluralism, in knowledge management, and to describe theoretical frameworks that support pluralism. Pluralism is defined as support for all three of the systems perspectives - hard, soft, and critical - that are implicit in the popular Davenport and Prusak (1998) definition of knowledge. These perspectives are associated with research paradigms (positivist, interpretivist, pluralist) and knowledge perspectives (application, normalization, creation). A case study of coordinating work in a hospital is reviewed to illustrate the role played by pluralistic approaches in knowledge management. A literature search is conducted to find frameworks that support pluralism. The findings are as follow. In the hospital case study the introduction of a patient record system (hard system) was the occasion for changes to both coordination (soft systems) and power relations (critical systems). Facts, norms and feelings are intertwined. While the electronic tool by itself is neutral in the face of power relations, its use in organisations is not. In this case at least, a holistic and pluralistic approach to knowledge management is required. In the search for frameworks to support pluralism, more than 50 frameworks from the general knowledge management literature are identified. Of the eight selected for further study, three are found to be pluralistic. These three - critical systems, scientific discourses, and Habermasian inquiry - share common characteristics. All three recognise that conflict is the precondition to knowledge creation, and that power relations, value commitments, and ethics are central to knowledge management. It is concluded that the knowledge management literature as a whole favours a single systems perspective (hard systems); a single research paradigm (positivism, focusing on objective facts); and a single knowledge management domain (knowledge application). This singular (non-pluralistic) approach produces theories about knowledge that has already emerged. Yet the Davenport and Prusak (1998) definition of knowledge and the hospital case study include two other perspectives - soft systems and critical systems - that focus on the organizational and individual aspects of emergence, respectively. In practice, knowledge management must address the need to simultaneously solve technical problems, resolve interpersonal issues, and dissolve personal conflict. The contribution of the paper is the comparison of knowledge management frameworks on the basis of underlying system perspectives, and the identification, description, and application of some pluralistic frameworks. Each systems perspective constitutes a different discourse on the purposes served by knowledge management, and pluralisms are required to integrate them. Pluralisms constitute both a framework for inquiry in knowledge management and a design theory for collaborative technologies. The review is not exhaustive. It is beyond the scope of this paper to examine the link between the purposes served by knowledge management and the methodology required for development. The paper contributes to the literature that seeks to understand the complexity of knowledge management practice via 'awareness of the potential and the implications of the different discourses in the study of knowledge and knowledge management'.",,,Electronic Journal of Knowledge Management,,Design theory,design_theory.csv,engineering_village,full,False,False,True,True,True,True,advance_criteria,True,"Reviews knowledge management perspectives and defines pluralism from prior frameworks; may relate to design knowledge constructs, flagged for full-text confirmation.",This review explicitly synthesizes theoretical frameworks for pluralism in knowledge management and also states a definition of pluralism in relation to knowledge perspectives.,False,,0,0,0,False,0,design knowledge; design expertise; design rationale; design pattern; design patterns; design principle; design principles; design guideline; design guidelines; design heuristic; design heuristics; design procedure; design procedures; design rule; design rules; design framework; design frameworks; design method; design methods; design theory,0,Design theory,tfidf-svd,method,kmeans,2,"management, commons, digital, method theory, literature, review, pluralism, online communities",8.283452,-6.068863,0.4790787683514971,3,True,3,8,0.9571340914346503,"method theory, theories, science, methodology, engineering, management, practice, sonification",Value-Sensitive Design / Method Theory / Online Communities,"This cluster focuses on Privacy / Security, involving Designers, using Design Science, Case Study as the main methodological or conceptual lens, with contribution types coded as Theoretical, Methodological, Artifact/System.",Privacy / Security,Designers,"Design Science, Case Study",,"Theoretical, Methodological, Artifact/System","[{'paper_id': '5a973fb8ae6f', 'title': 'ICT-Enabled Self-Management of Chronic Diseases: Literature Review and Analysis Using Value-Sensitive Design', 'cluster': 2, 'distance': 0.3758893023286417}, {'paper_id': 'c9175ef9ebfe', 'title': 'Management design theories', 'cluster': 6, 'distance': 0.5612706372415192}, {'paper_id': 'e47202a23273', 'title': 'Toward a design theory of strategic enterprise management business intelligence (SEMBI) capability maturity model', 'cluster': 2, 'distance': 0.6043327788861108}, {'paper_id': 'd2fba2826d90', 'title': 'Design Principles for Platform-Enabled Knowledge Commons with an Expository Instantiation', 'cluster': 2, 'distance': 0.6991622655835645}, {'paper_id': '9049c4d2bbec', 'title': 'Towards a design theory of blended learning curriculum', 'cluster': 1, 'distance': 0.7994802183937172}]"
9f9f7295ec8c,Affordance based design: a relational theory for design,"Maier, J. (1); Fadel, G. (1)","After reviewing current approaches to design theory, which are based on the transformative concept of function, we argue that this basis in function limits the scope of design problems and explanatory power of current design theories. As an alternative with greater potential for explanatory power and a framework for solving a wider array of design problems, we propose that a relational theory of design is needed. Such a relational theory should mirror those currently developed in mathematics, physics, computer science, and even philosophy. We develop a relational theory for design based on the concept of affordances from perceptual psychology. Affordances help to explain the entanglement between designers, users, and artifacts—relationships that are not currently handled by function based approaches to design. Affordance based design, as developed in this paper, does not offer a radical new approach to doing design, but rather a shift in design thinking. Our focus in this paper is therefore on the explanatory power and potential innovation fostered by this change in design thinking, as illustrated through several examples, and not on specific methods.",10.1007/s00163-008-0060-3,,Research in Engineering Design,,Design theory,design_theory.csv,engineering_village,full,False,False,True,True,False,True,advance_criteria,True,"Reviews current design theories based on function and proposes an alternative relational theory of design, synthesizing prior theory and offering its own definitional framework.","The paper reviews current approaches to design theory and then proposes a relational theory for design based on affordances, so it both synthesizes prior theory and provides an original definition/framework.",True,pdfplumber,63936,46,10,False,0,design knowledge; design expertise; design rationale; design pattern; design patterns; design principle; design principles; design guideline; design guidelines; design heuristic; design heuristics; design procedure; design procedures; design rule; design rules; design framework; design frameworks; design method; design methods; design theory,8,Design theory,tfidf-svd,method,kmeans,2,"management, commons, digital, method theory, literature, review, pluralism, online communities",6.635623,-5.323643,0.6482529459828934,9,False,9,8,0.9735260632165342,"method theory, theories, science, methodology, engineering, management, practice, sonification",Value-Sensitive Design / Method Theory / Online Communities,"This cluster focuses on Privacy / Security, involving Designers, using Design Science, Case Study as the main methodological or conceptual lens, with contribution types coded as Theoretical, Methodological, Artifact/System.",Privacy / Security,Designers,"Design Science, Case Study",,"Theoretical, Methodological, Artifact/System","[{'paper_id': '0bca44c18d6c', 'title': 'Tinkering, tailoring, and bricolage: Implications for theories of Design', 'cluster': 6, 'distance': 0.6516654536571792}, {'paper_id': 'af66a447ca7c', 'title': 'Digital Panopticon: How Remote Work Monitoring Shapes Employee Behavior and Motivation', 'cluster': 2, 'distance': 0.7491357027814385}, {'paper_id': 'f0dd2d28f3d2', 'title': 'Research methods for design theory', 'cluster': 0, 'distance': 0.7534504702255115}, {'paper_id': '56da61efca6b', 'title': 'Transitional Theory', 'cluster': 0, 'distance': 0.7717568559442535}, {'paper_id': '03fd54829f02', 'title': 'Digisprudence: the design of legitimate code', 'cluster': 0, 'distance': 0.7885733230584111}]"
b21a9b4cc5ef,C-K design theory: an advanced formulation,"Hatchuel, A. (1); Weil, B. (1)","C-K theory is a unified Design theory and was first introduced in 2003 (Hatchuel and Weil 2003). The name “C-K theory” reflects the assumption that Design can be modelled as the interplay between two interdependent spaces with different structures and logics: the space of concepts (C) and the space of knowledge (K). Both pragmatic views of Design and existing Design theories define Design as a dynamic mapping process between required functions and selected structures. However, dynamic mapping is not sufficient to describe the generation of new objects and new knowledge which are distinctive features of Design. We show that C-K theory captures such generation and offers a rigorous definition of Design. This is illustrated with an example: the design of Magnesium-CO2 engines for Mars explorations. Using C-K theory we also discuss Braha and Reich’s topological structures for design modelling (Braha and Reich 2003). We interpret this approach as special assumptions about the stability of objects in space K. Combining C-K theory and Braha and Reich’s models opens new areas for research about knowledge structures in Design theories. These findings confirm the analytical and interpretative power of C-K theory.",10.1007/s00163-008-0043-4,,Research in Engineering Design,,Design theory,design_theory.csv,engineering_village,full,False,False,True,True,False,True,advance_criteria,True,"Advances C-K design theory as a unified design theory, defining design as interplay of concept and knowledge spaces and engaging with existing design theories, satisfying C2 and C3.","This appears to be a theoretical paper about the concept/knowledge structure of design theory, but the truncated abstract does not clearly show a synthesis from prior work or an explicit definition/adaptation, so full text is needed.",True,pdfplumber,49123,32,10,False,0,design knowledge; design expertise; design rationale; design pattern; design patterns; design principle; design principles; design guideline; design guidelines; design heuristic; design heuristics; design procedure; design procedures; design rule; design rules; design framework; design frameworks; design method; design methods; design theory,8,Design theory,tfidf-svd,method,kmeans,0,"method theory, space, humanism, concept, scale, software engineering, code, instructional",5.80687,-4.39107,0.5677584731397353,4,False,4,8,0.9727232487757789,"method theory, theories, science, methodology, engineering, management, practice, sonification",Design Science / Method Theory / Software Engineering,"This cluster focuses on Education / Learning, involving Designers, Practitioners, using Case Study as the main methodological or conceptual lens, with recurring attention to Tool, with contribution types coded as Theoretical, Methodological, Empirical.",Education / Learning,"Designers, Practitioners",Case Study,Tool,"Theoretical, Methodological, Empirical","[{'paper_id': 'a285258b5545', 'title': 'Extended general design theory. I. Compactification of concept space', 'cluster': 0, 'distance': 0.5000380900021122}, {'paper_id': '79d31b954d2a', 'title': 'THE LOGICS OF DOUBLE PROOF IN PROOF OF CONCEPT: A DESIGN THEORY-BASED MODEL OF EXPERIMENTATION IN THE UNKNOWN', 'cluster': 0, 'distance': 0.7508046336998958}, {'paper_id': '4db508a9681a', 'title': 'Philosophy of design: A meta-theoretical structure for design theory', 'cluster': 4, 'distance': 0.7612497861570664}, {'paper_id': 'c0372ed4d123', 'title': 'Web-based information systems: Developing a design theory', 'cluster': 0, 'distance': 0.776630152706007}, {'paper_id': '83d1ebe7d6c0', 'title': 'Design Theory in Information Systems', 'cluster': 0, 'distance': 0.7867218879879496}]"
0a130c0971e9,Feedforward as an essential active principle of engagement in computer games,"Swan, Richard H. (1)","Learner engagement is important for learning, yet the question of how to design engaging learning experiences still lingers. One of the facets of computer games is that they tend to be engaging. In addition, they are designed experiences. By examining computer games as examples of the design of engaging experiences through the lens of design theory, it may be possible to extract more fundamental principles for the design of engagement. Such principles could inform the design of serious games and other learning experiences. This chapter uses Vincenti's fundamental design concept of operational principle to identify the core components and active principle that underlie the design of engagement in games. The chapter also introduces the concept of feedforward to describe the continual elicitation of anticipatory cognition and behavior by players/learners. This feedforward effect in the context of player/learner agency is essential to the active principle of engagement in computer games. © 2010, IGI Global.",10.4018/978-1-61520-717-6.ch005,2010,Gaming and Cognition: Theories and Practice from the Learning Sciences,,Design theory,design_theory.csv,engineering_village,full,False,False,True,True,True,True,advance_criteria,True,"Uses design theory (Vincenti's operational principle) to extract fundamental design principles for engagement, examining design-knowledge constructs as its topic and applying a defined design concept.","This chapter appears to extract engagement principles from computer games through a design-theory lens, making design principles central, but the abstract does not clearly confirm a literature synthesis or an explicit definition, so full text is needed.",False,,0,0,0,False,0,design knowledge; design expertise; design rationale; design pattern; design patterns; design principle; design principles; design guideline; design guidelines; design heuristic; design heuristics; design procedure; design procedures; design rule; design rules; design framework; design frameworks; design method; design methods; design theory,0,Design theory,tfidf-svd,method,kmeans,1,"decision, blended, curriculum, pedagogical, synchronous learning, computer, dss, calibration",5.763894,-2.785502,0.5647078777661709,7,False,7,5,0.9666649984011136,"method theory, games, computer, need, theoretical, address, field, directed",Design Science / Synchronous Learning / Decision,"This cluster focuses on Education / Learning, with contribution types coded as Theoretical, Methodological, Artifact/System.",Education / Learning,,,,"Theoretical, Methodological, Artifact/System","[{'paper_id': 'ad8d60b9d2e6', 'title': 'WAR GAMES CLASSIFICATION SYSTEMS', 'cluster': 4, 'distance': 0.6364382076018058}, {'paper_id': '92fd41483399', 'title': 'Design exemplars for synchronous e-learning: A design theory approach', 'cluster': 1, 'distance': 0.6905432103595661}, {'paper_id': 'ceac90427122', 'title': 'Design-oriented human-computer interaction', 'cluster': 1, 'distance': 0.7853552904838912}, {'paper_id': '9049c4d2bbec', 'title': 'Towards a design theory of blended learning curriculum', 'cluster': 1, 'distance': 0.8063798569502358}, {'paper_id': '83d1ebe7d6c0', 'title': 'Design Theory in Information Systems', 'cluster': 0, 'distance': 0.8138861586971334}]"
a1a2a51ae22e,Incommensurability in design science: Which comes first-Theory or artefact?,"Davern, Michael (1); Parkes, Alison (1)","There has been much debate and discussion in recent literature about the nature of information systems (IS) theory, the role of theory in design and the notions of design science and design theory. A central idea in much of this literature is the interplay between traditional theory-based research and the development of design theory through the building of information systems artefacts. In this chapter, we describe our recent experiences in the development of an artefact (a rule-based expert system called DG-In) based on a behavioural theory and the challenges we found as we attempted to reconcile it with relevant design theory. The potential for incommensurability in the research cycle between theory and artefact has significant implications for IS research-from both a design-science perspective and a behavioural-science perspective. It brings into question core ideas such as the development of a cumulative research tradition and notions of theory-based design and design theory more generally.",10.22459/isf.12.2010.04,2010,Information Systems Foundations: The Role of Design Science,,Design theory,design_theory.csv,engineering_village,full,False,False,True,True,True,True,advance_criteria,True,"Discusses and synthesizes literature on the nature of IS design theory and the role of theory in design, treating design theory as the topic and engaging with its definitions.","The chapter discusses design science, design theory, and experiences building an artefact from behavioral theory, but the abstract does not clearly show that it synthesizes or explicitly defines design-knowledge constructs, so it should be checked in full text.",False,,0,0,0,False,0,design knowledge; design expertise; design rationale; design pattern; design patterns; design principle; design principles; design guideline; design guidelines; design heuristic; design heuristics; design procedure; design procedures; design rule; design rules; design framework; design frameworks; design method; design methods; design theory,0,Design theory,tfidf-svd,method,kmeans,0,"method theory, space, humanism, concept, scale, software engineering, code, instructional",7.097511,-4.6003366,0.6181702899871511,10,False,10,8,0.9756729970594885,"method theory, theories, science, methodology, engineering, management, practice, sonification",Design Science / Method Theory / Software Engineering,"This cluster focuses on Education / Learning, involving Designers, Practitioners, using Case Study as the main methodological or conceptual lens, with recurring attention to Tool, with contribution types coded as Theoretical, Methodological, Empirical.",Education / Learning,"Designers, Practitioners",Case Study,Tool,"Theoretical, Methodological, Empirical","[{'paper_id': 'f0dd2d28f3d2', 'title': 'Research methods for design theory', 'cluster': 0, 'distance': 0.6158862086178124}, {'paper_id': '103eb1a8586b', 'title': 'Incommensurability and multi-paradigm grounding in design science research: Implications for creating knowledge', 'cluster': 6, 'distance': 0.7621082915666225}, {'paper_id': '50c94f5857d8', 'title': 'Eight Components of a Design Theory of Sonification', 'cluster': 5, 'distance': 0.7755874273243535}, {'paper_id': '43fee329f83e', 'title': 'Process design theory for digital information services', 'cluster': 2, 'distance': 0.7778932750412801}, {'paper_id': '56da61efca6b', 'title': 'Transitional Theory', 'cluster': 0, 'distance': 0.7807932151364818}]"
