paper_id,title,authors,abstract,doi,year,venue,url,keyword,source_file,source_repos,abstract_quality,format_excluded,scope_excluded,c2,c3,fulltext_flag,c2_and_c3,disposition,advances_to_fulltext,primary_reason,val_reason,pdf_found,pdf_extract_method,full_text_chars,paragraph_count,matched_paragraph_count,discussion_found,discussion_paragraph_count,extraction_terms,keyword_conditioned_paragraph_count,focus_keyword,embedding_model,text_view,cluster_method,cluster,cluster_theme_terms,umap_x,umap_y,distance_to_centroid,representative_rank,is_representative_top3,medoid_rank,lda_topic,lda_topic_probability,lda_topic_words,cluster_label_candidate,cluster_summary_candidate,facet_population_or_context,facet_stakeholder_or_population,facet_method_or_lens,facet_artifact_or_domain,facet_contribution_or_outcome,nearest_papers
5b3b013c191d,Towards a unified terminology for sonification and visualization,K. Enge; A. Rind; Michael Iber; Robert Höldrich; W. Aigner,"Both sonification and visualization convey information about data by effectively using our human perceptual system, but their ways to transform the data differ. Over the past 30 years, the sonification community has demanded a holistic perspective on data representation, including audio-visual analysis, several times. A design theory of audio-visual analysis would be a relevant step in this direction. An indispensable foundation for this endeavor is a terminology describing the combined design space. To build a bridge between the domains, we adopt three of the established theoretical constructs from visualization theory for the field of sonification. The three constructs are the spatial substrate, the visual mark, and the visual channel. In our model, we choose time to be the temporal substrate of sonification. Auditory marks are then positioned in time, such as visual marks are positioned in space. Auditory channels are encoded into auditory marks to convey information. The proposed definitions allow discussing visualization and sonification designs as well as multi-modal designs based on a common terminology. While the identified terminology can support audio-visual analytics research, it also provides a new perspective on sonification theory itself.",,2023,Personal and Ubiquitous Computing,https://www.semanticscholar.org/paper/79f758f21333f7a0a552329d1b8ad8cf8bfd0154,Design theory,design_theory.csv,semantic_scholar,full,False,False,True,True,True,True,advance_criteria,True,"Builds a unified terminology and design space bridging sonification and visualization from established theoretical constructs, satisfying C2 and plausibly C3; flagged to confirm definitional adaptation.","The paper appears to build a unified terminology for the combined sonification-visualization design space by adapting established theoretical constructs across domains, which plausibly synthesizes design-knowledge constructs from prior work, but any explicit definition is not confirmable from the truncated abstract.",True,pdfplumber,52856,35,8,False,0,design knowledge; design expertise; design rationale; design pattern; design patterns; design principle; design principles; design guideline; design guidelines; design heuristic; design heuristics; design procedure; design procedures; design rule; design rules; design framework; design frameworks; design method; design methods; design theory,4,Design theory,tfidf-svd,method,kmeans,5,"sonification, visualization, audio visual analysis, sounds, years, holistic perspective data, human perceptual ways, hindered",7.023722,-3.5451307,0.05647689176757076,2,True,2,8,0.9727248584739919,"method theory, theories, science, methodology, engineering, management, practice, sonification",Design Science / Audio Visual Analysis / Holistic Perspective Data,"This cluster focuses on sonification, visualization, involving Designers, using Design Science as the main methodological or conceptual lens, with contribution types coded as Theoretical, Artifact/System, Methodological.",,Designers,Design Science,,"Theoretical, Artifact/System, Methodological","[{'paper_id': '50c94f5857d8', 'title': 'Eight Components of a Design Theory of Sonification', 'cluster': 5, 'distance': 0.21952828846283146}, {'paper_id': '67d72b35ce6b', 'title': 'A nascent design theory for explainable intelligent systems', 'cluster': 1, 'distance': 0.7867505897721943}, {'paper_id': '43fee329f83e', 'title': 'Process design theory for digital information services', 'cluster': 2, 'distance': 0.862983599803404}, {'paper_id': '804431d6f285', 'title': 'Concepts and definitions for product recovery: Analysis and clarification of the terminology used in academia and industry', 'cluster': 6, 'distance': 0.8736386536162677}, {'paper_id': '83d1ebe7d6c0', 'title': 'Design Theory in Information Systems', 'cluster': 0, 'distance': 0.881333331453362}]"
6ecb18a5b139,TO THE PROBLEM OF FORMING THE CATEGORIAL AND CONCEPTUAL APPARATUS OF THE COURSE “HISTORY AND METHODOLOGY OF DESIGN DESIGN”,N. Aganina; D. D.Filonenko,"The relevance of the study is due to the inevitable obsolescence of fixed concepts and categories of design theory that make up the theoretical foundation of the master's course “History and Methodology of Design”, which is associated with the closeness of the resulting categorical-conceptual systems. 
The aim of the study is to create a dynamic structure of concepts and design categories that form the categorical-conceptual apparatus of the course. 
As a methodological basis of the study, a cultural approach is used that allows one to ""practically implement a systematic view"" on a design that is in the process of constant development and updating. In the course of work, the following research methods are used: problem statement, definition and systematization of concepts and categories, comparative method, historical and cultural analysis. 
As a result of the study, the authors of the article propose to consider the system of concepts and categories of the course in the form of a “network” formed around the concept of “design culture”, the content of which is revealed using the category of “proektnost”. The proposed structure allows us to preserve the fundamental plurality of interpretations of the concept of design and justify the methodological pluralism of design practice.",,2020,,https://www.semanticscholar.org/paper/7d824a6668b58b3a5799c88bdd089a659751a214,Design theory,design_theory.csv,semantic_scholar,full,False,False,True,True,True,True,advance_criteria,True,"Aims to construct a dynamic structure of design concepts and categories forming a categorical-conceptual apparatus, which both synthesizes and defines design-knowledge constructs.","The paper aims to create a dynamic structure of design concepts and categories for a methodology course, which suggests categorization/synthesis of design-theory constructs, but the abstract does not clearly state an explicit definition or adaptation of a design-knowledge construct.",False,,0,0,0,False,0,design knowledge; design expertise; design rationale; design pattern; design patterns; design principle; design principles; design guideline; design guidelines; design heuristic; design heuristics; design procedure; design procedures; design rule; design rules; design framework; design frameworks; design method; design methods; design theory,0,Design theory,tfidf-svd,method,kmeans,4,"methodology, conceptual, ecc, mechanical, game, theoretical, military, method theory",5.9481435,-6.3571672,0.3184845816977204,1,True,1,6,0.9689617630169933,"method theory, product, concepts, decision, management, problem, course, theories",Method Theory / Methodology / Conceptual,"This cluster focuses on methodology, conceptual, with recurring attention to Game, with contribution types coded as Theoretical, Methodological, Artifact/System.",,,,Game,"Theoretical, Methodological, Artifact/System","[{'paper_id': 'f0eab2f851e8', 'title': 'Design science−the need for a scientific basis for engineering design methodology', 'cluster': 4, 'distance': 0.5342187908923479}, {'paper_id': '232abf4e9e91', 'title': 'The Conceptual Design of Mechanical Products', 'cluster': 4, 'distance': 0.598214183949616}, {'paper_id': '4db508a9681a', 'title': 'Philosophy of design: A meta-theoretical structure for design theory', 'cluster': 4, 'distance': 0.7422768276734049}, {'paper_id': 'bacdc4f76eea', 'title': 'Work system principles: towards a justified design theory on the grounds of socio-instrumental pragmatism', 'cluster': 4, 'distance': 0.7609457536566108}, {'paper_id': '5b52ec143fa6', 'title': 'The ECC Methodology for Architecture Design Theory and Practices Research', 'cluster': 4, 'distance': 0.7772892919367879}]"
3f7b5dc9fc40,Concerning the Epistemology of Design: The Role of the Eco-Cognitive Model of Abduction in Pragmatism,Alger Sans Pinillos; A. Estany,"Design has usually been linked to art and applied in scenarios related to everyday life. Even when design has, on occasion, made its way into the world of academia, it has always been closely linked to art and scenarios related everyday life. At last, however, the idea of design has reached the field of epistemology: an area within the very heart of philosophy that has always focused, in theory, on the foundations of knowledge. Consequently, design is being studied from different approaches interested in the foundation of knowledge, theoretical and practical. This is one of the reasons why abduction and pragmatism have been considered relevant from a design perspective. This paper first shows the main features of abduction and pragmatism, describes their evolution and considers their mutual implications. Second, the epistemology of design is analysed considering its most relevant characteristics. Third, the connection between abduction and, on the one hand, pragmatism and, on the other, design epistemology is addressed. Finally, the role of abductive inference in grounding a real epistemology for design theory from the naturalised cognitive perspective of abduction is outlined. The central proposition is that this approach is essential as a methodological innovation, as it allows us to analyse both the inquiry process and the design process as interdependent when dealing with practical problems of a social and cultural nature. This approach allows us to analyse how human actions determine changes in the theoretical framework from which we make our inquiry. In short, the world is an open-ended project that humans design through our daily inquiry.",,2023,Philosophies,https://www.semanticscholar.org/paper/7e135cc8cc3f2977f008136b33bf88e38576edcc,Design theory,design_theory.csv,semantic_scholar,full,False,False,True,True,True,True,advance_criteria,True,"Examines the epistemology of design and abduction as foundations of design knowledge, plausibly synthesizing and defining constructs; flagged to confirm in full text.","The paper plausibly treats design as a knowledge/epistemological topic, but the abstract does not clearly confirm a synthesis from prior work or an explicit adapted/original definition, so full text is needed.",False,,0,0,0,False,0,design knowledge; design expertise; design rationale; design pattern; design patterns; design principle; design principles; design guideline; design guidelines; design heuristic; design heuristics; design procedure; design procedures; design rule; design rules; design framework; design frameworks; design method; design methods; design theory,0,Design theory,tfidf-svd,method,kmeans,0,"method theory, space, humanism, concept, scale, software engineering, code, instructional",7.3695254,-3.020905,0.7505300269325947,22,False,22,8,0.9742831735814647,"method theory, theories, science, methodology, engineering, management, practice, sonification",Design Science / Method Theory / Software Engineering,"This cluster focuses on Education / Learning, involving Designers, Practitioners, using Case Study as the main methodological or conceptual lens, with recurring attention to Tool, with contribution types coded as Theoretical, Methodological, Empirical.",Education / Learning,"Designers, Practitioners",Case Study,Tool,"Theoretical, Methodological, Empirical","[{'paper_id': '68bf6cd63875', 'title': 'Design epistemology as innovation in public health research', 'cluster': 3, 'distance': 0.44439544750492876}, {'paper_id': '0bca44c18d6c', 'title': 'Tinkering, tailoring, and bricolage: Implications for theories of Design', 'cluster': 6, 'distance': 0.8132056810600448}, {'paper_id': '363ca9685308', 'title': 'Cognitive Architecture and Instructional Design: 20 Years Later', 'cluster': 0, 'distance': 0.828237964486107}, {'paper_id': '804431d6f285', 'title': 'Concepts and definitions for product recovery: Analysis and clarification of the terminology used in academia and industry', 'cluster': 6, 'distance': 0.837960195627631}, {'paper_id': '91ac41f73380', 'title': 'Knowing the Unknowable: Understanding and Measuring Design Impact Across Disciplines and Scale', 'cluster': 0, 'distance': 0.8429892598602011}]"
6194ef223969,A typology of Urban Design theories and its application to the shared body of knowledge,Hooman Foroughmand Araabi,"This article consists of two parts. The first part suggests a typology for urban design theories in order to provide a new way of understanding the nature and function of the, seemingly opposing, debates existing in the field. This typology is based on distinguishing between subjects, object and knowledge of urban design. In the second part, the typology is applied to the shared body of knowledge. In order to do so, this article attempts to give an overview of the current shared body of knowledge in the field of urban design. The reading lists of urban design theory courses, drawn from different universities in the United States, United Kingdom and Australia, are analysed to identify common texts. These texts are then considered to be one reading of what constitutes the shared body of knowledge. A comparison is made between this list of titles and those texts offered in various urban design readers to provide a better overall picture of the shared body of knowledge. Finally, a chronological analysis is made to illustrate the development of the three types of urban design theory.",,2015,Urban Design International,https://www.semanticscholar.org/paper/89914fef1674939de30d51f67c4e54d2aee8e0dd,Design theory,design_theory.csv,semantic_scholar,full,False,False,True,True,False,True,advance_criteria,True,"Proposes a typology of urban design theories and applies it to the shared body of knowledge, synthesizing and categorizing design-knowledge constructs (C2) while defining the typology's distinctions (C3).","It proposes a typology of urban design theories and applies it to the field’s shared body of knowledge using course reading lists, which satisfies synthesis/categorization, but any explicit definition of design-knowledge constructs is not clear from the abstract alone.",False,,0,0,0,False,0,design knowledge; design expertise; design rationale; design pattern; design patterns; design principle; design principles; design guideline; design guidelines; design heuristic; design heuristics; design procedure; design procedures; design rule; design rules; design framework; design frameworks; design method; design methods; design theory,0,Design theory,tfidf-svd,method,kmeans,6,"theories, product, recovery, technique innovation, method theory, kernel, science, management",6.742713,-4.9371,0.6977017648921332,10,False,10,2,0.974283799499677,"concept, method theory, meta, theoretical, existing, typology, conceptual, article",Design Science / Technique Innovation / Method Theory,"This cluster focuses on theories, product, involving Designers, using Design Science as the main methodological or conceptual lens, with contribution types coded as Theoretical, Artifact/System, Methodological.",,Designers,Design Science,,"Theoretical, Artifact/System, Methodological","[{'paper_id': '00781ed0e844', 'title': 'Cognitive Point of View in Recursive Design', 'cluster': 0, 'distance': 0.6937736651984913}, {'paper_id': '79d31b954d2a', 'title': 'THE LOGICS OF DOUBLE PROOF IN PROOF OF CONCEPT: A DESIGN THEORY-BASED MODEL OF EXPERIMENTATION IN THE UNKNOWN', 'cluster': 0, 'distance': 0.8198457689616168}, {'paper_id': '9f9f7295ec8c', 'title': 'Affordance based design: a relational theory for design', 'cluster': 2, 'distance': 0.8338663187309874}, {'paper_id': 'c1db52f69aae', 'title': 'Editorial: A Critical Look at Theories in Design Science Research', 'cluster': 6, 'distance': 0.8357609188398594}, {'paper_id': '0bca44c18d6c', 'title': 'Tinkering, tailoring, and bricolage: Implications for theories of Design', 'cluster': 6, 'distance': 0.8544982401316964}]"
83d1ebe7d6c0,Design Theory in Information Systems,S. Gregor,"The aim of this paper is to explore an important category of information systems knowledge that is termed “design theory”. This knowledge is distinguished as the fifth of five types of theory: (i) theory for analysing and describing, (ii) theory for understanding, (iii) theory for predicting, (iv) theory for explaining and predicting, and (v) theory for design and action. Examples of design theory in information systems are provided, with associated research methods. The limited understanding and recognition of this type of theory in information systems indicates that further debate concerning its nature and role in our discipline is needed.",,2002,Australasian Journal of Information Systems,https://www.semanticscholar.org/paper/aa849c3dea50cd7496aac43c8aea0c53fc070505,Design theory,design_theory.csv,semantic_scholar,full,False,False,True,True,True,True,advance_criteria,True,"Explores and categorizes 'design theory' as a type of IS knowledge among five theory types and defines it, satisfying C2 and likely C3.","The paper explicitly explores and characterizes 'design theory' as a type of information systems knowledge, providing examples and distinguishing it from other theory types, which satisfies synthesis/categorization and definitional treatment.",False,,0,0,0,False,0,design knowledge; design expertise; design rationale; design pattern; design patterns; design principle; design principles; design guideline; design guidelines; design heuristic; design heuristics; design procedure; design procedures; design rule; design rules; design framework; design frameworks; design method; design methods; design theory,0,Design theory,tfidf-svd,method,kmeans,0,"method theory, space, humanism, concept, scale, software engineering, code, instructional",6.2522883,-4.6027617,0.41447763828949413,1,True,1,8,0.9699959928736572,"method theory, theories, science, methodology, engineering, management, practice, sonification",Design Science / Method Theory / Software Engineering,"This cluster focuses on Education / Learning, involving Designers, Practitioners, using Case Study as the main methodological or conceptual lens, with recurring attention to Tool, with contribution types coded as Theoretical, Methodological, Empirical.",Education / Learning,"Designers, Practitioners",Case Study,Tool,"Theoretical, Methodological, Empirical","[{'paper_id': 'c0372ed4d123', 'title': 'Web-based information systems: Developing a design theory', 'cluster': 0, 'distance': 0.48224713079868775}, {'paper_id': 'f0dd2d28f3d2', 'title': 'Research methods for design theory', 'cluster': 0, 'distance': 0.5522442574616144}, {'paper_id': '56da61efca6b', 'title': 'Transitional Theory', 'cluster': 0, 'distance': 0.7032506413187655}, {'paper_id': 'fd05a25a5e94', 'title': 'Four Criteria for Design Theories', 'cluster': 6, 'distance': 0.7397534226600657}, {'paper_id': '5ffd963397c9', 'title': 'THEORY OF TECHNICAL SYSTEMS - PREREQUISITE TO DESIGN THEORY.', 'cluster': 0, 'distance': 0.7794023241584347}]"
41443180c5b4,"Service Ecosystem Design: Propositions, Process Model, and Future Research Agenda",J. Vink; Kaisa Koskela-Huotari; B. Tronvoll; B. Edvardsson; Katarina Wetter-Edman,"While service design has been highlighted as a promising approach for driving innovation, there are often struggles in realizing lasting change in practice. The issues with long-term implementation reveal a reductionist view of service design that ignores the institutional arrangements and other interdependencies that influence design efforts within multi-actor service systems. The purpose of this article is to build a systemic understanding of service design to inform actors’ efforts aimed at intentional, long-term change in service systems. To achieve this aim, we inform the conceptual building blocks of service design by applying service-dominant logic’s service ecosystems perspective. Through this process, we develop four core propositions and a multilevel process model of service ecosystem design. The conceptualization of service ecosystem design advances service design theory by illuminating previously taken for granted aspects; explaining how intentional, long-term change emerges; and expanding the scope of service design beyond projects. Furthermore, this research offers a foundation for future research on service design that involves extending the systemic conceptualization of service design, conducting more holistic empirical investigations, and developing practical methods and approaches for the embedded, collective processes of designing.",,2020,Journal of services research,https://www.semanticscholar.org/paper/ac1bd39fb2c3e185247823c8a846c9829bb5ce27,Design theory,design_theory.csv,semantic_scholar,full,False,False,True,True,True,True,advance_criteria,True,"Builds systemic conceptual understanding of service design from prior work with propositions and a process model, plausibly synthesizing and defining design constructs; flagged to confirm C2/C3.","It reviews literature on HR planning, strategy, business model, and systemic design methodology to propose a systemic design approach, which supports C2, but the abstract does not clearly provide or adapt an explicit definition of the design-knowledge construct.",False,,0,0,0,False,0,design knowledge; design expertise; design rationale; design pattern; design patterns; design principle; design principles; design guideline; design guidelines; design heuristic; design heuristics; design procedure; design procedures; design rule; design rules; design framework; design frameworks; design method; design methods; design theory,0,Design theory,tfidf-svd,method,kmeans,3,"framing, service, problem, actors, taking, interstitial, social, account",7.960832,-4.542158,0.6344111741276793,6,False,6,3,0.9756732096999204,"service, digital, online, social, method theory, efforts, initial, practice",Framing / Service / Problem,"This cluster focuses on framing, service, with contribution types coded as Theoretical, Methodological, Empirical.",,,,,"Theoretical, Methodological, Empirical","[{'paper_id': '43fee329f83e', 'title': 'Process design theory for digital information services', 'cluster': 2, 'distance': 0.5646441158621933}, {'paper_id': 'd2fba2826d90', 'title': 'Design Principles for Platform-Enabled Knowledge Commons with an Expository Instantiation', 'cluster': 2, 'distance': 0.7476053196059897}, {'paper_id': '7fb79f6d2f73', 'title': 'PEDAGOGICAL DESIGN: CONCEPT, PRINCIPLES, MODELS', 'cluster': 1, 'distance': 0.844358958054036}, {'paper_id': '363ca9685308', 'title': 'Cognitive Architecture and Instructional Design: 20 Years Later', 'cluster': 0, 'distance': 0.8545061190903702}, {'paper_id': '103eb1a8586b', 'title': 'Incommensurability and multi-paradigm grounding in design science research: Implications for creating knowledge', 'cluster': 6, 'distance': 0.8562095531703507}]"
