paper_id,title,authors,abstract,doi,year,venue,url,keyword,source_repos,abstract_quality,format_excluded,scope_excluded,c2,c3,fulltext_flag,c2_and_c3,disposition,advances_to_fulltext,primary_reason,val_reason,pdf_found,pdf_extract_method,full_text_chars,paragraph_count,matched_paragraph_count,discussion_found,discussion_paragraph_count,keyword_conditioned_paragraph_count,focus_keyword,embedding_model,text_view,cluster_method,cluster,cluster_theme_terms,umap_x,umap_y,distance_to_centroid,representative_rank,is_representative_top3,medoid_rank,lda_topic,lda_topic_probability,lda_topic_words,cluster_label_candidate,cluster_summary_candidate,facet_population_or_context,facet_stakeholder_or_population,facet_method_or_lens,facet_artifact_or_domain,facet_contribution_or_outcome,nearest_papers,design_knowledge_form,design_knowledge_action,design_knowledge_contribution
fd2392ff2aff,Surveying a Landscape of Ethics-Focused Design Methods,"Chivukula, Shruthi Sai (1); Li, Ziqing (2); Pivonka, Anne C. (2); Chen, Jingning (2); Gray, Colin M. (2)","Over the past decade, HCI researchers, design researchers, and practitioners have increasingly addressed ethics-focused issues through a range of theoretical, methodological and pragmatic contributions to the field. While many forms of design knowledge have been proposed and described, we focus explicitly on knowledge that has been codified as 'methods,' which we define as structured supports for everyday work practices of designers. In this paper, we identify, analyze, and map a collection of 63 existing ethics-focused methods intentionally designed for ethical impact. Building on results of a content analysis of these methods, we contribute a descriptive record of how these methods operationalize ethics, their intended audience or context of use, their 'core' or 'script,' and the means by which these methods are formulated and codified. Building on these results, we provide an initial definition of ethics-focused methods, identifying potential opportunities for the development of future methods to support ethical design practice. © 2021, CC BY-NC-SA.",10.48550/arXiv.2102.08909,2021.0,arXiv,,Design knowledge,engineering_village|semantic_scholar,full,False,False,True,True,False,True,advance_criteria,True,"Surveys and maps 63 ethics-focused design methods and explicitly defines 'methods' as a form of design knowledge, satisfying both C2 and C3.","The paper studies ethics-focused design methods as its topic, maps and analyzes 63 existing methods from prior work, and explicitly defines 'methods' as a design-knowledge construct, satisfying both C2 and C3.",True,pdfplumber,94262,68,10,True,12,6,Design knowledge,tfidf-svd,method,kmeans,1,"product, field, cpm, prototyping, health, public, pdd, industrial",3.5048425,5.290102,0.6426175876214817,9,False,9,4,0.5493315933357742,"dsr, patterns, analysis, practices, discipline, future, propose, community",Defines Design Knowledge Through Conceptual Framing,"This cluster defines and conceptualizes design knowledge, emphasizing how a design-knowledge construct is made explicit, organized, or put to work rather than only where it is applied. Related knowledge forms include Design Methods, Tacit Design Knowledge. The shared move also involves synthesis of prior work and representation and documentation. Its contribution pattern is coded as Methodological, Theoretical, Artifact/System. Application and method terms are supporting facets, especially methods or lenses such as Case Study and contexts such as Industrial Design, Education / Learning, Healthcare. Representative papers include Identification and management of the near-field knowledge of industrial design for innovative product shapes; Causal design knowledge: Alternative representation method for product development knowledge management.","Industrial Design, Education / Learning, Healthcare",Designers,Case Study,,"Methodological, Theoretical, Artifact/System","[{'paper_id': 'a1ccc16dab98', 'title': 'ANALYSIS OF DESIGN COMPETENCE OF FUTURE ENGINEER-TEACHERS', 'cluster': 5, 'distance': 0.5844387688837653}, {'paper_id': '3058799f63c1', 'title': 'Using Schema to Inform Method Design Practices', 'cluster': 5, 'distance': 0.6219905619339774}, {'paper_id': 'fda0636dbea5', 'title': 'Design Research: Aesthetic Epistemology and Explanatory Knowledge', 'cluster': 1, 'distance': 0.6696017478986617}, {'paper_id': 'd6b2bf339ae4', 'title': 'Co-producing, curating, and defining design knowledge in an online practitioner community', 'cluster': 0, 'distance': 0.6700228406913581}, {'paper_id': 'e958310acab5', 'title': 'Prescriptive knowledge in IS research: Conceptualizing design principles in terms of materiality, action, and boundary conditions', 'cluster': 4, 'distance': 0.7035306638248076}]",Design Knowledge,defines and conceptualizes,defines and conceptualizes Design Knowledge
a7e06450729f,Game Design as an Autonomous Research Subject,"Neves, P.P. (1); Zagalo, N. (2)","This paper examines the methods and systems of game design from the standpoint of existing method proposals failing to establish a common basis for systematizing design knowledge, which this paper aims to help resolve. Game design has often been subsumed by game development and associated disciplines, and game design methodology has often been subsumed by game analysis. This paper reviews related work in defining game design as an autonomous research subject and then divides the methods and systems of game design into complementary methods and core methods, with only the latter, consisting chiefly of design patterns, attempting to systematize how game design knowledge is generated. Seminal game patterns have been descriptive rather than -prescriptive and so have failed to find the requisite practitioner adoption to fulfill their role as a living method. One recent pattern approach has sought to resolve this issue by promoting pattern usage generally over the adoption of a particular language. This paper outlines an alternate and possibly complementary approach of a novel, practical basis for game design literacy for helping core methods work as a basis for systematizing game design knowledge. The proposed basis sacrifices descriptiveness to prescriptiveness to shape methods in that direction.",10.3390/info12090367,,Information,,Design knowledge,engineering_village,full,False,False,True,True,True,True,advance_criteria,True,"Reviews and systematizes game design methods/systems and proposes defining game design as an autonomous research subject with categorized core vs complementary methods, satisfying C2 and likely C3.","The paper reviews related work and categorizes game design methods and systems, so it appears to synthesize design knowledge, but the abstract does not clearly state an explicit definition/adaptation and is truncated, warranting full-text review.",True,pdfplumber,78220,57,10,False,0,3,Design knowledge,tfidf-svd,method,kmeans,0,"game, patterns, practices, stack, language, situation, anatomy, evidence",3.0998282,5.0128336,0.6028396308888203,7,False,7,2,0.9754186029710612,"product, teachers, science, game, review, field, analysis, make",Evaluates Design Knowledge Through Empirical Evidence,"This cluster evaluates with evidence design knowledge, emphasizing how a design-knowledge construct is made explicit, organized, or put to work rather than only where it is applied. Related knowledge forms include Design Patterns, Design Theory. The shared move also involves definition and conceptualization and synthesis of prior work. Its contribution pattern is coded as Methodological, Empirical, Artifact/System. Application and method terms are supporting facets, especially methods or lenses such as Design Science and contexts such as Education / Learning. Representative papers include The Dark Patterns Knowledge Stack: Exploring New Ways to Negotiate Context, Law, and Design; The anatomy of HCI design patterns.",Education / Learning,"Designers, Practitioners",Design Science,"Game, Interface, Tool","Methodological, Empirical, Artifact/System","[{'paper_id': 'ccc616a68c38', 'title': 'Towards Creating a Body of Evidence-based Interactive Digital Narrative Design Knowledge: Approaches and Challenges', 'cluster': 0, 'distance': 0.1693378365585264}, {'paper_id': '5a716d80ac6b', 'title': 'Towards a Method for Design Principle Development in Information Systems', 'cluster': 7, 'distance': 0.8575098399388204}, {'paper_id': 'cda6c6785f0a', 'title': 'The design of social drones: a review of studies on autonomous flyers in inhabited environments', 'cluster': 5, 'distance': 0.8739303064147074}, {'paper_id': '364b7d9127ec', 'title': 'Toward a Unified Model of Design Knowledge', 'cluster': 5, 'distance': 0.877328353152776}, {'paper_id': '40668e23fbab', 'title': 'Dimensions of knowledge in prototyping: A review and characterisation of prototyping methods and their contributions to design knowledge', 'cluster': 1, 'distance': 0.8812075005851978}]",Design Knowledge,evaluates with evidence,evaluates with evidence Design Knowledge
82f49b5a1905,SOLUTION REPERTOIRE,"van Turnhout, Koen (1); Smits, Aletta (1)","In this paper, we argue that design ‘solutions’ such as iconic designs, archetypes and design patterns, ought to be recognized as crucial forms of design knowledge. There is an abundance of literature suggesting solutions play a crucial role in design cognition: they can act as a gateway to understand the design situation better, as a stepping-stone to novel ideas and as an illustration of good practices. Unfortunately, however, the question of what this means for our teaching and our curriculum design has received less attention. How should instructors and design programmers handle solution-oriented knowledge? To spark a more informed debate about teaching solution-oriented thinking, we introduce the notion of solution repertoire: 'the competence of appreciating and handling solutions in one’s design discipline and to use them as an anchor point for design-relevant knowledge that goes beyond the anecdotal experience'. This paper sets the stage by introducing and defining solution repertoire and by examining the implications of way of thinking for our own curriculum. © PDE 2021.",,2021.0,"Proceedings of the 23rd International Conference on Engineering and Product Design Education, E and PDE 2021",,Design knowledge,engineering_village,full,False,False,True,True,True,True,advance_criteria,True,"Argues design solutions/patterns/archetypes are forms of design knowledge and engages literature on their role, satisfying C2 with apparent conceptual framing for C3.","The abstract treats solutions such as iconic designs, archetypes, and design patterns as forms of design knowledge, but from the truncated abstract it is unclear whether it synthesizes prior literature or explicitly defines/adapts these constructs, so full text is needed.",False,,0,0,0,False,0,0,Design knowledge,tfidf-svd,method,kmeans,0,"game, patterns, practices, stack, language, situation, anatomy, evidence",2.7141821,3.5684066,0.5392982679303089,3,True,3,1,0.9677354226685192,"article, practices, field, creation, forms, formulation, digital, dsr",Evaluates Design Knowledge Through Empirical Evidence,"This cluster evaluates with evidence design knowledge, emphasizing how a design-knowledge construct is made explicit, organized, or put to work rather than only where it is applied. Related knowledge forms include Design Patterns, Design Theory. The shared move also involves definition and conceptualization and synthesis of prior work. Its contribution pattern is coded as Methodological, Empirical, Artifact/System. Application and method terms are supporting facets, especially methods or lenses such as Design Science and contexts such as Education / Learning. Representative papers include The Dark Patterns Knowledge Stack: Exploring New Ways to Negotiate Context, Law, and Design; The anatomy of HCI design patterns.",Education / Learning,"Designers, Practitioners",Design Science,"Game, Interface, Tool","Methodological, Empirical, Artifact/System","[{'paper_id': '364b7d9127ec', 'title': 'Toward a Unified Model of Design Knowledge', 'cluster': 5, 'distance': 0.6274679433525412}, {'paper_id': 'e8a17b6120e4', 'title': 'Designing as reflective conversation with the materials of a design situation', 'cluster': 0, 'distance': 0.6342327386426295}, {'paper_id': 'c0efa7750b45', 'title': 'Forms of reasoning in the design science research process', 'cluster': 2, 'distance': 0.7139041330323503}, {'paper_id': 'ef3a9300a2f3', 'title': 'Developing a competency taxonomy for teacher design knowledge in technology-enhanced learning environments: a literature review', 'cluster': 3, 'distance': 0.7349848605518945}, {'paper_id': '3058799f63c1', 'title': 'Using Schema to Inform Method Design Practices', 'cluster': 5, 'distance': 0.7696977908948585}]",Design Knowledge,evaluates with evidence,evaluates with evidence Design Knowledge
40668e23fbab,Dimensions of knowledge in prototyping: A review and characterisation of prototyping methods and their contributions to design knowledge,"Real, Ricardo (1); C., Snider; M., Goudswaard; B., Hicks","Whilst prior works have characterised the affordances of prototyping methods in terms of generating knowledge about a product or process, the types, or ‘dimensions’ of knowledge towards which they contribute are not fully understood. In this paper we adapt the concept of ‘design domains’ as a method to interpret, and better understand the contributions of different prototyping methods to design knowledge in new product development. We first synthesise a set of ten dimensions for design knowledge from a review of literature in design-related fields. A study was then conducted in which participants from engineering backgrounds completed a Likert-type questionnaire to quantify the perceived contributions to design knowledge of 90 common prototyping methods against each dimension. We statistically analyse results to identify patterns in the knowledge contribution of different methods. Results reveal that methods exhibit significantly different contribution profiles, suggesting different methods to be suited to different knowledge. Thus, this paper indicates potential for new methods, methodology and processes to leverage such characterisations for better selection and sequencing of methods in the prototyping process. © ICED 2021.All right reserved.",10.1017/pds.2021.130,2021.0,Proceedings of the Design Society,,Design knowledge,engineering_village|semantic_scholar,full,False,False,True,True,False,True,advance_criteria,True,"Synthesizes ten dimensions of design knowledge from a review of literature and adapts the concept of 'design domains' for its purposes, satisfying both C2 and C3.","The paper explicitly reviews literature to synthesize ten dimensions of design knowledge and states that it adapts the concept of design domains, satisfying both synthesis/categorization and adaptation of a definition-related construct.",True,pdfplumber,32699,24,10,True,4,6,Design knowledge,tfidf-svd,method,kmeans,1,"product, field, cpm, prototyping, health, public, pdd, industrial",3.747758,5.742335,0.4604314738583794,5,False,5,2,0.9738501765511896,"product, teachers, science, game, review, field, analysis, make",Defines Design Knowledge Through Conceptual Framing,"This cluster defines and conceptualizes design knowledge, emphasizing how a design-knowledge construct is made explicit, organized, or put to work rather than only where it is applied. Related knowledge forms include Design Methods, Tacit Design Knowledge. The shared move also involves synthesis of prior work and representation and documentation. Its contribution pattern is coded as Methodological, Theoretical, Artifact/System. Application and method terms are supporting facets, especially methods or lenses such as Case Study and contexts such as Industrial Design, Education / Learning, Healthcare. Representative papers include Identification and management of the near-field knowledge of industrial design for innovative product shapes; Causal design knowledge: Alternative representation method for product development knowledge management.","Industrial Design, Education / Learning, Healthcare",Designers,Case Study,,"Methodological, Theoretical, Artifact/System","[{'paper_id': '6b9f020cd024', 'title': 'Design knowledge for decision-making process in a DFX product design approach', 'cluster': 1, 'distance': 0.3678649840984888}, {'paper_id': 'a883ec94b37a', 'title': 'Causal design knowledge: Alternative representation method for product development knowledge management', 'cluster': 1, 'distance': 0.559377312081317}, {'paper_id': '2a3139d14895', 'title': 'What is design knowledge from the viewpoint of CPM/PDD?', 'cluster': 1, 'distance': 0.6011762607679583}, {'paper_id': 'e105857da02d', 'title': 'Designerly Ways of Knowing in HRI: Broadening the Scope of Design-oriented HRI Through the Concept of Intermediate-level Knowledge', 'cluster': 7, 'distance': 0.6457189666486729}, {'paper_id': 'a707fd62833a', 'title': 'Tracing the tensions surrounding understandings of agency and knowledge in technology design', 'cluster': 3, 'distance': 0.6547686967176927}]",Design Knowledge,defines and conceptualizes,defines and conceptualizes Design Knowledge
f6ba28a6efeb,ON the HIERARCHICAL LEVELS of DESIGN KNOWLEDGE,"Kolarić, S. (1); Beck, J. (2); Stolterman, E. (3)","Hierarchies of knowledge represent a popular formalism for conceptualizing beliefs, justifications, and truth statements. To capitalize on the opportunity for formulating effective maps of design knowledge, this article introduces the hierarchical context-design development-high-level (CDH) model that stratifies different bodies of design-specific knowledge into ranked levels. We compare it with existing hierarchical models of knowledge, and describe its unique uses and benefits for both design research and design practice. © The Author(s), 2020. Published by Cambridge University Press.",10.1017/dsd.2020.330,2020.0,Proceedings of the Design Society: DESIGN Conference,,Design knowledge,engineering_village|semantic_scholar,full,False,False,True,True,False,True,advance_criteria,True,"Introduces a hierarchical CDH model that stratifies bodies of design knowledge, compares it with existing models, and defines design knowledge levels, satisfying C2 and C3.","The paper investigates design characteristics affecting technological appropriation and teacher design decisions in VLEs, but the abstract excerpt is insufficient to verify whether it synthesizes or defines design-knowledge constructs.",True,pdfplumber,28183,19,10,False,0,6,Design knowledge,tfidf-svd,method,kmeans,3,"recreation, nature, interactive technology, enhanced learning, cliche, hierarchical, intermediate, level",3.4044037,2.7022822,0.5984736890494672,7,False,7,1,0.9601333558870776,"article, practices, field, creation, forms, formulation, digital, dsr",Synthesizes Design Knowledge into Shared Design Constructs,"This cluster synthesizes prior work on design knowledge, emphasizing how a design-knowledge construct is made explicit, organized, or put to work rather than only where it is applied. Related knowledge forms include Design Rules, Design Frameworks. The shared move also involves organization and classification and definition and conceptualization. Its contribution pattern is coded as Theoretical, Methodological, Taxonomy/Review. Representative papers include Strong Technology-Enhanced Learning Concepts; Toward a Framework for the Design of Interactive Technology for Nature Recreation.",,Designers,,,"Theoretical, Methodological, Taxonomy/Review","[{'paper_id': '1401e17184c0', 'title': 'Software creation: cliche as intermediate knowledge in software design', 'cluster': 3, 'distance': 0.6916339165559753}, {'paper_id': '364b7d9127ec', 'title': 'Toward a Unified Model of Design Knowledge', 'cluster': 5, 'distance': 0.7085493966063567}, {'paper_id': 'b0fe7e080516', 'title': 'Design knowledge representation: An ontological perspective', 'cluster': 3, 'distance': 0.7866824194170037}, {'paper_id': 'dcbdeccbb96c', 'title': 'Is there a specific type of knowledge associated with design?', 'cluster': 6, 'distance': 0.803948946221084}, {'paper_id': '9d158233f041', 'title': 'Guidelines supporting the formulation of design principles', 'cluster': 4, 'distance': 0.8163676584977297}]",Design Knowledge,synthesizes prior work on,synthesizes prior work on Design Knowledge
5a716d80ac6b,Towards a Method for Design Principle Development in Information Systems,"Möller, F. (1); Guggenberger, T.M. (1); Otto, B. (1)","A central goal of doing research is to make findings available to the academic and practitioner community in order to extend the current knowledge base. The notion of how to generalize, abstract, and codify knowledge gained in design endeavors is a vital issue in design science, especially in the strand of design theory. Design principles provide a medium to make such design knowledge available to others and to make it transferable from a single application onto more scenarios that are subject to similar boundary conditions. The study proposes a preliminary method for the development of design principles based on a structured literature review and the inductive derivation of methodological components from it. The purpose of the method is to give researchers and practitioners executable steps to generate design principles.",10.1007/978-3-030-64823-7_20,,"Designing for Digital Transformation. Co-Creating Services with Citizens and Industry. 15th International Conference on Design Science Research in Information Systems and Technology, DESRIST 2020. Proceedings. Lecture Notes in Computer Science (LNCS 12388)",,Design knowledge,engineering_village,full,False,False,True,True,True,True,advance_criteria,True,"Studies design principles as a medium for codifying design knowledge and proposes a method, treating the construct as topic (C2) and characterizing what design principles mean (likely C3); flagged to confirm.","The paper centers on design principles and proposes a method for developing them, but the abstract does not clearly state that it synthesizes prior literature into categories/definitions or explicitly defines the construct, so full text is needed.",False,,0,0,0,False,0,0,Design knowledge,tfidf-svd,method,kmeans,7,"hri, designerly, ecosystems, make, data quality, arguments, toulmin, objects",2.419888,3.9914749,0.5549644352475744,3,True,3,2,0.9738275574499816,"product, teachers, science, game, review, field, analysis, make",Synthesizes Design Knowledge into Shared Design Constructs,"This cluster synthesizes prior work on design knowledge, emphasizing how a design-knowledge construct is made explicit, organized, or put to work rather than only where it is applied. Related knowledge forms include Design Principles, Design Theory. The shared move also involves definition and conceptualization and representation and documentation. Its contribution pattern is coded as Theoretical, Artifact/System, Methodological. Representative papers include Immodest Proposals: Research Through Design and Knowledge; Managing design knowledge.",,"Designers, Practitioners",,Tool,"Theoretical, Artifact/System, Methodological","[{'paper_id': 'd6b2bf339ae4', 'title': 'Co-producing, curating, and defining design knowledge in an online practitioner community', 'cluster': 0, 'distance': 0.5679892614218243}, {'paper_id': '03adadfa0ad4', 'title': 'Design Principles: Literature Review, Analysis, and Future Directions', 'cluster': 4, 'distance': 0.7070937468756336}, {'paper_id': 'e8f4a7417bf7', 'title': 'Toward a Method for Design Science Research Meta-Studies to Improve the Reusability of Design Principles', 'cluster': 2, 'distance': 0.7255736473953458}, {'paper_id': '53adec5acee6', 'title': 'Mapping design knowledge: 36 years of Design Studies', 'cluster': 7, 'distance': 0.7300668004941926}, {'paper_id': '37f353dbe230', 'title': 'Managing design knowledge', 'cluster': 7, 'distance': 0.7328836405420516}]",Design Knowledge,synthesizes prior work on,synthesizes prior work on Design Knowledge
