paper_id,title,authors,abstract,doi,year,venue,url,keyword,source_repos,abstract_quality,format_excluded,scope_excluded,c2,c3,fulltext_flag,c2_and_c3,disposition,advances_to_fulltext,primary_reason,val_reason,pdf_found,pdf_extract_method,full_text_chars,paragraph_count,matched_paragraph_count,discussion_found,discussion_paragraph_count,keyword_conditioned_paragraph_count,focus_keyword,embedding_model,text_view,cluster_method,cluster,cluster_theme_terms,umap_x,umap_y,distance_to_centroid,representative_rank,is_representative_top3,medoid_rank,lda_topic,lda_topic_probability,lda_topic_words,cluster_label_candidate,cluster_summary_candidate,facet_population_or_context,facet_stakeholder_or_population,facet_method_or_lens,facet_artifact_or_domain,facet_contribution_or_outcome,nearest_papers,design_knowledge_form,design_knowledge_action,design_knowledge_contribution
ccc616a68c38,Towards Creating a Body of Evidence-based Interactive Digital Narrative Design Knowledge: Approaches and Challenges,"Roth, Christian and Koenitz, Hartmut","In the context of this paper we take design knowledge as the methods applied by the creators (for example game designers in the case of games) of interactive experiences in contrast to for example the design of authoring tools or the design of game engines and similar computational systems. Such knowledge about rule-based game design is widespread as evidenced by numerous book publications and many university-level programs of study. In contrast, there is considerable less academic or professional knowledge on the design of interactive narratives -- for example, book publications focused on this topic number in the single digits and in academic programs the topic only exists on the margins. This paper proposes the use of empirical research methods as means to address this situation and examines specific challenges. On this foundation, we introduce a research effort to gather transferable interactive narrative design knowledge and report on a first user study. Finally, we provide guidelines and discuss future research.",10.1145/3132361.3133942,2017.0,Proceedings of the 2nd International Workshop on Multimedia Alternate Realities,https://doi.org/10.1145/3132361.3133942,Design knowledge,acm|engineering_village|semantic_scholar,full,False,False,True,True,False,True,advance_criteria,True,Provides its own definition of design knowledge (methods applied by creators) and works toward synthesizing a body of interactive digital narrative design knowledge.,"The truncated abstract centers on teaching object-oriented design knowledge and related constructs like patterns, but does not clearly show whether it synthesizes or defines them, so full text is needed.",True,pdfplumber,37104,25,10,False,0,6,Design knowledge,tfidf-svd,method,kmeans,0,"game, patterns, practices, stack, language, situation, anatomy, evidence",2.9515016,5.180445,0.5465114271315676,4,False,4,1,0.9700249715484728,"article, practices, field, creation, forms, formulation, digital, dsr",Evaluates Design Knowledge Through Empirical Evidence,"This cluster evaluates with evidence design knowledge, emphasizing how a design-knowledge construct is made explicit, organized, or put to work rather than only where it is applied. Related knowledge forms include Design Patterns, Design Theory. The shared move also involves definition and conceptualization and synthesis of prior work. Its contribution pattern is coded as Methodological, Empirical, Artifact/System. Application and method terms are supporting facets, especially methods or lenses such as Design Science and contexts such as Education / Learning. Representative papers include The Dark Patterns Knowledge Stack: Exploring New Ways to Negotiate Context, Law, and Design; The anatomy of HCI design patterns.",Education / Learning,"Designers, Practitioners",Design Science,"Game, Interface, Tool","Methodological, Empirical, Artifact/System","[{'paper_id': 'a7e06450729f', 'title': 'Game Design as an Autonomous Research Subject', 'cluster': 0, 'distance': 0.1693378365585264}, {'paper_id': '6aeae7ccf85b', 'title': 'Toward a Framework for the Design of Interactive Technology for Nature Recreation', 'cluster': 3, 'distance': 0.7597351672129498}, {'paper_id': 'ade78c466271', 'title': 'Revised set of usability heuristics for the evaluation of interactive systems', 'cluster': 4, 'distance': 0.8087560678528494}, {'paper_id': 'a1ccc16dab98', 'title': 'ANALYSIS OF DESIGN COMPETENCE OF FUTURE ENGINEER-TEACHERS', 'cluster': 5, 'distance': 0.8171867474353334}, {'paper_id': 'b227e604cd40', 'title': 'The Dark Patterns Knowledge Stack: Exploring New Ways to Negotiate Context, Law, and Design', 'cluster': 0, 'distance': 0.8245796215227237}]",Design Knowledge,evaluates with evidence,evaluates with evidence Design Knowledge
b227e604cd40,"The Dark Patterns Knowledge Stack: Exploring New Ways to Negotiate Context, Law, and Design","Gray, Colin M.","Research on dark patterns has grown rapidly, but challenges remain in situating these practices within broader socio-technical, legal, and design contexts. In this essay, I introduce the concept of the “dark patterns knowledge stack” as a new way of synthesizing evidence about manipulative, coercive, and deceptive design practices. Inspired by Alexander’s notion of pattern language, I demonstrate how the knowledge stack aligns multiple layers of analysis and evidence—from interfaces and user characteristics to the socio-technical landscape and user intentions—revealing how manipulative practices interrelate across scales, are perpetuated through key business metrics, and evolve over time. Use of the knowledge stack is demonstrated through two case studies, followed by provocations for scholars, regulators, and practitioners to work together to more effectively identify harms, negotiate accountability, and chart pathways for more just and transparent digital systems.",10.1145/3772318.3791264,2026.0,Proceedings of the 2026 CHI Conference on Human Factors in Computing Systems,https://doi.org/10.1145/3772318.3791264,Design knowledge,acm,full,False,False,True,True,True,True,advance_criteria,True,"Essay synthesizing dark patterns evidence into a 'knowledge stack' concept inspired by pattern language, defining its own framework, plausibly satisfying C2/C3 but warrants full-text confirmation.","Studies tacit knowledge transmission through game design practice in a small team, but the abstract does not clearly indicate a synthesis from prior literature or an explicit definition of the construct.",True,pdfplumber,54338,39,10,False,0,6,Design knowledge,tfidf-svd,method,kmeans,0,"game, patterns, practices, stack, language, situation, anatomy, evidence",1.9032853,3.4057438,0.3070562508915084,1,True,1,4,0.9729957092013286,"dsr, patterns, analysis, practices, discipline, future, propose, community",Evaluates Design Knowledge Through Empirical Evidence,"This cluster evaluates with evidence design knowledge, emphasizing how a design-knowledge construct is made explicit, organized, or put to work rather than only where it is applied. Related knowledge forms include Design Patterns, Design Theory. The shared move also involves definition and conceptualization and synthesis of prior work. Its contribution pattern is coded as Methodological, Empirical, Artifact/System. Application and method terms are supporting facets, especially methods or lenses such as Design Science and contexts such as Education / Learning. Representative papers include The Dark Patterns Knowledge Stack: Exploring New Ways to Negotiate Context, Law, and Design; The anatomy of HCI design patterns.",Education / Learning,"Designers, Practitioners",Design Science,"Game, Interface, Tool","Methodological, Empirical, Artifact/System","[{'paper_id': '78ea04e5eaee', 'title': 'Socio-technical design principles for a multi-stakeholder agriculture extension information system in Ethiopia', 'cluster': 0, 'distance': 0.4923326868996192}, {'paper_id': '6e7959c82d5f', 'title': 'The anatomy of HCI design patterns', 'cluster': 0, 'distance': 0.5037164582244611}, {'paper_id': '8f065cfd18a4', 'title': 'Pattern language: A framework for learning', 'cluster': 0, 'distance': 0.6830844137473064}, {'paper_id': 'd6b2bf339ae4', 'title': 'Co-producing, curating, and defining design knowledge in an online practitioner community', 'cluster': 0, 'distance': 0.7420592972534772}, {'paper_id': '495817cc9c25', 'title': 'Object-oriented design knowledge: Principles, heuristics and best practices', 'cluster': 4, 'distance': 0.780134509673605}]",Design Knowledge,evaluates with evidence,evaluates with evidence Design Knowledge
d4ef8c48ded5,"Toward an Inventory of Plans and Patterns, and Their Use to Foster Strategic Knowledge in Programming Novices","Costantini, Umberto and Lonati, Violetta and Morpurgo, Anna","When learning to program, different types of knowledge and skills have to be built: syntactic knowledge, i.e., knowledge of the language features; conceptual knowledge, i.e., knowledge of the semantics of the various constructs; strategic knowledge, i.e. the ability to use syntactic and conceptual knowledge in the most appropriate and effective way to solve programming problems. Strategic knowledge also includes the ability to exploit and combine solutions to known problems to solve new ones and is one of the hardest skills to acquire when learning to programm [5, 6, 11]. Terms such as goals[10] patterns [5, 6, 11]. schema,[9] strategies[4], and variables' roles[3] have been used to refer to this kind of knowledge. Several authors suggest that strategic knowledge should be taught explicitly, however there are three main issues to address: plans/patterns/schema are used sometimes interchangeably and sometimes similarly but not correspondingly; it is claimed that a small number of plans/patterns is needed in an introductory programming course, however there is no agreed upon inventory of plans/patterns among the CS community;the notion of variables' roles isn't always explicitly linked to the notion of plans/patterns;little instructional material is available that explicitly teaches strategies, and it is neither easy nor obvious how to design such material. The aim of this study is to investigate whether and how such notions of plans/patterns/schema and variables' roles can be integrated into introductory programming courses.The idea is to establish a framework that includes and arranges the different definitions presented in literature. The framework developed will be used for building a catalogue of plans/pattern and variables' roles encountered in CS1 practice, in CS1 assessment, and in the literature on introductory programming; this catalogue will be the basis for designing new instructional/learning material for fostering strategic knowledge. The developed material will be used in one of our introductory programming courses and in peer tutoring activities for the students. The effectiveness will be tested evaluating students programming skills with a pre-test and a post-test, using a group as a treatment group and another one as control group.",10.1145/3372782.3408115,2020.0,Proceedings of the 2020 ACM Conference on International Computing Education Research,https://doi.org/10.1145/3372782.3408115,Design knowledge,acm,full,False,False,True,True,True,True,advance_criteria,True,"Builds an inventory of plans and patterns and defines types of knowledge (syntactic/conceptual/strategic) in programming, engaging C2 and apparently defining constructs, warranting full-text confirmation.","The abstract centers on strategic knowledge, plans, and patterns in programming novices and may inventory or categorize these constructs, but the truncated abstract does not clearly confirm a literature-based synthesis or an explicit definition.",True,pdfplumber,5024,4,1,False,0,1,Design knowledge,tfidf-svd,method,kmeans,0,"game, patterns, practices, stack, language, situation, anatomy, evidence",2.521431,2.33451,0.694038251879719,11,False,11,1,0.9721125887583036,"article, practices, field, creation, forms, formulation, digital, dsr",Evaluates Design Knowledge Through Empirical Evidence,"This cluster evaluates with evidence design knowledge, emphasizing how a design-knowledge construct is made explicit, organized, or put to work rather than only where it is applied. Related knowledge forms include Design Patterns, Design Theory. The shared move also involves definition and conceptualization and synthesis of prior work. Its contribution pattern is coded as Methodological, Empirical, Artifact/System. Application and method terms are supporting facets, especially methods or lenses such as Design Science and contexts such as Education / Learning. Representative papers include The Dark Patterns Knowledge Stack: Exploring New Ways to Negotiate Context, Law, and Design; The anatomy of HCI design patterns.",Education / Learning,"Designers, Practitioners",Design Science,"Game, Interface, Tool","Methodological, Empirical, Artifact/System","[{'paper_id': '03adadfa0ad4', 'title': 'Design Principles: Literature Review, Analysis, and Future Directions', 'cluster': 4, 'distance': 0.5129649567201306}, {'paper_id': '817a6d8c927b', 'title': 'KNOWLEDGE REPRESENTATION IN THE CONCEPTUAL DESIGN PROCESS FOR BUILDING ENERGY SYSTEMS.', 'cluster': 7, 'distance': 0.6858511212483868}, {'paper_id': 'dcbdeccbb96c', 'title': 'Is there a specific type of knowledge associated with design?', 'cluster': 6, 'distance': 0.7328102611369207}, {'paper_id': '37f353dbe230', 'title': 'Managing design knowledge', 'cluster': 7, 'distance': 0.7960084131113427}, {'paper_id': '7c4d2eb91f51', 'title': 'Using a Visual Abstract as a Lens for Communicating and Promoting Design Science Research in Software Engineering', 'cluster': 2, 'distance': 0.7963416636699482}]",Design Knowledge,evaluates with evidence,evaluates with evidence Design Knowledge
e105857da02d,Designerly Ways of Knowing in HRI: Broadening the Scope of Design-oriented HRI Through the Concept of Intermediate-level Knowledge,"Lupetti, Maria Luce and Zaga, Cristina and Cila, Nazli","Interest in design methods and tools has been steadily growing in HRI. Yet, design is not acknowledged as a discipline with specific epistemology and methodology. Designerly HRI work is validated through user studies which, we argue, provide a limited account of the knowledge design produces. This paper aims to broaden current understanding of designerly HRI work and its contributions by unpacking what designerly knowledge is and how to produce it. Through a critical analysis of current HRI design literature, we identify a lack of work dedicated to understanding the conceptual implications of robotic artifacts. These, in fact, are implicit carriers of crucial HRI knowledge that can challenge established assumptions about how a robot should look, act, and be like. We conclude by discussing a set of practices desirable to legitimize designerly HRI work, and calling for further research addressing the conceptual implications designerly HRI work.",10.1145/3434073.3444668,2021.0,Proceedings of the 2021 ACM/IEEE International Conference on Human-Robot Interaction,https://doi.org/10.1145/3434073.3444668,Design knowledge,acm|ieee|semantic_scholar,full,False,False,True,True,False,True,advance_criteria,True,"Critically analyzes HRI design literature to unpack what designerly/intermediate-level knowledge is, synthesizing and defining design-knowledge constructs (C2 and C3).","It critically analyzes HRI design literature to unpack designerly knowledge and intermediate-level knowledge, indicating a synthesis/categorization of design-knowledge constructs, but any explicit adapted or original definition is not clearly visible in the truncated abstract.",True,pdfplumber,46696,31,10,False,0,6,Design knowledge,tfidf-svd,method,kmeans,7,"hri, designerly, ecosystems, make, data quality, arguments, toulmin, objects",2.3137982,4.4280405,0.6202245484676635,5,False,5,2,0.9779264185200514,"product, teachers, science, game, review, field, analysis, make",Synthesizes Design Knowledge into Shared Design Constructs,"This cluster synthesizes prior work on design knowledge, emphasizing how a design-knowledge construct is made explicit, organized, or put to work rather than only where it is applied. Related knowledge forms include Design Principles, Design Theory. The shared move also involves definition and conceptualization and representation and documentation. Its contribution pattern is coded as Theoretical, Artifact/System, Methodological. Representative papers include Immodest Proposals: Research Through Design and Knowledge; Managing design knowledge.",,"Designers, Practitioners",,Tool,"Theoretical, Artifact/System, Methodological","[{'paper_id': '40668e23fbab', 'title': 'Dimensions of knowledge in prototyping: A review and characterisation of prototyping methods and their contributions to design knowledge', 'cluster': 1, 'distance': 0.6457189666486729}, {'paper_id': '19dd6ec0253e', 'title': 'A principle-based philosophical framework for fashion design praxis and education in new design landscapes', 'cluster': 5, 'distance': 0.7010374900708727}, {'paper_id': 'fffe50e033fa', 'title': 'Activity as the ultimate particular of interaction design', 'cluster': 7, 'distance': 0.7471533052159921}, {'paper_id': '7b15d81000db', 'title': 'The anatomy of a design theory', 'cluster': 0, 'distance': 0.7618009540302577}, {'paper_id': 'fd2392ff2aff', 'title': 'Surveying a Landscape of Ethics-Focused Design Methods', 'cluster': 1, 'distance': 0.7651347788771035}]",Design Knowledge,synthesizes prior work on,synthesizes prior work on Design Knowledge
b73f2343e274,Let's Get Divorced: Constructing Knowledge Outcomes for Critical Design and Constructive Design Research,"Forlizzi, Jodi and Zimmerman, John and Hekkert, Paul and Koskinen, Ilpo","Over the last two decades, constructive design research (CDR) - more commonly called Research through Design within HCI - has become an accepted mode of scholarly inquiry within the design research community. It has been described as having three distinct genres: lab, field, and showroom. The lab and field genres typically take a pragmatic stance and typically propose a preferred future. Research done following the showroom approach - more commonly known as critical design (CD), speculative design, or design fictions - typically offers a polemic and a critique of the current state embodied in an artifact. Recently, we have observed a growing conflict within the design research community between pragmatic and critical design researchers [4]. To help reduce this conflict, we called for a divorce between CD and pragmatic CDR, advocating that each approach has its own merits and should be evaluated on its own account. Other design researchers have pushed back on this stance, seeking to create some middle ground to connect these two types of research. In this day-long workshop, we seek to look at exemplar CDR and CD case studies, to develop methods for describing, evaluating, replicating, and making use of knowledge outcomes from these two forms of design research.",10.1145/3197391.3197395,2018.0,Proceedings of the 2018 ACM Conference Companion Publication on Designing Interactive Systems,https://doi.org/10.1145/3197391.3197395,Design knowledge,acm,full,False,False,True,True,True,True,advance_criteria,True,"Discusses and constructs knowledge outcomes for constructive and critical design research genres, synthesizing and defining design research constructs, satisfying C2 and likely C3.","This appears to discuss knowledge outcomes in critical and constructive design research, plausibly concerning design knowledge, but the abstract excerpt does not clearly confirm a synthesis or explicit definition.",True,pdfplumber,8728,6,5,False,0,5,Design knowledge,tfidf-svd,method,kmeans,1,"product, field, cpm, prototyping, health, public, pdd, industrial",4.243974,5.3297524,0.7047780461789759,12,False,12,4,0.9678429921186512,"dsr, patterns, analysis, practices, discipline, future, propose, community",Defines Design Knowledge Through Conceptual Framing,"This cluster defines and conceptualizes design knowledge, emphasizing how a design-knowledge construct is made explicit, organized, or put to work rather than only where it is applied. Related knowledge forms include Design Methods, Tacit Design Knowledge. The shared move also involves synthesis of prior work and representation and documentation. Its contribution pattern is coded as Methodological, Theoretical, Artifact/System. Application and method terms are supporting facets, especially methods or lenses such as Case Study and contexts such as Industrial Design, Education / Learning, Healthcare. Representative papers include Identification and management of the near-field knowledge of industrial design for innovative product shapes; Causal design knowledge: Alternative representation method for product development knowledge management.","Industrial Design, Education / Learning, Healthcare",Designers,Case Study,,"Methodological, Theoretical, Artifact/System","[{'paper_id': '114973fd100e', 'title': 'Identification and management of the near-field knowledge of industrial design for innovative product shapes', 'cluster': 1, 'distance': 0.726059642339158}, {'paper_id': 'a883ec94b37a', 'title': 'Causal design knowledge: Alternative representation method for product development knowledge management', 'cluster': 1, 'distance': 0.7975495411498571}, {'paper_id': '39fee30eb03c', 'title': 'Cutting Cubes Out of Fog: The Whole View of Design', 'cluster': 1, 'distance': 0.8086819806267632}, {'paper_id': '3058799f63c1', 'title': 'Using Schema to Inform Method Design Practices', 'cluster': 5, 'distance': 0.8186216280945665}, {'paper_id': '33444d31c6dc', 'title': 'A design theory for visual inquiry tools', 'cluster': 5, 'distance': 0.8200004643807501}]",Design Knowledge,defines and conceptualizes,defines and conceptualizes Design Knowledge
4b599d3e2eb0,Immodest Proposals: Research Through Design and Knowledge,"Bardzell, Jeffrey and Bardzell, Shaowen and Koefoed Hansen, Lone","The paper offers theoretical support for research through design (RtD) by arguing that in order to legitimize and make use of research through design as research, HCI researchers need to explore and clarify how RtD objects might contribute to knowledge. Leveraging the tradition of aesthetics in the arts and humanities, we argue that while the intentions of the object's designer are important and while annotations are a good mechanism to articulate them, the critical reception of objects is equally foundational to RtD's broader knowledge impacts within HCI. Such a scholarly critical reception is needed precisely because of the potential inexhaustibility of design objects' meanings; their inability to be paraphrased simply and adequately. Offering a multilevel analysis of the (critical) design fiction Menstruation Machine by Sputniko!, the paper explores how design objects co-produce knowledge, by working through complex design problem spaces in non-reductive ways, proposing new connections and distinctions, and embodying design ideas and processes across time and minds.",10.1145/2702123.2702400,2015.0,Proceedings of the 33rd Annual ACM Conference on Human Factors in Computing Systems,https://doi.org/10.1145/2702123.2702400,Design knowledge,acm,full,False,False,True,True,True,True,advance_criteria,True,"Offers theoretical support for research through design and clarifies how RtD objects contribute to knowledge, engaging with design knowledge as topic and likely defining constructs.","The paper centrally concerns knowledge contributions of research through design and appears to theorize how RtD objects contribute to knowledge, but the truncated abstract does not clearly show a synthesis from prior work or an explicit definition, so full-text review is needed.",True,pdfplumber,59504,38,10,False,0,6,Design knowledge,tfidf-svd,method,kmeans,7,"hri, designerly, ecosystems, make, data quality, arguments, toulmin, objects",2.943786,3.952404,0.3472312250178404,1,True,1,2,0.95804495705745,"product, teachers, science, game, review, field, analysis, make",Synthesizes Design Knowledge into Shared Design Constructs,"This cluster synthesizes prior work on design knowledge, emphasizing how a design-knowledge construct is made explicit, organized, or put to work rather than only where it is applied. Related knowledge forms include Design Principles, Design Theory. The shared move also involves definition and conceptualization and representation and documentation. Its contribution pattern is coded as Theoretical, Artifact/System, Methodological. Representative papers include Immodest Proposals: Research Through Design and Knowledge; Managing design knowledge.",,"Designers, Practitioners",,Tool,"Theoretical, Artifact/System, Methodological","[{'paper_id': '53adec5acee6', 'title': 'Mapping design knowledge: 36 years of Design Studies', 'cluster': 7, 'distance': 0.5731014000337357}, {'paper_id': 'ddf4ea43a777', 'title': 'Adaptation of Toulmin’s Model of Argumentation for Establishing Rigour and Relevance in Design Research', 'cluster': 7, 'distance': 0.7124838238461754}, {'paper_id': '5a716d80ac6b', 'title': 'Towards a Method for Design Principle Development in Information Systems', 'cluster': 7, 'distance': 0.7343500594045804}, {'paper_id': 'fffe50e033fa', 'title': 'Activity as the ultimate particular of interaction design', 'cluster': 7, 'distance': 0.7903250467045579}, {'paper_id': 'fc4c2b9d38d7', 'title': 'A framework for supporting architecture knowledge and rationale management', 'cluster': 5, 'distance': 0.8102834317249128}]",Design Knowledge,synthesizes prior work on,synthesizes prior work on Design Knowledge
