paper_id,title,authors,abstract,doi,year,venue,url,keyword,source_repos,abstract_quality,format_excluded,scope_excluded,c2,c3,fulltext_flag,c2_and_c3,disposition,advances_to_fulltext,primary_reason,val_reason,pdf_found,pdf_extract_method,full_text_chars,paragraph_count,matched_paragraph_count,discussion_found,discussion_paragraph_count,keyword_conditioned_paragraph_count,focus_keyword,embedding_model,text_view,cluster_method,cluster,cluster_theme_terms,umap_x,umap_y,distance_to_centroid,representative_rank,is_representative_top3,medoid_rank,lda_topic,lda_topic_probability,lda_topic_words,cluster_label_candidate,cluster_summary_candidate,facet_population_or_context,facet_stakeholder_or_population,facet_method_or_lens,facet_artifact_or_domain,facet_contribution_or_outcome,nearest_papers,design_knowledge_form,design_knowledge_action,design_knowledge_contribution
7f559689c730,Strong Technology-Enhanced Learning Concepts,"Prieto, L.P. (1); Alavi, H. (2); Verma, H. (3)","Although not unheard of, there is a scarcity of intermediate-level concepts (not as generalizable as theories, but with an applicability wider than a single technology or intervention) in technology-enhanced learning (TEL) research. In this paper we propose ‘strong TEL concepts’, as intermediate-level bodies of design knowledge that are both grounded in research evidence from multiple technologies and contexts, and have clear theoretical connections. We describe the main features of this kind of concepts, along with a practical method for developing them as valuable research contributions. We also propose ‘purposeful disengagement’ as an example of strong TEL concept, to ignite the dialogue in our community about the necessity and benefits of this kind of knowledge to support both TEL design and theory advancement.",10.1007/978-3-319-66610-5_42,,"Data Driven Approaches in Digital Education. 12th European Conference on Technology Enhanced Learning, EC-TEL 2017. Proceedings: LNCS 10474",,Design knowledge,engineering_village,full,False,False,True,True,False,True,advance_criteria,True,"Proposes and defines 'strong TEL concepts' as intermediate-level bodies of design knowledge grounded in multiple studies, both synthesizing constructs and providing an original definition.","The paper proposes and characterizes 'strong TEL concepts' as intermediate-level bodies of design knowledge grounded in prior research across contexts, thereby defining the construct and outlining a method for developing it from evidence.",False,,0,0,0,False,0,0,Design knowledge,tfidf-svd,method,kmeans,3,"recreation, nature, interactive technology, enhanced learning, cliche, hierarchical, intermediate, level",1.9036794,4.939973,0.2985108280654329,1,True,1,4,0.9773871642288045,"dsr, patterns, analysis, practices, discipline, future, propose, community",Synthesizes Design Knowledge into Shared Design Constructs,"This cluster synthesizes prior work on design knowledge, emphasizing how a design-knowledge construct is made explicit, organized, or put to work rather than only where it is applied. Related knowledge forms include Design Rules, Design Frameworks. The shared move also involves organization and classification and definition and conceptualization. Its contribution pattern is coded as Theoretical, Methodological, Taxonomy/Review. Representative papers include Strong Technology-Enhanced Learning Concepts; Toward a Framework for the Design of Interactive Technology for Nature Recreation.",,Designers,,,"Theoretical, Methodological, Taxonomy/Review","[{'paper_id': 'ef3a9300a2f3', 'title': 'Developing a competency taxonomy for teacher design knowledge in technology-enhanced learning environments: a literature review', 'cluster': 3, 'distance': 0.3298085441694204}, {'paper_id': '19dd6ec0253e', 'title': 'A principle-based philosophical framework for fashion design praxis and education in new design landscapes', 'cluster': 5, 'distance': 0.7022117565229816}, {'paper_id': '6aeae7ccf85b', 'title': 'Toward a Framework for the Design of Interactive Technology for Nature Recreation', 'cluster': 3, 'distance': 0.7056952883039103}, {'paper_id': '1401e17184c0', 'title': 'Software creation: cliche as intermediate knowledge in software design', 'cluster': 3, 'distance': 0.7355232978352282}, {'paper_id': 'a707fd62833a', 'title': 'Tracing the tensions surrounding understandings of agency and knowledge in technology design', 'cluster': 3, 'distance': 0.7483209625019882}]",Design Knowledge,synthesizes prior work on,synthesizes prior work on Design Knowledge
03adadfa0ad4,"Design Principles: Literature Review, Analysis, and Future Directions","Fu, K.K. (1); Yang, M.C. (2); Wood, K.L. (3)","Design principles are created to codify and formalize design knowledge so that innovative, archival practices may be communicated and used to advance design science and solve future design problems, especially the pinnacle, wicked, and grand-challenge problems that face the world and cross-cutting markets. Principles are part of a family of knowledge explication, which also include guidelines, heuristics, rules of thumb, and strategic constructs. Definitions of a range of explications are explored from a number of seminal papers. Based on this analysis, the authors pose formalized definitions for the three most prevalent terms in the literature—principles, guidelines, and heuristics—and draw more definitive distinctions between the terms. Current research methods and practices with design principles are categorized and characterized. We further explore research methodologies, validation approaches, semantic principle composition through computational analysis, and a proposed formal approach to articulating principles. In analyzing the methodology for discovering, deriving, formulating, and validating design principles, the goal is to understand and advance the theoretical basis of design, the foundations of new tools and techniques, and the complex systems of the future. Suggestions for the future of design principles research methodology for added rigor and repeatability are proposed.",10.1115/1.4034105,,Journal of Mechanical Design,,Design knowledge,engineering_village,full,False,False,True,True,False,True,advance_criteria,True,"Literature review treating design principles/guidelines/heuristics as its topic, synthesizing definitions from seminal papers and posing its own formalized definitions, satisfying C2 and C3.","The paper treats design principles and related knowledge explications as its topic, reviews and analyzes definitions from prior literature, and proposes formalized definitions of its own.",False,,0,0,0,False,0,0,Design knowledge,tfidf-svd,method,kmeans,4,"heuristics, usability, oriented, guidelines, formulation, object, sdk, utilization",1.7328632,2.7395005,0.4919904083570945,6,False,6,4,0.9773441807632386,"dsr, patterns, analysis, practices, discipline, future, propose, community",Synthesizes Design Principles into Shared Design Constructs,"This cluster synthesizes prior work on design principles, emphasizing how a design-knowledge construct is made explicit, organized, or put to work rather than only where it is applied. Related knowledge forms include Design Knowledge, Design Heuristics. The shared move also involves definition and conceptualization and translation into actionable guidance. Its contribution pattern is coded as Methodological, Theoretical, Artifact/System. Application and method terms are supporting facets, especially methods or lenses such as Design Science, Workshop and contexts such as Education / Learning, Workplace. Representative papers include Guidelines supporting the formulation of design principles; Design Principles for Boundary Spanning in Transdisciplinary Design Science Research.","Education / Learning, Workplace",Designers,"Design Science, Workshop","Interface, Tool","Methodological, Theoretical, Artifact/System","[{'paper_id': 'd4ef8c48ded5', 'title': 'Toward an Inventory of Plans and Patterns, and Their Use to Foster Strategic Knowledge in Programming Novices', 'cluster': 0, 'distance': 0.5129649567201306}, {'paper_id': '3dbca777664c', 'title': 'Design Principles for Boundary Spanning in Transdisciplinary Design Science Research', 'cluster': 4, 'distance': 0.5465372544114198}, {'paper_id': '39fee30eb03c', 'title': 'Cutting Cubes Out of Fog: The Whole View of Design', 'cluster': 1, 'distance': 0.6788445811115542}, {'paper_id': '9d158233f041', 'title': 'Guidelines supporting the formulation of design principles', 'cluster': 4, 'distance': 0.6854010376222318}, {'paper_id': '5a716d80ac6b', 'title': 'Towards a Method for Design Principle Development in Information Systems', 'cluster': 7, 'distance': 0.7070937468756336}]",Design Principles,synthesizes prior work on,synthesizes prior work on Design Principles
1b8c995dfc43,Seven design frames that teachers use when considering technological pedagogical content knowledge (TPACK),"Koh, J.H.L. (1); Ching Sing Chai (1)","Technological pedagogical content knowledge (TPACK) encapsulates teachers' pedagogical knowledge for the integration of information and communications technologies (ICT). It is created as teachers engage in collaborative talk during the design of ICT lessons. Design frames characterize teachers' design reasoning and can substantially influence teachers' TPACK considerations. Yet, this aspect of teachers' TPACK is not well understood. This study examined the design talk conducted by 27 Singapore primary teachers as they worked in teams to integrate student-centered ICT lessons into their school curriculum. Through content analysis and chi-square analyses of about 35 h of coded design talk, it was found that teachers used seven design frames and predominantly considered pedagogical content knowledge, TPACK, and design knowledge when they engaged in ICT lesson design. Teachers' consideration of pedagogical content knowledge was driven by design frames related to idea development, perception, enactment, institutional considerations, and interpersonal factors. On the other hand, teachers emphasized idea development and enactment when they considered TPACK. Teachers also had to consider the management of design processes during ICT lesson design. The implications for teacher ICT professional development are discussed. [All rights reserved Elsevier].",10.1016/j.compedu.2016.09.003,,Computers & Education,,Design knowledge,engineering_village,full,False,False,True,True,True,True,advance_criteria,True,"Identifies and characterizes seven 'design frames' that capture teachers' design reasoning, categorizing forms of design knowledge and defining the construct in its context; flagged to confirm from full text.","An empirical study of teachers' design talk and TPACK framing appears to study design reasoning rather than synthesize prior design-knowledge constructs, so C2/C3 are not confirmed from the abstract and it merits full-text review.",False,,0,0,0,False,0,0,Design knowledge,tfidf-svd,method,kmeans,5,"teachers, competence, transformation, generalization, tools, drones, documents, pedagogical",2.885602,5.4108095,0.6631036161685899,10,False,10,2,0.9665736981403606,"product, teachers, science, game, review, field, analysis, make",Synthesizes Design Knowledge into Shared Design Constructs,"This cluster synthesizes prior work on design knowledge, emphasizing how a design-knowledge construct is made explicit, organized, or put to work rather than only where it is applied. Related knowledge forms include Design Theory, Design Frameworks. The shared move also involves definition and conceptualization and capture and transfer. Its contribution pattern is coded as Theoretical, Methodological, Artifact/System. Application and method terms are supporting facets, especially methods or lenses such as Ontology, Thematic Analysis, Co-design and contexts such as Education / Learning. Representative papers include A theoretical framework for the studio as a learning environment; ANALYSIS OF DESIGN COMPETENCE OF FUTURE ENGINEER-TEACHERS.",Education / Learning,"Designers, Practitioners","Ontology, Thematic Analysis, Co-design",Tool,"Theoretical, Methodological, Artifact/System","[{'paper_id': 'a1ccc16dab98', 'title': 'ANALYSIS OF DESIGN COMPETENCE OF FUTURE ENGINEER-TEACHERS', 'cluster': 5, 'distance': 0.2072959446294803}, {'paper_id': 'ef3a9300a2f3', 'title': 'Developing a competency taxonomy for teacher design knowledge in technology-enhanced learning environments: a literature review', 'cluster': 3, 'distance': 0.7026044818236717}, {'paper_id': 'fd2392ff2aff', 'title': 'Surveying a Landscape of Ethics-Focused Design Methods', 'cluster': 1, 'distance': 0.8113809254361241}, {'paper_id': '1c7fa3f7d73a', 'title': 'A theoretical framework for the studio as a learning environment', 'cluster': 5, 'distance': 0.8202754435464403}, {'paper_id': 'ccc616a68c38', 'title': 'Towards Creating a Body of Evidence-based Interactive Digital Narrative Design Knowledge: Approaches and Challenges', 'cluster': 0, 'distance': 0.8495142202590354}]",Design Knowledge,synthesizes prior work on,synthesizes prior work on Design Knowledge
b0fe7e080516,Design knowledge representation: An ontological perspective,"Sanfilippo, Emilio M. (1, 2); Masolo, Claudio (1); Porello, Daniele (1)","We present a preliminary high-level formal theory, grounded on knowledge representation techniques and foundational ontologies, for the uniform and integrated representation of the different kinds of (qualitative and quantitative) knowledge involved in the designing process. We discuss the conceptual nature of engineering design by individuating and analyzing the involved notions. These notions are then formally characterized by extending the DOLCE foundational ontology. Our ultimate purpose is twofold: (i) to contribute to foundational issues of design; and (ii) to support the development of advanced modelling systems for (qualitative and quantitative) representation of design knowledge. Copyright ©2015 for the individual papers by the papers' authors.",,2015.0,CEUR Workshop Proceedings,,Design knowledge,engineering_village|semantic_scholar,full,False,False,True,True,True,True,advance_criteria,True,"Presents a formal ontological theory analyzing and characterizing kinds of design knowledge, defining the involved notions, plausibly satisfying C2 and C3.","The paper reviews literature on design knowledge representation, contrasts logicist approaches, and offers an overview toward an anti-logicist framework, which supports C2, but no explicit definition of design knowledge is evident from the abstract.",False,,0,0,0,False,0,0,Design knowledge,tfidf-svd,method,kmeans,3,"recreation, nature, interactive technology, enhanced learning, cliche, hierarchical, intermediate, level",2.8951879,2.6045618,0.5410945648742099,5,False,5,0,0.9689804544069536,"tacit, oriented, object, ontology, kinds, mechanisms, patterns, representation",Synthesizes Design Knowledge into Shared Design Constructs,"This cluster synthesizes prior work on design knowledge, emphasizing how a design-knowledge construct is made explicit, organized, or put to work rather than only where it is applied. Related knowledge forms include Design Rules, Design Frameworks. The shared move also involves organization and classification and definition and conceptualization. Its contribution pattern is coded as Theoretical, Methodological, Taxonomy/Review. Representative papers include Strong Technology-Enhanced Learning Concepts; Toward a Framework for the Design of Interactive Technology for Nature Recreation.",,Designers,,,"Theoretical, Methodological, Taxonomy/Review","[{'paper_id': '817a6d8c927b', 'title': 'KNOWLEDGE REPRESENTATION IN THE CONCEPTUAL DESIGN PROCESS FOR BUILDING ENERGY SYSTEMS.', 'cluster': 7, 'distance': 0.3245929481049835}, {'paper_id': '76d309f713b9', 'title': 'How industrial design knowledge differs from engineering design knowledge', 'cluster': 1, 'distance': 0.7261246799102787}, {'paper_id': 'c5d4c66275a8', 'title': 'Towards a Theory Driven Foundational Model for Design: Rethinking Requirement Elicitation for Special Needs', 'cluster': 5, 'distance': 0.7386890823691294}, {'paper_id': 'f6ba28a6efeb', 'title': 'ON the HIERARCHICAL LEVELS of DESIGN KNOWLEDGE', 'cluster': 3, 'distance': 0.7866824194170037}, {'paper_id': 'fffe50e033fa', 'title': 'Activity as the ultimate particular of interaction design', 'cluster': 7, 'distance': 0.8127345804929735}]",Design Knowledge,synthesizes prior work on,synthesizes prior work on Design Knowledge
e958310acab5,"Prescriptive knowledge in IS research: Conceptualizing design principles in terms of materiality, action, and boundary conditions","Chandra, Leona (1); Seidel, Stefan (1); Gregor, Shirley (2)","In the IS discipline, the formulation of design principles is an important vehicle to convey design knowledge that contributes beyond instantiations applicable in a limited context of use. However, their formulation still varies in terms of orientation, clarity, and precision. In this paper, we focus on the design of artifacts that are oriented towards human use, and we identify and analyze three orientations in the formulation of such design principles in IS journals - action oriented, materiality oriented, and both action and materiality oriented. We propose an effective and actionable formulation of design principles that is both clear and precise. © 2015 IEEE.",10.1109/HICSS.2015.485,2015.0,Proceedings of the Annual Hawaii International Conference on System Sciences,,Design knowledge,engineering_village|ieee,full,False,False,True,True,False,True,advance_criteria,True,"Analyzes and conceptualizes design principles as a vehicle for design knowledge in IS, synthesizing orientations from prior literature and proposing its own formulation, satisfying C2 and C3.","The paper explicitly conceptualizes design principles as prescriptive knowledge, analyzes orientations of their formulation in IS journals, and proposes an actionable formulation, satisfying both synthesis/categorization and definitional adaptation.",True,pdfplumber,52663,35,10,False,0,4,Design knowledge,tfidf-svd,method,kmeans,4,"heuristics, usability, oriented, guidelines, formulation, object, sdk, utilization",1.3474973,2.4292338,0.4727548673750711,4,False,4,1,0.9700605998694176,"article, practices, field, creation, forms, formulation, digital, dsr",Synthesizes Design Principles into Shared Design Constructs,"This cluster synthesizes prior work on design principles, emphasizing how a design-knowledge construct is made explicit, organized, or put to work rather than only where it is applied. Related knowledge forms include Design Knowledge, Design Heuristics. The shared move also involves definition and conceptualization and translation into actionable guidance. Its contribution pattern is coded as Methodological, Theoretical, Artifact/System. Application and method terms are supporting facets, especially methods or lenses such as Design Science, Workshop and contexts such as Education / Learning, Workplace. Representative papers include Guidelines supporting the formulation of design principles; Design Principles for Boundary Spanning in Transdisciplinary Design Science Research.","Education / Learning, Workplace",Designers,"Design Science, Workshop","Interface, Tool","Methodological, Theoretical, Artifact/System","[{'paper_id': '9d158233f041', 'title': 'Guidelines supporting the formulation of design principles', 'cluster': 4, 'distance': 0.19269634034318717}, {'paper_id': '3dbca777664c', 'title': 'Design Principles for Boundary Spanning in Transdisciplinary Design Science Research', 'cluster': 4, 'distance': 0.5444177645352585}, {'paper_id': 'fd2392ff2aff', 'title': 'Surveying a Landscape of Ethics-Focused Design Methods', 'cluster': 1, 'distance': 0.7035306638248076}, {'paper_id': '4effa8e553a8', 'title': 'Toward Engineering Design Principles for HCI', 'cluster': 4, 'distance': 0.7398372470484934}, {'paper_id': '78ea04e5eaee', 'title': 'Socio-technical design principles for a multi-stakeholder agriculture extension information system in Ethiopia', 'cluster': 0, 'distance': 0.8063878678317913}]",Design Principles,synthesizes prior work on,synthesizes prior work on Design Principles
1c7fa3f7d73a,A theoretical framework for the studio as a learning environment,"Brandt, Carol B. (1); Cennamo, Katherine (2); Douglas, Sarah (3); Vernon, Mitzi (4); McGrath, Margarita (5); Reimer, Yolanda (6)","In this article we describe a holistic, ecological framework that takes into account the surface structures and pedagogical approaches in the studio and how these elements are connected to the construction of design knowledge: epistemology. In our development of this framework, we came to understand how disciplinary underpinnings and academic culture shape the ways that studio is enacted. Using practice theory, we illustrate our framework with two examples - one in Industrial Design and another in Human Computer Interaction - that demonstrate the ways in which the studio can act as a bridge between academic and professional communities. We came to see the studio as a unique practice community that connects academic and professional contexts. We argue that successful implementation of studio-based learning involves an awareness of disciplinary canons, ontological approaches to knowledge, and the academic constraints on studio-based approaches to learning. © 2011 Springer Science+Business Media B.V.",10.1007/s10798-011-9181-5,2013.0,International Journal of Technology and Design Education,,Design knowledge,engineering_village,full,False,False,True,True,True,True,advance_criteria,True,"Develops a theoretical/ecological framework connecting the studio to the construction of design knowledge (epistemology), drawing on practice theory and prior work, plausibly satisfying C2 and C3; flagged to confirm definitional adaptation.","Presents a theoretical framework connecting studio pedagogy to the construction of design knowledge, but the abstract does not clearly show a synthesis from prior literature or an explicit definition, so full text is needed.",True,pdfplumber,58614,43,10,False,0,6,Design knowledge,tfidf-svd,method,kmeans,5,"teachers, competence, transformation, generalization, tools, drones, documents, pedagogical",3.6221163,4.5142827,0.4057682838057721,1,True,1,1,0.9720675798886066,"article, practices, field, creation, forms, formulation, digital, dsr",Synthesizes Design Knowledge into Shared Design Constructs,"This cluster synthesizes prior work on design knowledge, emphasizing how a design-knowledge construct is made explicit, organized, or put to work rather than only where it is applied. Related knowledge forms include Design Theory, Design Frameworks. The shared move also involves definition and conceptualization and capture and transfer. Its contribution pattern is coded as Theoretical, Methodological, Artifact/System. Application and method terms are supporting facets, especially methods or lenses such as Ontology, Thematic Analysis, Co-design and contexts such as Education / Learning. Representative papers include A theoretical framework for the studio as a learning environment; ANALYSIS OF DESIGN COMPETENCE OF FUTURE ENGINEER-TEACHERS.",Education / Learning,"Designers, Practitioners","Ontology, Thematic Analysis, Co-design",Tool,"Theoretical, Methodological, Artifact/System","[{'paper_id': '19dd6ec0253e', 'title': 'A principle-based philosophical framework for fashion design praxis and education in new design landscapes', 'cluster': 5, 'distance': 0.5419522244623587}, {'paper_id': 'fc4c2b9d38d7', 'title': 'A framework for supporting architecture knowledge and rationale management', 'cluster': 5, 'distance': 0.6833692452985394}, {'paper_id': '7f7baeb83bac', 'title': 'A theoretical framework on embodiment in digital design', 'cluster': 5, 'distance': 0.6845377415003893}, {'paper_id': '364b7d9127ec', 'title': 'Toward a Unified Model of Design Knowledge', 'cluster': 5, 'distance': 0.7429478912986969}, {'paper_id': 'c5d4c66275a8', 'title': 'Towards a Theory Driven Foundational Model for Design: Rethinking Requirement Elicitation for Special Needs', 'cluster': 5, 'distance': 0.7518942027002606}]",Design Knowledge,synthesizes prior work on,synthesizes prior work on Design Knowledge
