paper_id,title,authors,abstract,doi,year,venue,url,keyword,source_repos,abstract_quality,format_excluded,scope_excluded,c2,c3,fulltext_flag,c2_and_c3,disposition,advances_to_fulltext,primary_reason,val_reason,pdf_found,pdf_extract_method,full_text_chars,paragraph_count,matched_paragraph_count,discussion_found,discussion_paragraph_count,keyword_conditioned_paragraph_count,focus_keyword,embedding_model,text_view,cluster_method,cluster,cluster_theme_terms,umap_x,umap_y,distance_to_centroid,representative_rank,is_representative_top3,medoid_rank,lda_topic,lda_topic_probability,lda_topic_words,cluster_label_candidate,cluster_summary_candidate,facet_population_or_context,facet_stakeholder_or_population,facet_method_or_lens,facet_artifact_or_domain,facet_contribution_or_outcome,nearest_papers,design_knowledge_form,design_knowledge_action,design_knowledge_contribution
e8a17b6120e4,Designing as reflective conversation with the materials of a design situation,"Schon, D.A. (1)","The paper considers what it means to capture design knowledge by embodying it in procedures that are expressible in a computer program, distinguishing several possible purposes for such an exercise. It goes on to describe design phenomena that a computational strategy would have to reproduce. All of them are integral to a view of designing as reflective conversation with the materials of a design situation, and depend on the idea of distinctive design worlds constructed by the designer. These phenomena include: the designer's seeing-moving-seeing, the construction of figures from marks on a page, the appreciation of design qualities, the evolution of design intentions in the course of the design process, the recognition of unintended consequences of move experiments, the storage and deployment of prototypes, which must be placed in transaction with the design situation, and communication across divergent design worlds.",10.1016/0950-7051(92)90020-G,,Knowledge-Based Systems,,Design knowledge,engineering_village,full,False,False,True,True,True,True,advance_criteria,True,"Examines what it means to capture design knowledge and characterizes design phenomena/worlds conceptually, plausibly satisfying C2/C3 but warranting full-text confirmation.","The abstract centrally discusses systematization of design knowledge within an intelligent CAD environment, but it is unclear from the abstract alone whether this is a synthesis from prior work or includes an explicit definition.",False,,0,0,0,False,0,0,Design knowledge,tfidf-svd,method,kmeans,0,"game, patterns, practices, stack, language, situation, anatomy, evidence",2.510466,2.9578886,0.6491446139969872,8,False,8,1,0.9357165027220464,"article, practices, field, creation, forms, formulation, digital, dsr",Evaluates Design Knowledge Through Empirical Evidence,"This cluster evaluates with evidence design knowledge, emphasizing how a design-knowledge construct is made explicit, organized, or put to work rather than only where it is applied. Related knowledge forms include Design Patterns, Design Theory. The shared move also involves definition and conceptualization and synthesis of prior work. Its contribution pattern is coded as Methodological, Empirical, Artifact/System. Application and method terms are supporting facets, especially methods or lenses such as Design Science and contexts such as Education / Learning. Representative papers include The Dark Patterns Knowledge Stack: Exploring New Ways to Negotiate Context, Law, and Design; The anatomy of HCI design patterns.",Education / Learning,"Designers, Practitioners",Design Science,"Game, Interface, Tool","Methodological, Empirical, Artifact/System","[{'paper_id': '82f49b5a1905', 'title': 'SOLUTION REPERTOIRE', 'cluster': 0, 'distance': 0.6342327386426295}, {'paper_id': '0b7e6111aa14', 'title': 'Synthesizing a Solution Space for Prescriptive Design Knowledge Codification', 'cluster': 2, 'distance': 0.7319890122082876}, {'paper_id': 'c90163fa7f57', 'title': 'A new model to express and capture the design rationale in the documents', 'cluster': 5, 'distance': 0.8734451623618487}, {'paper_id': 'd4ef8c48ded5', 'title': 'Toward an Inventory of Plans and Patterns, and Their Use to Foster Strategic Knowledge in Programming Novices', 'cluster': 0, 'distance': 0.8844569221244044}, {'paper_id': 'ccc616a68c38', 'title': 'Towards Creating a Body of Evidence-based Interactive Digital Narrative Design Knowledge: Approaches and Challenges', 'cluster': 0, 'distance': 0.9137556990245962}]",Design Knowledge,evaluates with evidence,evaluates with evidence Design Knowledge
5000c5049cbd,Learning design knowledge as generalization,"Li, Heng (1); Wu, Xindong (1)","Generalizing design knowledge is a process of extracting knowledge from design-provided data. Although it is one of the most common ways of 'learning' design knowledge, generalization has a fundamental weakness: except for special occasions, the results of generalization can never be validated. Inquiries into generalization have therefore dealt with questions of what are the best criteria for guiding the generalization. This paper argues that generalizing design knowledge involves three essential tasks; knowledge representation, a description language for design examples, and generalization operators. An application of generalizing empirical networks from design examples is described to illustrate these three tasks in the development of a generalization system.",,1998.0,Cybernetics and Systems,,Design knowledge,engineering_village|semantic_scholar,full,False,False,True,True,True,True,advance_criteria,True,"Examines learning/generalizing design knowledge as its topic and discusses knowledge representation and description language constructs, suggesting characterization and possible definitions warranting full-text review.","The paper centrally discusses generalizing design knowledge and appears to characterize essential tasks in that process, but the abstract does not clearly confirm a literature synthesis or an explicit adapted/original definition.",False,,0,0,0,False,0,0,Design knowledge,tfidf-svd,method,kmeans,5,"teachers, competence, transformation, generalization, tools, drones, documents, pedagogical",4.6084104,2.688844,0.755401595036121,18,False,18,5,0.9476566388233704,"platform, types, digital, literature, domain, form, quality, ontology",Synthesizes Design Knowledge into Shared Design Constructs,"This cluster synthesizes prior work on design knowledge, emphasizing how a design-knowledge construct is made explicit, organized, or put to work rather than only where it is applied. Related knowledge forms include Design Theory, Design Frameworks. The shared move also involves definition and conceptualization and capture and transfer. Its contribution pattern is coded as Theoretical, Methodological, Artifact/System. Application and method terms are supporting facets, especially methods or lenses such as Ontology, Thematic Analysis, Co-design and contexts such as Education / Learning. Representative papers include A theoretical framework for the studio as a learning environment; ANALYSIS OF DESIGN COMPETENCE OF FUTURE ENGINEER-TEACHERS.",Education / Learning,"Designers, Practitioners","Ontology, Thematic Analysis, Co-design",Tool,"Theoretical, Methodological, Artifact/System","[{'paper_id': '02381ea80183', 'title': 'A design theory for data quality tools in data ecosystems: Findings from three industry cases', 'cluster': 7, 'distance': 0.5041685999705232}, {'paper_id': '07eb3166d706', 'title': 'A Typology of Knowledge Creation in Design Science Research Projects', 'cluster': 2, 'distance': 0.6417119996101112}, {'paper_id': '8f065cfd18a4', 'title': 'Pattern language: A framework for learning', 'cluster': 0, 'distance': 0.7809068605069925}, {'paper_id': '1c7fa3f7d73a', 'title': 'A theoretical framework for the studio as a learning environment', 'cluster': 5, 'distance': 0.8199031421007638}, {'paper_id': 'c5d4c66275a8', 'title': 'Towards a Theory Driven Foundational Model for Design: Rethinking Requirement Elicitation for Special Needs', 'cluster': 5, 'distance': 0.8222349002295959}]",Design Knowledge,synthesizes prior work on,synthesizes prior work on Design Knowledge
37f353dbe230,Managing design knowledge,"Neelamkavil, J. (1)","The great ancient philosopher Confucius once said: 'real knowledge is to know the extent of one's ignorance'. Industries are recognizing the strategic value of knowledge and the careful management and distribution of their intellectual assets across the company to create value and to gain/sustain competitive advantage. In any organization, the data, information and experience that make-up the knowledge repository is really corporate assets. So what is knowledge? The first part of this paper differentiates between the terms such as 'data', 'information' and 'knowledge'. It will also differentiate between 'explicit' vs. 'tacit' knowledge, and how to derive explicit knowledge from its tacit form. The second part of the paper addresses the important issue of design knowledge management. Study has indicated that design engineers spend, on average, about one quarter of their time searching for information. Managing design knowledge, how such knowledge can be identified, captured, represented and stored for future use are vital issues, as three-quarters of all engineering designs are variations of existing designs. The paper also outlines the architecture of the design knowledge management system that is being developed at IMTI.",,,Proceedings of the IASTED International Conference Intelligent Systems and Control,,Design knowledge,engineering_village,full,False,False,True,True,True,True,advance_criteria,True,"Differentiates data/information/knowledge and addresses what design knowledge is, suggesting definitional and synthesis work, though full text would confirm.","This paper centers on learning design knowledge in situ and may discuss how such knowledge is represented, but the abstract does not clearly confirm synthesis from prior work or an explicit definition.",False,,0,0,0,False,0,0,Design knowledge,tfidf-svd,method,kmeans,7,"hri, designerly, ecosystems, make, data quality, arguments, toulmin, objects",4.627422,3.1390247,0.516936974330381,2,True,2,1,0.9399001435808012,"article, practices, field, creation, forms, formulation, digital, dsr",Synthesizes Design Knowledge into Shared Design Constructs,"This cluster synthesizes prior work on design knowledge, emphasizing how a design-knowledge construct is made explicit, organized, or put to work rather than only where it is applied. Related knowledge forms include Design Principles, Design Theory. The shared move also involves definition and conceptualization and representation and documentation. Its contribution pattern is coded as Theoretical, Artifact/System, Methodological. Representative papers include Immodest Proposals: Research Through Design and Knowledge; Managing design knowledge.",,"Designers, Practitioners",,Tool,"Theoretical, Artifact/System, Methodological","[{'paper_id': '02381ea80183', 'title': 'A design theory for data quality tools in data ecosystems: Findings from three industry cases', 'cluster': 7, 'distance': 0.4676219439231706}, {'paper_id': 'c058d036363a', 'title': 'What designers know', 'cluster': 6, 'distance': 0.7224108244411147}, {'paper_id': '5a716d80ac6b', 'title': 'Towards a Method for Design Principle Development in Information Systems', 'cluster': 7, 'distance': 0.7328836405420516}, {'paper_id': 'd6b2bf339ae4', 'title': 'Co-producing, curating, and defining design knowledge in an online practitioner community', 'cluster': 0, 'distance': 0.734994308246885}, {'paper_id': '33444d31c6dc', 'title': 'A design theory for visual inquiry tools', 'cluster': 5, 'distance': 0.7791676458106876}]",Design Knowledge,synthesizes prior work on,synthesizes prior work on Design Knowledge
18d57211cb40,Object oriented design knowledge: ontology and measurement of impact,"Garzas, J. (1); Piattini, M.","It has been a long time since the appearance of the object oriented (OO) paradigm. From that moment, the designers have accumulated much knowledge in the design and construction of OO systems. Patterns are the most refined OO design knowledge. However, there are many other kinds of knowledge that are not yet classified and formalized. We distinguish and classify the following categories: principles, heuristics, patterns and refactorings. We propose an ontology for object oriented design knowledge and a measure of impact for patterns, two key elements to create a method based on knowledge.",,,"Object-Oriented Information Systems. 8th International Conference, OOIS 2002. Proceedings (Lecture Notes in Computer Science Vol.2425)",,Design knowledge,engineering_village,full,False,False,True,True,False,True,advance_criteria,True,"Classifies OO design knowledge into principles, heuristics, patterns, and refactorings and proposes an ontology, synthesizing and defining design knowledge constructs.","Explicitly distinguishes and classifies categories of object-oriented design knowledge and proposes an ontology, satisfying both synthesis/categorization and definitional framing of design knowledge constructs.",False,,0,0,0,False,0,0,Design knowledge,tfidf-svd,method,kmeans,4,"heuristics, usability, oriented, guidelines, formulation, object, sdk, utilization",1.4649947,3.5009122,0.6384499694691912,12,False,12,0,0.980109366952582,"tacit, oriented, object, ontology, kinds, mechanisms, patterns, representation",Synthesizes Design Principles into Shared Design Constructs,"This cluster synthesizes prior work on design principles, emphasizing how a design-knowledge construct is made explicit, organized, or put to work rather than only where it is applied. Related knowledge forms include Design Knowledge, Design Heuristics. The shared move also involves definition and conceptualization and translation into actionable guidance. Its contribution pattern is coded as Methodological, Theoretical, Artifact/System. Application and method terms are supporting facets, especially methods or lenses such as Design Science, Workshop and contexts such as Education / Learning, Workplace. Representative papers include Guidelines supporting the formulation of design principles; Design Principles for Boundary Spanning in Transdisciplinary Design Science Research.","Education / Learning, Workplace",Designers,"Design Science, Workshop","Interface, Tool","Methodological, Theoretical, Artifact/System","[{'paper_id': 'a140a90ce7b9', 'title': 'The object-oriented design knowledge ontology', 'cluster': 7, 'distance': 0.0394123343187317}, {'paper_id': '495817cc9c25', 'title': 'Object-oriented design knowledge: Principles, heuristics and best practices', 'cluster': 4, 'distance': 0.3595844614308199}, {'paper_id': '6d926f3c4a97', 'title': 'A domain reference ontology for design science research knowledge bases', 'cluster': 2, 'distance': 0.8108778025492867}, {'paper_id': 'e958310acab5', 'title': 'Prescriptive knowledge in IS research: Conceptualizing design principles in terms of materiality, action, and boundary conditions', 'cluster': 4, 'distance': 0.836174519180966}, {'paper_id': '3dbca777664c', 'title': 'Design Principles for Boundary Spanning in Transdisciplinary Design Science Research', 'cluster': 4, 'distance': 0.8609881130725323}]",Design Principles,synthesizes prior work on,synthesizes prior work on Design Principles
1401e17184c0,Software creation: cliche as intermediate knowledge in software design,"Abolhassani, H. (1); Hui Chen (1); Koono, Z. (1)","This paper reports on cliche and related mechanisms appearing in the human design of software. During studies on human design knowledge, the authors found frequent instances of the same pattern of detailing, named cliche. In our study, cliche is an intermediate level of design knowledge, during a hierarchical detailing step, residing between simple reuse and creation by micro design rules, which have already been reported. These three kinds of design knowledge are of various types and have different complexities. Discussions of them, focusing on cliche type, with procedures of formation of a simple cliche skeleton and generation of a cliche are given. The studies show a working model of Zipf's principle.",,,IEICE Transactions on Information and Systems,,Design knowledge,engineering_village,full,False,False,True,True,True,True,advance_criteria,True,"Studies and categorizes kinds of human design knowledge (cliche, reuse, micro design rules) and defines cliche as an intermediate level of design knowledge, plausibly satisfying C2 and C3.","The paper discusses structuring design knowledge and abductive reasoning for design synthesis, but the abstract does not clearly show a synthesis from prior literature or an explicit definition, so it should be routed to full-text review.",False,,0,0,0,False,0,0,Design knowledge,tfidf-svd,method,kmeans,3,"recreation, nature, interactive technology, enhanced learning, cliche, hierarchical, intermediate, level",3.1473773,2.1891725,0.5726218059263142,6,False,6,1,0.9664374051270505,"article, practices, field, creation, forms, formulation, digital, dsr",Synthesizes Design Knowledge into Shared Design Constructs,"This cluster synthesizes prior work on design knowledge, emphasizing how a design-knowledge construct is made explicit, organized, or put to work rather than only where it is applied. Related knowledge forms include Design Rules, Design Frameworks. The shared move also involves organization and classification and definition and conceptualization. Its contribution pattern is coded as Theoretical, Methodological, Taxonomy/Review. Representative papers include Strong Technology-Enhanced Learning Concepts; Toward a Framework for the Design of Interactive Technology for Nature Recreation.",,Designers,,,"Theoretical, Methodological, Taxonomy/Review","[{'paper_id': '95eee570b8f1', 'title': 'Accumulating design knowledge: A mechanisms-based approach', 'cluster': 2, 'distance': 0.46595495500634176}, {'paper_id': '8f065cfd18a4', 'title': 'Pattern language: A framework for learning', 'cluster': 0, 'distance': 0.6607411484257233}, {'paper_id': 'f6ba28a6efeb', 'title': 'ON the HIERARCHICAL LEVELS of DESIGN KNOWLEDGE', 'cluster': 3, 'distance': 0.6916339165559753}, {'paper_id': 'cda6c6785f0a', 'title': 'The design of social drones: a review of studies on autonomous flyers in inhabited environments', 'cluster': 5, 'distance': 0.7169074744975887}, {'paper_id': '7f559689c730', 'title': 'Strong Technology-Enhanced Learning Concepts', 'cluster': 3, 'distance': 0.7355232978352282}]",Design Knowledge,synthesizes prior work on,synthesizes prior work on Design Knowledge
fc4c2b9d38d7,A framework for supporting architecture knowledge and rationale management,"Babar, Muhammad Ali (1); Gorton, Ian (1); Kitchenham, Barbara (1)","There is growing recognition of the importance of documenting and managing background knowledge about architecture design decisions. However, there is little guidance on the types of information that form Architecture Design Knowledge (ADK), how to make implicitly described ADK explicit, and how such knowledge can be documented to improve architecture processes. We propose a framework that provides a support mechanism to capture and manage ADK. We analyze ze different approaches to capturing tacit and implicit design knowledge describe a process of extracting ADK from patterns and an effective way of documenting it. We also present a data model to characterize architecture design primitives used or generated during architecture design and evaluation. This data model can be tailored to implement repositories of ADK. We complete this chapter with open issues that architecture research must confront in order to successfully transfer technology for capturing design rationale to the industry. © Springer-Verlag Berlin Heidelberg 2006.",10.1007/978-3-540-30998-7_11,2006.0,Rationale Management in Software Engineering,,Design knowledge,engineering_village,full,False,False,True,True,True,True,advance_criteria,True,"Defines Architecture Design Knowledge and types of information forming it, and analyzes approaches to capturing tacit/implicit design knowledge, plausibly satisfying C2 and C3 though full text needed to confirm.","The paper focuses on architecture design knowledge and analyzes approaches and information types for capturing and managing it, indicating synthesis/categorization, but no explicit definition/adaptation is clearly stated in the abstract.",False,,0,0,0,False,0,0,Design knowledge,tfidf-svd,method,kmeans,5,"teachers, competence, transformation, generalization, tools, drones, documents, pedagogical",3.437241,4.2716713,0.6864897268150788,15,False,15,4,0.9720526866045868,"dsr, patterns, analysis, practices, discipline, future, propose, community",Synthesizes Design Knowledge into Shared Design Constructs,"This cluster synthesizes prior work on design knowledge, emphasizing how a design-knowledge construct is made explicit, organized, or put to work rather than only where it is applied. Related knowledge forms include Design Theory, Design Frameworks. The shared move also involves definition and conceptualization and capture and transfer. Its contribution pattern is coded as Theoretical, Methodological, Artifact/System. Application and method terms are supporting facets, especially methods or lenses such as Ontology, Thematic Analysis, Co-design and contexts such as Education / Learning. Representative papers include A theoretical framework for the studio as a learning environment; ANALYSIS OF DESIGN COMPETENCE OF FUTURE ENGINEER-TEACHERS.",Education / Learning,"Designers, Practitioners","Ontology, Thematic Analysis, Co-design",Tool,"Theoretical, Methodological, Artifact/System","[{'paper_id': '8f065cfd18a4', 'title': 'Pattern language: A framework for learning', 'cluster': 0, 'distance': 0.6008378939944994}, {'paper_id': '2a3139d14895', 'title': 'What is design knowledge from the viewpoint of CPM/PDD?', 'cluster': 1, 'distance': 0.6722016361243759}, {'paper_id': '1c7fa3f7d73a', 'title': 'A theoretical framework for the studio as a learning environment', 'cluster': 5, 'distance': 0.6833692452985394}, {'paper_id': '19dd6ec0253e', 'title': 'A principle-based philosophical framework for fashion design praxis and education in new design landscapes', 'cluster': 5, 'distance': 0.7700641983357229}, {'paper_id': '37f353dbe230', 'title': 'Managing design knowledge', 'cluster': 7, 'distance': 0.7871241090038408}]",Design Knowledge,synthesizes prior work on,synthesizes prior work on Design Knowledge
