paper_id,title,authors,abstract,doi,year,venue,url,keyword,source_file,source_repos,abstract_quality,format_excluded,scope_excluded,c2,c3,fulltext_flag,c2_and_c3,disposition,advances_to_fulltext,primary_reason,val_reason,pdf_found,pdf_path,pdf_extract_method,full_text_chars,paragraph_count,matched_paragraph_count,extracted_context,discussion_found,discussion_paragraph_count,discussion_summary,discussion_excerpt,discussion_full,extraction_terms,keyword_conditioned_context,keyword_conditioned_paragraph_count,focus_keyword,embedding_model,text_view,cluster_method,cluster,cluster_theme_terms,umap_x,umap_y,distance_to_centroid,representative_rank,is_representative_top3,medoid_rank,lda_topic,lda_topic_probability,lda_topic_words,cluster_label_candidate,cluster_summary_candidate,facet_population_or_context,facet_stakeholder_or_population,facet_method_or_lens,facet_artifact_or_domain,facet_contribution_or_outcome,nearest_papers
7ebbe03ea0d8,Autobiographical design in HCI research: designing and learning through use-it-yourself,"Neustaedter, Carman and Sengers, Phoebe","Designing a system with yourself as a target user and evaluating the design through your own self-usage is commonly considered a questionable approach in HCI research. Perhaps for this reason, HCI research including extensive self-usage of a design is underdocumented. Yet such self-usage does happen and many researchers have found great value in the lessons learned from it. Our goal in this paper is to bring these hidden practices to light and offer guidelines for how HCI researchers can usefully engage in what we term 'autobiographical design'---design research drawing on extensive, genuine usage by those creating or building a system. Through interviews with HCI experts who have engaged in variations of autobiographical design, we draw out the possibilities and limitations of autobiographical design methods and lay out best practices for its use as an HCI research method.",10.1145/2317956.2318034,2012,Proceedings of the Designing Interactive Systems Conference,https://doi.org/10.1145/2317956.2318034,Design methods,design_methods.bib,acm|engineering_village,full,False,False,True,True,True,True,advance_criteria,True,"Documents hidden self-usage practices, defines and offers guidelines for the construct 'autobiographical design' as a design research method, suggesting C2 and C3; flagged to confirm in full text.","Treats autobiographical design as the topic, brings hidden practices to light, and offers guidelines while explicitly naming and framing the construct, satisfying synthesis/categorization and definitional adaptation criteria.",True,/Users/baiyixin/Downloads/pdf_386/2317956.2318034.pdf,pdfplumber,49272,33,10,"Through interviews with HCI lessons from media spaces based on technologists’ use of experts who have engaged in variations of autobiographical their own systems or that of their colleagues, based on design, we draw out the possibilities and limitations of intensive and authentic self-usage (e.g., [7,16,33]). autobiographical design methods and lay out best practices Despite these examples of learning and designing through for its use as an HCI research method. self-usage, we know of few accounts of this as a reported HCI research method (the notable exception is [17]). In Author Keywords fact, HCI research methodologies focusing on researchers’ Autobiographical design; design research methods own experiences as users of a system may seem heretical to both the ethical goal of user-centered design and the ACM Classification Keywords epistemological goal of basing research in HCI on H.5.2 [Information interfaces and presentation]: User Interfaces – Evaluation/methodology; objective, third-party knowledge. Yet self-usage by researchers does happen, whether it is reported or not. Thus, as a community, we feel it is important that we better INTRODUCTION User-centered design is a cornerstone of the field of HCI, understand this method and how it should be used. since incorporating users in the design process can lead to Our goal, then, is to shed light on the research practice that better systems [35]. There are many methods for we term autobiographical design: design research incorporating end users into design research, ranging from drawing on extensive, genuine usage by those creating or participatory design to lab or field evaluations [35]. There building the system.

(By ‘genuine’ usage we mean it is are also design methods that focus on individual, based on true needs of the researchers, rather than them idiosyncratic experiences as a basis for design. Cooper, for pretending to have needs expected of targeted users). We example, emphasizes “designing for one” through creating chose the term ‘autobiographical design’ as we felt a core personas, or fictional characterizations of specific users attribute of the method is that a researcher or designer’s [11]. Others argue that designers should focus on nonown experiences are embodied in the design of a system typical users such as extreme characters [14], atypical user and its exploration. That is, as the researcher(s) build the groups [23], or lead users [42] as a source of innovation. system, they use it themselves, learn about the design space, and evaluate and iterate the design based on their own experiences. Within this definition, there are certainly nuances, and our paper explores these. personal or classroom use is granted without fee provided that copies are not made or distributed for profit or commercial advantage and that copies Our interest in this topic began with our own projects. bear this notice and the full citation on the first page. To copy otherwise, Neustaedter designed two systems for himself and his or republish, to post on servers or to redistribute to lists, requires prior specific permission and/or a fee. family, using and studying each system over the course of a DIS 2012, June 11-15, 2012, Newcastle, UK. year [27,34]. Sengers used a similar approach for three 514

autobiographical design was marked by intensive tinkering We argue, then, that autobiographical design as an HCI in response to our personal experiences with the system, research method can help combat this problem. In many including moments where our own use surprised us. In situations autobiographical design can provide detailed, contrast to most of the respondents, we both used extensive nuanced, and experiential understanding of a design space. data collection including tracking system usage, This can be done early in the design process to tinker with documenting changes to the code, and communal blogs an idea, over extended periods of time from months to years shared among project participants to keep track of our to learn about long-term adoption and real usage, and when developing experiences with the system. Sengers recruited it might otherwise be difficult to deploy a design because of an outside evaluator to collect and co-analyze this data. technical complexities. Genuine usage is hard to come by in Neustaedter did subsequent user studies to validate his the early design stages through typical user-centered design findings but found they confirmed what he already knew. practices, but can be accessed through autobiographical In understanding the implications of autobiographical design. Such genuine usage supports reflection-in-action design, we first draw a distinction between design practice [39] and, as argued by our respondents, allows researchers that focuses on creating innovative designs, and design to draw on intuitions and nuances of experience that escape research that also produces new social, cultural, and/or formal analysis. technical understanding through design and its evaluation Yet, as our results show, there are clearly also situations [45].

DIS 2012 • In the Wild June 11–15, 2012 • Newcastle, UK questions of what we know are tied to questions about how For example, ethnographic methods focus on the we should know and what we view research to be. Here, articulation of cultural practices over long periods of time our respondents varied. Some respondents reported trying including reports on the ethnographer’s own experiences to find ways to minimize bias and to establish objective while culturally immersed. This is similar in some ways to findings. Other respondents were less concerned with autobiographical design; however, ethnography does not objectivity and more interested in the unique experiential typically include design work or design iteration. Like dimensions opened through autobiographical practices. autobiographical design, designerly techniques such as These different views potentially tie to different accounts of cultural probes [19] can provide design inspiration and HCI, as scientific research establishing truths of interaction sometimes even experiential understanding. However, (typically tied to behavioral science) or as interpretive autobiographical design includes the actual creation and research revealing alternative perspectives and new iteration of a design as part of its methodological process, possibilities for design (typically tied to design and whereas cultural probes do not. This is not to say that ethnography) [25]. Yet, as an anonymous reviewer pointed autobiographical design is better than these and other out, autobiographical design also ties to a crafts tradition research methods, but that it has its own strengths and reflected not only in design but also in computer science, properties. which values hands-on tinkering as a way of knowing.

In practical terms, other approaches to complement autobiographical design: you're just not going to get that kind of data from someone who just signed up for the process...if you're trying to study “What you really want to do is get people to do these things in the long term, then you may end up having autobiographical design and have them be able to say, to use this type of approach for practical reasons."" okay, I know I am doing this for myself, I know one of the almost inevitable consequences of this is that its going to Erickson argues that this long term, real usage helps work really well for me but there are going to be other understand practice holistically: users or teams that use it in ways that I don’t expect and so ""Life isn't very well segmented or siloed. In reality, [our] what can I do to think about ways to generalize it. You can daily practices bleed across boundaries. I think the genuine do everything from traditional methods like heuristic use allows you to tap into that and build applications or evaluation... you can do end user testing… there are lots of systems that are more permeable in some sense, that ways to address some of the shortcomings of accommodate the fluidity of your everyday use.” autobiographical design as long as you’re aware of the shortcomings in the first place.” Record keeping and data collection unusual Most respondents reported keeping no explicit, formalized Gaver suggests that autobiographical design provides other records of their own use. Gaver, for example, who had not worthy lessons not focused on generalizability. intended for his system to be research, reported that his first “[I]f what you’re trying to do with it is to generalize to written records were the final research paper.

DIS 2012 • In the Wild June 11–15, 2012 • Newcastle, UK years to design and evaluate a social system for the Our interviews should be understood as an intellectual workplace [5]. Our stance in coming to autobiographical discussion with experts in the area as opposed to a social design was different; Sengers had intended this as a central science study. As such, participation was non-anonymous, concept of her project, while Neustaedter had used allowing us to credit participants for their intellectual autobiographical design simply as an early exploratory contributions, to discuss their work in detail, and to help method and was surprised to discover how much he readers evaluate their qualifications. In our results section, learned. While our experiences had clearly demonstrated we describe participants’ views on autobiographical design; value in autobiographical design, our case studies were not in the discussion section we present our own conclusions. enough to understand the full scope, possibilities, and limitations of the method. Thus, we interviewed other HCI Interview Method experts who engaged in self-usage as part of their design While the interviews were a form of intellectual research. Based on our interviews and our own experiences, conversation, this was not simply an informal chat amongst we analyze the strengths and weaknesses of the method, friends. Prior to our interviews we developed a set of articulate best practices for applying the method, and argue common interview questions. We piloted these questions by that, and under which circumstances, autobiographical interviewing each other, as we were previously unfamiliar design can be a useful and suitable HCI research method. with each other’s work in the area.

Other other people and… make a product or something like that, respondents described similar stories: because then yeah, you want to test it out with other people. But in autobiographical design was not considered an accepted the case of the Video Window, especially when I wrote that research method, they often did not see the need to keep paper, I wrote that as an autobiographical piece where I written or visual records of their usage. Typically, the only was trying to talk about my particular experience with that real record of usage was the actual design changes made to piece. I feel like people can draw their own lessons from the system as a result. Sometimes these were recorded in that in the way you do for any particular case study.” code repositories, but these records were typically not looked back on to understand design usage or evolution. In the next sections, we look at the understandings that autobiographical design can provide. The only respondent to keep explicit records was Erickson, who emphasized the importance of this in his comments: Autobiographical design reveals ‘big effects’ Respondents found that autobiographical design allowed “I tried to be disciplined about this. One thing I tried to do them to see “big effects”—major things that could make or was keep regular notes on how I was using it and break a system, and genuine, as opposed to discretionary, reflections on it…what surprised me and what didn't, what needs. For example, in Greenberg’s case, he learned within worked and what didn't…one other thing that is very useful days of using his MEdia Space that camera placement was is the ability to look back. So, for example, at some point, critical for its success.

fundamental problems, but I think it is much less useful in cases where you are trying to build a system that is Detailed and experiential understanding [replacing an existing system]. Things don't occur to you in Several respondents felt that autobiographical design initial design because the space isn't well understood and allowed them to uncover detailed, subtle understandings its only when you actually have the system in place that you that they likely wouldn't have found with other userdiscover what the fundamental flaws are and what the centered design techniques because they might seem possibilities are.""- Whittaker unremarkable. Some participants described this as personal, experiential knowledge that they developed through Several respondents told us that autobiographical design led autobiographical design. This was enabled both because of to uniquely new design ideas. Although autobiographical the large amount and quality of time they spent with the design was generally said to support innovation, Cosley and system (perhaps equivalent to an ethnographer living at a Erickson felt autobiographical design could hurt innovation user’s home or shadowing them throughout their workday) if a designer focuses too strongly on a single perspective. and also because of their first-person perspective on it [see also 26]. Outsider perspectives are useful (sometimes) As a counterbalance to the aspects of autobiographical Abowd, for example, said that his motivation for designing design focused on oneself, some respondents said it can be a system for his own autistic son was to understand this helpful to have non-users (e.g., colleagues, supervisors, space deeply before he designed for others.

DIS 2012 • In the Wild June 11–15, 2012 • Newcastle, UK Autobiographical Design in HCI Research: Designing and Learning through Use-It-Yourself Carman Neustaedter Phoebe Sengers School of Interactive Arts + Technology Information Science Simon Fraser University Cornell University Surrey, BC, Canada Ithaca, NY, USA carman_neustaedter@sfu.ca sengers@cs.cornell.edu ABSTRACT But what about when those individual users are the Designing a system with yourself as a target user and researchers or designers themselves? Nobody would contest evaluating the design through your own self-usage is that designers, developers, and researchers frequently use commonly considered a questionable approach in HCI their own systems during design in order to test concepts, research. Perhaps for this reason, HCI research including learn through actual usage, or find and fix software bugs. In extensive self-usage of a design is underdocumented. Yet fact, many would argue this is an important step before such self-usage does happen and many researchers have putting the design before other end users. Though never found great value in the lessons learned from it. Our goal in truly formalized as a research method, such “eat your own this paper is to bring these hidden practices to light and dog food” methods have been applied in industry for years offer guidelines for how HCI researchers can usefully [10,15]. Beyond this, some systems are used throughout engage in what we term ‘autobiographical design’—design their design based on designers’ or researchers’ real needs. research drawing on extensive, genuine usage by those For example, early research from CSCW reported many creating or building a system.

Questions asked respondents to describe systems they had designed that We caution that we are not articulating a “dogfooding” involved self-usage, the design process of one of these approach. As we will describe, autobiographical design systems in detail, and their thoughts about autobiographical goes beyond simply using a system to test for bugs or design more generally. For example, questions included validate the system before presenting it to end-users. It what steps they took to design and use the system, what involves long-term, genuine use. We also are not attempting challenges or successes they had, and whether they had to glorify autobiographical design. Instead, we are trying to instances where designing for themselves did not work bring to light an already common method for conducting well. Interviews were semi-structured, diverging from the HCI research, and understand and document its validity and initial question list as necessary to understand and usefulness as a research methodology so that other HCI document the respondents’ complete views on the topic. researchers can use it effectively as a part of their research. Interviews lasted between 45 and 90 minutes. EXPERT INTERVIEWS Table 1 provides a means to navigate our interviews. Respondents are listed in alphabetical order, along with the Recruitment and Respondent Selection types of systems they designed with self-usage and the We investigated autobiographical design by interviewing focal system discussed in each interview. Systems are experts from the HCI community who had experience in classified by type, highlighting their diversity. Even though using some form of the method.",False,0,,,,design knowledge; design expertise; design rationale; design pattern; design patterns; design principle; design principles; design guideline; design guidelines; design heuristic; design heuristics; design procedure; design procedures; design rule; design rules; design framework; design frameworks; design method; design methods; design theory,"Through interviews with HCI lessons from media spaces based on technologists’ use of experts who have engaged in variations of autobiographical their own systems or that of their colleagues, based on design, we draw out the possibilities and limitations of intensive and authentic self-usage (e.g., [7,16,33]). autobiographical design methods and lay out best practices Despite these examples of learning and designing through for its use as an HCI research method. self-usage, we know of few accounts of this as a reported HCI research method (the notable exception is [17]). In Author Keywords fact, HCI research methodologies focusing on researchers’ Autobiographical design; design research methods own experiences as users of a system may seem heretical to both the ethical goal of user-centered design and the ACM Classification Keywords epistemological goal of basing research in HCI on H.5.2 [Information interfaces and presentation]: User Interfaces – Evaluation/methodology; objective, third-party knowledge. Yet self-usage by researchers does happen, whether it is reported or not. Thus, as a community, we feel it is important that we better INTRODUCTION User-centered design is a cornerstone of the field of HCI, understand this method and how it should be used. since incorporating users in the design process can lead to Our goal, then, is to shed light on the research practice that better systems [35]. There are many methods for we term autobiographical design: design research incorporating end users into design research, ranging from drawing on extensive, genuine usage by those creating or participatory design to lab or field evaluations [35]. There building the system.

DIS 2012 • In the Wild June 11–15, 2012 • Newcastle, UK years to design and evaluate a social system for the Our interviews should be understood as an intellectual workplace [5]. Our stance in coming to autobiographical discussion with experts in the area as opposed to a social design was different; Sengers had intended this as a central science study. As such, participation was non-anonymous, concept of her project, while Neustaedter had used allowing us to credit participants for their intellectual autobiographical design simply as an early exploratory contributions, to discuss their work in detail, and to help method and was surprised to discover how much he readers evaluate their qualifications. In our results section, learned. While our experiences had clearly demonstrated we describe participants’ views on autobiographical design; value in autobiographical design, our case studies were not in the discussion section we present our own conclusions. enough to understand the full scope, possibilities, and limitations of the method. Thus, we interviewed other HCI Interview Method experts who engaged in self-usage as part of their design While the interviews were a form of intellectual research. Based on our interviews and our own experiences, conversation, this was not simply an informal chat amongst we analyze the strengths and weaknesses of the method, friends. Prior to our interviews we developed a set of articulate best practices for applying the method, and argue common interview questions. We piloted these questions by that, and under which circumstances, autobiographical interviewing each other, as we were previously unfamiliar design can be a useful and suitable HCI research method. with each other’s work in the area.

(By ‘genuine’ usage we mean it is are also design methods that focus on individual, based on true needs of the researchers, rather than them idiosyncratic experiences as a basis for design. Cooper, for pretending to have needs expected of targeted users). We example, emphasizes “designing for one” through creating chose the term ‘autobiographical design’ as we felt a core personas, or fictional characterizations of specific users attribute of the method is that a researcher or designer’s [11]. Others argue that designers should focus on nonown experiences are embodied in the design of a system typical users such as extreme characters [14], atypical user and its exploration. That is, as the researcher(s) build the groups [23], or lead users [42] as a source of innovation. system, they use it themselves, learn about the design space, and evaluate and iterate the design based on their own experiences. Within this definition, there are certainly nuances, and our paper explores these. personal or classroom use is granted without fee provided that copies are not made or distributed for profit or commercial advantage and that copies Our interest in this topic began with our own projects. bear this notice and the full citation on the first page. To copy otherwise, Neustaedter designed two systems for himself and his or republish, to post on servers or to redistribute to lists, requires prior specific permission and/or a fee. family, using and studying each system over the course of a DIS 2012, June 11-15, 2012, Newcastle, UK. year [27,34]. Sengers used a similar approach for three 514

DIS 2012 • In the Wild June 11–15, 2012 • Newcastle, UK questions of what we know are tied to questions about how For example, ethnographic methods focus on the we should know and what we view research to be. Here, articulation of cultural practices over long periods of time our respondents varied. Some respondents reported trying including reports on the ethnographer’s own experiences to find ways to minimize bias and to establish objective while culturally immersed. This is similar in some ways to findings. Other respondents were less concerned with autobiographical design; however, ethnography does not objectivity and more interested in the unique experiential typically include design work or design iteration. Like dimensions opened through autobiographical practices. autobiographical design, designerly techniques such as These different views potentially tie to different accounts of cultural probes [19] can provide design inspiration and HCI, as scientific research establishing truths of interaction sometimes even experiential understanding. However, (typically tied to behavioral science) or as interpretive autobiographical design includes the actual creation and research revealing alternative perspectives and new iteration of a design as part of its methodological process, possibilities for design (typically tied to design and whereas cultural probes do not. This is not to say that ethnography) [25]. Yet, as an anonymous reviewer pointed autobiographical design is better than these and other out, autobiographical design also ties to a crafts tradition research methods, but that it has its own strengths and reflected not only in design but also in computer science, properties. which values hands-on tinkering as a way of knowing.

DIS 2012 • In the Wild June 11–15, 2012 • Newcastle, UK Autobiographical Design in HCI Research: Designing and Learning through Use-It-Yourself Carman Neustaedter Phoebe Sengers School of Interactive Arts + Technology Information Science Simon Fraser University Cornell University Surrey, BC, Canada Ithaca, NY, USA carman_neustaedter@sfu.ca sengers@cs.cornell.edu ABSTRACT But what about when those individual users are the Designing a system with yourself as a target user and researchers or designers themselves? Nobody would contest evaluating the design through your own self-usage is that designers, developers, and researchers frequently use commonly considered a questionable approach in HCI their own systems during design in order to test concepts, research. Perhaps for this reason, HCI research including learn through actual usage, or find and fix software bugs. In extensive self-usage of a design is underdocumented. Yet fact, many would argue this is an important step before such self-usage does happen and many researchers have putting the design before other end users. Though never found great value in the lessons learned from it. Our goal in truly formalized as a research method, such “eat your own this paper is to bring these hidden practices to light and dog food” methods have been applied in industry for years offer guidelines for how HCI researchers can usefully [10,15]. Beyond this, some systems are used throughout engage in what we term ‘autobiographical design’—design their design based on designers’ or researchers’ real needs. research drawing on extensive, genuine usage by those For example, early research from CSCW reported many creating or building a system.

Questions asked respondents to describe systems they had designed that We caution that we are not articulating a “dogfooding” involved self-usage, the design process of one of these approach. As we will describe, autobiographical design systems in detail, and their thoughts about autobiographical goes beyond simply using a system to test for bugs or design more generally. For example, questions included validate the system before presenting it to end-users. It what steps they took to design and use the system, what involves long-term, genuine use. We also are not attempting challenges or successes they had, and whether they had to glorify autobiographical design. Instead, we are trying to instances where designing for themselves did not work bring to light an already common method for conducting well. Interviews were semi-structured, diverging from the HCI research, and understand and document its validity and initial question list as necessary to understand and usefulness as a research methodology so that other HCI document the respondents’ complete views on the topic. researchers can use it effectively as a part of their research. Interviews lasted between 45 and 90 minutes. EXPERT INTERVIEWS Table 1 provides a means to navigate our interviews. Respondents are listed in alphabetical order, along with the Recruitment and Respondent Selection types of systems they designed with self-usage and the We investigated autobiographical design by interviewing focal system discussed in each interview. Systems are experts from the HCI community who had experience in classified by type, highlighting their diversity. Even though using some form of the method.",6,Design methods,tfidf-svd,knowledge-type,kmeans,7,"architectural, mascot, self, children, embodied, software, hood, creation",-2.9559538,5.912185,0.6225330508688856,7,False,7,4,0.9442028317673111,"service, complexity, methodology, related, usage, key, term, creation",Design Methods,"This cluster focuses on architectural, mascot, involving Designers, with contribution types coded as Methodological, Artifact/System, Taxonomy/Review.",,Designers,,,"Methodological, Artifact/System, Taxonomy/Review","[{'paper_id': 'bee7b59885fa', 'title': 'Adapting the FBS Model of Designing for Usage-Driven Innovation Processes', 'cluster': 2, 'distance': 0.8245973476381321}, {'paper_id': '1416cd2b88de', 'title': 'Cross-disciplinary system value overview towards value-oriented design', 'cluster': 1, 'distance': 0.8292947778874292}, {'paper_id': '1c04ffa25528', 'title': 'The implications of improvisational acting and role-playing on design methodologies', 'cluster': 3, 'distance': 0.9117870470468675}, {'paper_id': 'b841f16ac5b3', 'title': 'Design methods for real time software', 'cluster': 7, 'distance': 0.918961015921968}, {'paper_id': 'b2234ef79a5a', 'title': ""Tracing situated effects of innovative design methods: inexperienced designers' practices"", 'cluster': 0, 'distance': 0.9239341233094402}]"
