paper_id,title,authors,abstract,doi,year,venue,url,keyword,source_file,source_repos,abstract_quality,format_excluded,scope_excluded,c2,c3,fulltext_flag,c2_and_c3,disposition,advances_to_fulltext,primary_reason,val_reason,pdf_found,pdf_path,pdf_extract_method,full_text_chars,paragraph_count,matched_paragraph_count,extracted_context,discussion_found,discussion_paragraph_count,discussion_summary,discussion_excerpt,discussion_full,extraction_terms,keyword_conditioned_context,keyword_conditioned_paragraph_count,focus_keyword,embedding_model,text_view,cluster_method,cluster,cluster_theme_terms,umap_x,umap_y,distance_to_centroid,representative_rank,is_representative_top3,medoid_rank,lda_topic,lda_topic_probability,lda_topic_words,cluster_label_candidate,cluster_summary_candidate,facet_population_or_context,facet_stakeholder_or_population,facet_method_or_lens,facet_artifact_or_domain,facet_contribution_or_outcome,nearest_papers
95c2b3d44aff,Multiple forms of applications and impacts of a design theory -ten years of industrial applications of C-K theory,A. Hatchuel; P. Masson; B. Weil; Marine Agogu√©; A. Kazak√ßi; S. Hooge,"C-K theory has been developed by Armand Hatchuel and Benoit Weil and then by other researchers since 1990s. In this paper we show that its very abstract nature and its high degree of universality actually supported a large variety of industrial applications. We distinguish three types of applications: 1) C-K theory provides a new language, that supports new analysis and descriptive capacity and new teachable individual models of thoughts; 2) C-K theory provides a very general framework to better characterize the validity domain and the performance conditions of existing methods, leading to potential improvement of these methods; 3) C-K theory is the conceptual model at the root of new design methods that are today largely used in the industry.",,2016,,https://www.semanticscholar.org/paper/5975acb4d5d895ad651694e7ae4694f8abac61d2,Design methods,design_methods.csv,semantic_scholar,full,False,False,True,True,False,True,advance_criteria,True,"Examines C-K design theory and categorizes its forms of application, treating a design theory as the object of study and characterizing/defining its constructs, satisfying C2 and C3.","The paper appears to analyze and distinguish types of industrial applications and impacts of C-K theory as a design-theory construct, but the abstract snippet does not clearly confirm a literature-based synthesis or an explicit definition, so full text is needed.",False,,,0,0,0,,False,0,,,,design knowledge; design expertise; design rationale; design pattern; design patterns; design principle; design principles; design guideline; design guidelines; design heuristic; design heuristics; design procedure; design procedures; design rule; design rules; design framework; design frameworks; design method; design methods; design theory,,0,Design methods,tfidf-svd,knowledge-type,kmeans,6,"survey, applications, attributes, complexity, problems, community, ideal, solve",-4.6138997,4.611737,0.2712505737212034,1,True,1,5,0.9701392495262948,"value, field, product, practitioners, problems, existing, survey, industrial",Design Methods,"This cluster focuses on survey, applications, involving Designers, with contribution types coded as Theoretical, Empirical, Artifact/System.",,Designers,,,"Theoretical, Empirical, Artifact/System","[{'paper_id': '94347a49c12b', 'title': 'Using System Dynamics to Construct Design Theory for Community Information Systems', 'cluster': 6, 'distance': 0.43649423214972516}, {'paper_id': 'ac2f5510db32', 'title': 'Beyond geometric complexity: a critical review of complexity theory and how it relates to architecture engineering and construction', 'cluster': 6, 'distance': 0.7003470631357127}, {'paper_id': '03ce61847eb3', 'title': 'Emotion Semantics Construction in Industrial Product Application', 'cluster': 1, 'distance': 0.7665067304272182}, {'paper_id': 'bee7b59885fa', 'title': 'Adapting the FBS Model of Designing for Usage-Driven Innovation Processes', 'cluster': 2, 'distance': 0.9067501762075918}, {'paper_id': '7e095752d24c', 'title': 'Think-4-EmCoDe framework: Highlighting key qualities in embodied co-design techniques for children', 'cluster': 7, 'distance': 0.9109582237736091}]"
799b06403189,State of the Art on Robust Design Methods for Additive Manufacturing,Y. Malyani; M. Orqu√©ra; D. Millet,"Additive Manufacturing (AM) technologies allow to produce functional parts with complex geometries that cannot be manufactured by conventional processes. However, the complexity of the product is increased and causes new constraints in the manufacturing process. Therefore, these new processes lead particularly to new needs in design methods. The objective of this paper is to explore and form an overall view of design methods, especially, robust design (RD) methods. Robust design is defined here as a methodology that enables to design a product with optimal performances and insensitivity to small variations of the inputs of the manufacturing process. In this contribution a state of the art of robust design methods applied to AM will be carried out.",,2020,Lecture Notes in Mechanical Engineering,https://www.semanticscholar.org/paper/5d5004424041e3ab71ae951f9013b54439ee2cf7,Design methods,design_methods.csv,semantic_scholar,full,False,False,True,True,True,True,advance_criteria,True,"State-of-the-art review forming an overall view of robust design methods and offering a definition of robust design, plausibly satisfying C2 and C3.","This state-of-the-art paper explicitly aims to form an overall view of robust design methods for additive manufacturing and the abstract states that robust design is defined, satisfying both synthesis and explicit definition criteria.",False,,,0,0,0,,False,0,,,,design knowledge; design expertise; design rationale; design pattern; design patterns; design principle; design principles; design guideline; design guidelines; design heuristic; design heuristics; design procedure; design procedures; design rule; design rules; design framework; design frameworks; design method; design methods; design theory,,0,Design methods,tfidf-svd,knowledge-type,kmeans,1,"functional, virtual, value, product, defined, robust, manufacturing, emotion",-4.1681647,5.7234464,0.3624231290658573,1,True,1,4,0.957916913691328,"service, complexity, methodology, related, usage, key, term, creation",Design Methods,"This cluster focuses on functional, virtual, involving Designers, with contribution types coded as Methodological, Artifact/System, Empirical.",,Designers,,,"Methodological, Artifact/System, Empirical","[{'paper_id': 'c825a5e5ab08', 'title': 'Functional design framework for innovative design thinking in product development', 'cluster': 1, 'distance': 0.7090228066505986}, {'paper_id': 'ac2f5510db32', 'title': 'Beyond geometric complexity: a critical review of complexity theory and how it relates to architecture engineering and construction', 'cluster': 6, 'distance': 0.7631276182158813}, {'paper_id': '03ce61847eb3', 'title': 'Emotion Semantics Construction in Industrial Product Application', 'cluster': 1, 'distance': 0.777001713854298}, {'paper_id': 'f02904f836be', 'title': 'Universal Participatory Design: Achievements and Challenges', 'cluster': 3, 'distance': 0.8343718330011785}, {'paper_id': 'b841f16ac5b3', 'title': 'Design methods for real time software', 'cluster': 7, 'distance': 0.8347404815209095}]"
03ce61847eb3,Emotion Semantics Construction in Industrial Product Application,Wenhao Jiang,"The theory of emotion semantics constitution put forward in this study aims to explore on how to convey emotions in product design. First, the development of emotion expression methods is reviewed, to point out the trend from physiological aspect to psychological activities and bring up a double-layer research framework composed of expression communication and sensory reception. The study has made a profound discussion on how to convey emotions in product design with sensory elements such as vision, hearing and touch, and to rouse the users‚Äô emotional resonance with multiple elements in product design. On theoretical level, this study has discussed how to construct visual symbols and apply concepts such as ‚Äúemotional bionics‚Äù and product semantics, so as to optimize the function of sensory elements in regulating emotions by combining morphological aesthetics and semantic representations. In terms of practice, this study puts forward the visual modelling construction theory for ‚Äúallomorphic‚Äù product, corresponds visual symbols such as product modelling, color design and material with emotional conveyance semantics, and highlights the users‚Äô unique emotional experience facilitated by art and sensory experience, so that the viewers can be greatly impressed by the product. The study also emphasizes the key role of design in promoting emotional resonance and sensory experience, and brings forward a series of design methods and technological innovation including emotion analysis, multimedia interaction, multi-element integration, introduction of cultural symbols and the incorporation of knowledge of applied psychology and physiology, aiming at enhancing positive interaction in the users‚Äô emotion and psychology via a full range of sensory stimulation.",,2024,Spectrum of Art,https://www.semanticscholar.org/paper/6f02f16a16473889b3ceea6c87a753d0886a0bc5,Design methods,design_methods.csv,semantic_scholar,full,False,False,True,True,True,True,advance_criteria,True,"Reviews emotion expression methods and puts forward an emotion semantics theory/framework for product design, suggesting synthesis and original definition; flagged to confirm.","The paper reviews prior emotion-expression methods in product design, develops a research framework, and explicitly states a theory of emotion semantics constitution, satisfying both synthesis and definitional criteria.",False,,,0,0,0,,False,0,,,,design knowledge; design expertise; design rationale; design pattern; design patterns; design principle; design principles; design guideline; design guidelines; design heuristic; design heuristics; design procedure; design procedures; design rule; design rules; design framework; design frameworks; design method; design methods; design theory,,0,Design methods,tfidf-svd,knowledge-type,kmeans,1,"functional, virtual, value, product, defined, robust, manufacturing, emotion",-3.937139,4.9711866,0.46454911536859256,3,True,3,5,0.9600756673707326,"value, field, product, practitioners, problems, existing, survey, industrial",Design Methods,"This cluster focuses on functional, virtual, involving Designers, with contribution types coded as Methodological, Artifact/System, Empirical.",,Designers,,,"Methodological, Artifact/System, Empirical","[{'paper_id': 'c825a5e5ab08', 'title': 'Functional design framework for innovative design thinking in product development', 'cluster': 1, 'distance': 0.71280054442455}, {'paper_id': '95c2b3d44aff', 'title': 'Multiple forms of applications and impacts of a design theory -ten years of industrial applications of C-K theory', 'cluster': 6, 'distance': 0.7665067304272182}, {'paper_id': '799b06403189', 'title': 'State of the Art on Robust Design Methods for Additive Manufacturing', 'cluster': 1, 'distance': 0.777001713854298}, {'paper_id': '94347a49c12b', 'title': 'Using System Dynamics to Construct Design Theory for Community Information Systems', 'cluster': 6, 'distance': 0.8331028214868301}, {'paper_id': 'f16832406221', 'title': 'A Framework for Systemic Design', 'cluster': 2, 'distance': 0.8353050598091366}]"
66218ff443f6,Deliberated Evolution: Stalking the View Matcher in Design Space,John Millar Carroll; M. Rosson,"Technology development in HCI can be interpreted as a co-evolution of tasks and artifacts. The tasks people actually engage in (successfully or problematically) and those they wish to engage in (or perhaps merely to imagine) define requirements for future technology, and specifically for new HCI artifacts. These artifacts, in turn, open up new possibilities for human tasks, new ways to do familiar things, entirely new kinds of things to do. In this paper we describe psychological design rationale as an approach to augmenting HCI technology development and to clarifying the sense in which HCI artifacts embody psychological theory. A psychological design rationale is an enumeration of the psychological claims embodied by an artifact for the situations in which it is used. As an example, we present our design work with the View Matcher, a Smalltalk programming environment for coordinating multiple views of an example application. In particular, we show how psychological design rationale was used to develop a view matcher for code reuse from prior design rationales for related programming tasks and environments. 1. TASKS AND ARTIFACTS In 1605, Sir Francis Bacon called for a ‚Äúnatural history of trades.‚Äù He urged that technical tools, techniques and processes be made more public and explicit. This was one element in his broader project of developing practical science, and hinged on the assumption that if such knowledge could be more systematically considered and integrated, human progress would necessarily result. Thus, Bacon suggested that new concepts and inventions would result ‚Äúby a connexion and transferring of the observations of one Arte, to the use of another, when the experiences of several misteries shall fall under the consideration of one man‚Äôs minde.‚Äù (1970: Book 2, p. 10) Half a century later, when the Royal Society of London and the French Acad√©mie des Sciences were established, Bacon‚Äôs proposal was high on their agendas. However, the Royal Society quietly but promptly abandoned the project. And the Acad√©mie pursued it rather haltingly over the next century, culminating in the publication of Diderot‚Äôs Encyclop√©die ou dictionaire raisson√© des science, des artes, et des m√©tiers. Though Diderot‚Äôs objectives were explicitly those Bacon had originally articulated, the final product of the Encyclop√©die substantially lagged the leading edge of technology and its directive impacts on technological evolution were relatively minor. In this paper we are disciples of Bacon in an approach to HCI that we call ‚Äúdeliberated evolution‚Äù: we want to integrate understanding systems and building systems within a single framework of research-development. Our focus is on the psychological import of HCI artifacts (workstation hardware, operating systems, application programs, user interface displays and devices, and so forth). We are exploring the directive role that psychological design rationales of HCI artifacts can play in design work. In Bacon‚Äôs terms, our interest is in the connection and transferring of one design to a use in another design by means of explicit design rationale and systematic design methods. There are many reasons why Bacon‚Äôs original proposal failed to effectively guide seventeenth-century technology evolution (Ferguson, 1977). One factor is that it just took 1 Current address: Center for Human-Computer Interaction, 660 McBryde Hall, Virginia Tech, Blacksburg,",,1996,Hum. Comput. Interact.,https://www.semanticscholar.org/paper/7396740affd17f5cc3db5d1a68c15af8c79cb17e,Design methods,design_methods.csv,semantic_scholar,full,False,False,True,True,True,True,advance_criteria,True,"Presents psychological design rationale as an approach within design space, treating design rationale as a construct and offering its own framing, satisfying C2 and plausibly C3; flagged for full-text confirmation.","The paper appears centrally concerned with psychological design rationale in HCI and may define or adapt a design-knowledge construct, but the truncated abstract is insufficient to confirm C2 or C3 without full text.",False,,,0,0,0,,False,0,,,,design knowledge; design expertise; design rationale; design pattern; design patterns; design principle; design principles; design guideline; design guidelines; design heuristic; design heuristics; design procedure; design procedures; design rule; design rules; design framework; design frameworks; design method; design methods; design theory,,0,Design methods,tfidf-svd,knowledge-type,kmeans,0,"collapse, artifacts, floorplan, findings, business models, tasks, corroboration, ways",-4.6941786,6.187273,0.5708891002511586,4,False,4,2,0.9600263281945294,"architectural, virtual, understand, industry, building, challenges, artifacts, interactive",Design Methods,"This cluster focuses on Education / Learning, involving Designers, Practitioners, using User-centered Design, Ethnographic as the main methodological or conceptual lens, with contribution types coded as Methodological, Theoretical, Empirical.",Education / Learning,"Designers, Practitioners","User-centered Design, Ethnographic",,"Methodological, Theoretical, Empirical","[{'paper_id': 'b5d968168f35', 'title': 'A Framework of Design Method Corroboration', 'cluster': 0, 'distance': 0.6854201423945931}, {'paper_id': 'f47226c43979', 'title': 'The Human-Centredness Metric: Early Assessment of the Quality of Human-Centred Design Activities', 'cluster': 4, 'distance': 0.8863278515067551}, {'paper_id': '5611cdb5c33a', 'title': 'Generating implications for design through design research', 'cluster': 0, 'distance': 0.9049940129505855}, {'paper_id': 'f16832406221', 'title': 'A Framework for Systemic Design', 'cluster': 2, 'distance': 0.9073249020794059}, {'paper_id': '9fbb38d67689', 'title': 'Analysis of methods of creating new technical systems', 'cluster': 7, 'distance': 0.9076372418212337}]"
76669ffc8981,A Framework for Effective Virtual Commissioning: Guiding Principles for Seamless System Integration,Rich√°rd Korpai; Norbert Sz√°nt√≥; √Å. Csap√≥,"Virtual commissioning (VC), defined as the simulation and testing of systems in a virtual environment before physical implementation, plays a key role in addressing the challenges of integrating and validating complex systems efficiently and effectively. This paper focuses on the topic of virtual commissioning, summarizing and organizing existing research in the field. The paper provides a comprehensive overview of various design methods and technologies currently in use. A case study of virtual commissioning is also presented within the area of the Cyber-Physical Manufacturing Systems Laboratory of the Sz√©chenyi Istv√°n University, detailing the solution steps taken. Drawing on both research and practical experience, the paper proposes a novel framework to support virtual commissioning design, referred to as the ‚ÄúVirtual Commissioning House‚Äù (VCH). The methodology is evaluated through comparisons with existing virtual commissioning solutions, demonstrating its effectiveness.",,2024,Journal of Manufacturing and Materials Processing,https://www.semanticscholar.org/paper/97c9a4799592ce42d22539428acaa5f9ab544e51,Design methods,design_methods.csv,semantic_scholar,full,False,False,True,True,True,True,advance_criteria,True,"Summarizes and organizes existing research on virtual commissioning design methods and offers a defined framework with guiding principles, plausibly satisfying C2/C3; flag to confirm.","The abstract explicitly defines virtual commissioning and states that it summarizes and organizes existing research while presenting guiding principles, satisfying both synthesis and definitional criteria.",False,,,0,0,0,,False,0,,,,design knowledge; design expertise; design rationale; design pattern; design patterns; design principle; design principles; design guideline; design guidelines; design heuristic; design heuristics; design procedure; design procedures; design rule; design rules; design framework; design frameworks; design method; design methods; design theory,,0,Design methods,tfidf-svd,knowledge-type,kmeans,1,"functional, virtual, value, product, defined, robust, manufacturing, emotion",-5.5380936,4.59934,0.5736424371126845,5,False,5,2,0.9759874930112011,"architectural, virtual, understand, industry, building, challenges, artifacts, interactive",Design Methods,"This cluster focuses on functional, virtual, involving Designers, with contribution types coded as Methodological, Artifact/System, Empirical.",,Designers,,,"Methodological, Artifact/System, Empirical","[{'paper_id': '94347a49c12b', 'title': 'Using System Dynamics to Construct Design Theory for Community Information Systems', 'cluster': 6, 'distance': 0.8480064366334039}, {'paper_id': '1c04ffa25528', 'title': 'The implications of improvisational acting and role-playing on design methodologies', 'cluster': 3, 'distance': 0.8549341585051919}, {'paper_id': '55dc4ef842a6', 'title': 'IMPLEMENTATION OF THE BASIC PRINCIPLES OF FORMING THE ARCHITECTURE OF NON-FORMAL EDUCATION INSTITUTIONS', 'cluster': 3, 'distance': 0.8649319668008786}, {'paper_id': '799b06403189', 'title': 'State of the Art on Robust Design Methods for Additive Manufacturing', 'cluster': 1, 'distance': 0.8694490551934607}, {'paper_id': 'f16832406221', 'title': 'A Framework for Systemic Design', 'cluster': 2, 'distance': 0.8995378724044476}]"
94347a49c12b,Using System Dynamics to Construct Design Theory for Community Information Systems,A. Moor,"Virtual communities are complex and evolving socio-technical systems. The design of community information systems requires much theoretical research to solve design problems. A design theory is a prescriptive theory which helps optimize design methods. Community IS design theory is still very young and fragmented, however. In the design theory development process, a mix of theory components is used to solve novel problems or existing problems more effectively and efficiently. We present a meta-model of IS development which focuses on the role of theory in IS design. We show how simulation via system dynamics could play an important role in a more systematic development of design theory for community information systems.",,2007,Journal of Community Informatics,https://www.semanticscholar.org/paper/9898a05d24456f06fae80b2792799f42c78e97c2,Design methods,design_methods.csv,semantic_scholar,full,False,False,True,True,True,True,advance_criteria,True,"Discusses design theory as a construct, presents a meta-model of theory's role in IS design, and defines design theory, plausibly satisfying C2 and C3; flagged to confirm in full text.","The abstract discusses an abstract discourse and design dimensions for landscape design, but it is unclear from the truncated text whether it synthesizes prior work or explicitly defines a design-knowledge construct, so full-text review is warranted.",False,,,0,0,0,,False,0,,,,design knowledge; design expertise; design rationale; design pattern; design patterns; design principle; design principles; design guideline; design guidelines; design heuristic; design heuristics; design procedure; design procedures; design rule; design rules; design framework; design frameworks; design method; design methods; design theory,,0,Design methods,tfidf-svd,knowledge-type,kmeans,6,"survey, applications, attributes, complexity, problems, community, ideal, solve",-4.8322115,4.4259663,0.2712961681529421,2,True,2,5,0.9729613423271884,"value, field, product, practitioners, problems, existing, survey, industrial",Design Methods,"This cluster focuses on survey, applications, involving Designers, with contribution types coded as Theoretical, Empirical, Artifact/System.",,Designers,,,"Theoretical, Empirical, Artifact/System","[{'paper_id': '95c2b3d44aff', 'title': 'Multiple forms of applications and impacts of a design theory -ten years of industrial applications of C-K theory', 'cluster': 6, 'distance': 0.43649423214972516}, {'paper_id': 'ac2f5510db32', 'title': 'Beyond geometric complexity: a critical review of complexity theory and how it relates to architecture engineering and construction', 'cluster': 6, 'distance': 0.7021640151348789}, {'paper_id': 'f02904f836be', 'title': 'Universal Participatory Design: Achievements and Challenges', 'cluster': 3, 'distance': 0.8165403746084076}, {'paper_id': '03ce61847eb3', 'title': 'Emotion Semantics Construction in Industrial Product Application', 'cluster': 1, 'distance': 0.8331028214868301}, {'paper_id': '76669ffc8981', 'title': 'A Framework for Effective Virtual Commissioning: Guiding Principles for Seamless System Integration', 'cluster': 1, 'distance': 0.8480064366334039}]"
