paper_id,title,authors,abstract,doi,year,venue,url,keyword,source_file,source_repos,abstract_quality,format_excluded,scope_excluded,c2,c3,fulltext_flag,c2_and_c3,disposition,advances_to_fulltext,primary_reason,val_reason,pdf_found,pdf_path,pdf_extract_method,full_text_chars,paragraph_count,matched_paragraph_count,extracted_context,discussion_found,discussion_paragraph_count,discussion_summary,discussion_excerpt,discussion_full,extraction_terms,keyword_conditioned_context,keyword_conditioned_paragraph_count,focus_keyword,embedding_model,text_view,cluster_method,cluster,cluster_theme_terms,umap_x,umap_y,distance_to_centroid,representative_rank,is_representative_top3,medoid_rank,lda_topic,lda_topic_probability,lda_topic_words,cluster_label_candidate,cluster_summary_candidate,facet_population_or_context,facet_stakeholder_or_population,facet_method_or_lens,facet_artifact_or_domain,facet_contribution_or_outcome,nearest_papers
dbf31702e533,Patterns for living lab practice: describing key know-how to promote service co-creation with users,"Akasaka, Fumiya (1); Yasuoka, Mika (2); Nakatani, Momoko (1); Kimura, Atsunobu (1); Ihara, Masayuki (1)","'Value co-creation' among actors related to service provision is one of the key concepts in service design. Living Lab (LL) is a co-creative service design methodology in which designers and users collaboratively design services. In LL, users are actively involved in service design processes over long periods. Because LL is a design methodology based on longterm co-creation with users, its practices involve more direct and indirect communication and collaboration with users than typical service design does. Therefore, in order to make value co-creation successful in LL projects, it is crucial for designers to use not only knowledge of service design methods, but also practical know-how related to 'facilitating long-term cocreation with users.' Such know-how is not always shared, however, among LL practitioners, because it is often buried in their experiences. Thus, LL practice currently places heavy reliance on the practitioners‚Äô intuition and experience. Therefore, to support LL practitioners, it is essential to extract key knowhow on how to achieve successful LL projects from experienced practitioners, and to describe such knowhow. This would allow us to share and reuse knowhow in planning and running an LL project. Hence, the purpose of this study is to extract such key knowhow for LL practice and describe it in an easy-to-reuse manner. We first developed a workshop to extract key know-how for LL practice. In this study, we held the workshop twice and could extract 30 items of key know-how. Subsequently, we described the extracted key know-how as 'patterns' by using the pattern language framework, and we developed a booklet listing the 30 patterns in an easy-to-reuse manner. The booklet can be used by LL practitioners to refer to and reuse the key know-how for LL practice. Through an evaluation, we confirmed that the developed booklet is useful for LL practitioners for referring to and using LL know-how. ¬© 2020, Fuji Technology Press. All rights reserved.",10.20965/ijat.2020.p0769,2020,International Journal of Automation Technology,,Design methods,design_methods.csv,engineering_village|semantic_scholar,full,False,False,True,True,True,True,advance_criteria,True,"Develops patterns describing key know-how for Living Lab service co-creation, synthesizing design knowledge into patterns (C2) and defining LL/co-creation constructs (C3 plausible), warranting full-text review.","The paper appears to articulate patterns/know-how for living lab service co-creation practice, suggesting a synthesis/categorization of design knowledge from practice or prior work, but the truncated abstract does not clearly confirm any explicit definition or adaptation.",False,,,0,0,0,,False,0,,,,design knowledge; design expertise; design rationale; design pattern; design patterns; design principle; design principles; design guideline; design guidelines; design heuristic; design heuristics; design procedure; design procedures; design rule; design rules; design framework; design frameworks; design method; design methods; design theory,,0,Design methods,tfidf-svd,knowledge-type,kmeans,2,"service, fbs, methodology, systemic, innovation, creation, rid, lab",-2.9181378,6.4643064,0.24195438584641416,2,True,2,4,0.9701698839543398,"service, complexity, methodology, related, usage, key, term, creation",Design Methods,"This cluster focuses on service, fbs, involving Designers, Practitioners, using Design Science, Case Study, Workshop as the main methodological or conceptual lens, with contribution types coded as Methodological, Empirical, Artifact/System.",,"Designers, Practitioners","Design Science, Case Study, Workshop",,"Methodological, Empirical, Artifact/System","[{'paper_id': '27b32c0d515d', 'title': 'Advancing service design research with design science research', 'cluster': 2, 'distance': 0.2937282448980253}, {'paper_id': 'f16832406221', 'title': 'A Framework for Systemic Design', 'cluster': 2, 'distance': 0.7571313379892828}, {'paper_id': 'd330bde18c87', 'title': 'Languaging design methods', 'cluster': 7, 'distance': 0.7890791308556031}, {'paper_id': '7e095752d24c', 'title': 'Think-4-EmCoDe framework: Highlighting key qualities in embodied co-design techniques for children', 'cluster': 7, 'distance': 0.8622130182106342}, {'paper_id': '1416cd2b88de', 'title': 'Cross-disciplinary system value overview towards value-oriented design', 'cluster': 1, 'distance': 0.8874518755777058}]"
49719118a4a0,Progressive collapse of structures ‚Äì review and outlook,"Starossek, U. (1)","The difference between progressive collapse, related to mechanisms of collapse, and disproportionate collapse, related to design, is outlined. Various mechanisms of collapse are described, which helps to clarify conceptual relationships. Ordinary design procedures are inadequate for preventing disproportionate collapse. The reasons for this are explained. After defining the terms collapse resistance and robustness, a pragmatic design approach for achieving collapse resistance of general structures is outlined. In this approach, the design objectives are established in a decision-making process. Concerning design methods, segmentation is available in addition to alternative load paths. The former method can be preferable in case of large initial local failure. This pragmatic approach can be developed into model guidelines for the design of general structures against disproportionate collapse. In contrast, it is found that current design regulations apply only to buildings of small to medium size and not to structures in general. ¬© 2019 Taylor & Francis Group, London, UK.",10.1201/9780429426506-364,2019,"Advances in Engineering Materials, Structures and Systems: Innovations, Mechanics and Applications - Proceedings of the 7th International Conference on Structural Engineering, Mechanics and Computation, 2019",,Design methods,design_methods.csv,engineering_village,full,False,False,True,True,True,True,advance_criteria,True,"Reviews and clarifies conceptual distinctions and definitions (collapse resistance, robustness) and outlines design approaches, plausibly synthesizing and defining constructs; flagged to confirm from full text.","This review explicitly clarifies and defines collapse-related concepts, describes conceptual relationships, and outlines a pragmatic design approach, satisfying both synthesis/definition and explicit definitional criteria.",False,,,0,0,0,,False,0,,,,design knowledge; design expertise; design rationale; design pattern; design patterns; design principle; design principles; design guideline; design guidelines; design heuristic; design heuristics; design procedure; design procedures; design rule; design rules; design framework; design frameworks; design method; design methods; design theory,,0,Design methods,tfidf-svd,knowledge-type,kmeans,0,"collapse, artifacts, floorplan, findings, business models, tasks, corroboration, ways",-5.9332347,6.544827,0.6190648602693866,8,False,8,4,0.9401915992979402,"service, complexity, methodology, related, usage, key, term, creation",Design Methods,"This cluster focuses on Education / Learning, involving Designers, Practitioners, using User-centered Design, Ethnographic as the main methodological or conceptual lens, with contribution types coded as Methodological, Theoretical, Empirical.",Education / Learning,"Designers, Practitioners","User-centered Design, Ethnographic",,"Methodological, Theoretical, Empirical","[{'paper_id': '5ba50396ff25', 'title': 'What is a Convention in Interactive Narrative Design?', 'cluster': 7, 'distance': 0.8340921340383551}, {'paper_id': '0a373ca87142', 'title': 'Surveying a Landscape of Ethics-Focused Design Methods', 'cluster': 3, 'distance': 0.8624163687834814}, {'paper_id': '4934044e5959', 'title': 'Constraint management for concept ideation in conceptual design', 'cluster': 3, 'distance': 0.8827279698207828}, {'paper_id': '4592ed134f14', 'title': 'The relation between brain-learning physiology and conceptualization methods in the design process of architecture students1', 'cluster': 3, 'distance': 0.9020580231113021}, {'paper_id': 'b5d968168f35', 'title': 'A Framework of Design Method Corroboration', 'cluster': 0, 'distance': 0.9086600548435961}]"
4934044e5959,Constraint management for concept ideation in conceptual design,"Liu, Ang (1); Wang, Yuchen (1); Teo, Ivan (1); Lu, Stephen (2)","Constraint plays a critical role in swaying the direction of concept ideation in conceptual design. Design constraints should be differentiated from design objectives because they play different roles in influencing ideation. Constraint management is a very challenging task in conceptual design because they are mostly abstract, subjective, and dynamic. This paper focuses on constraint management for the sake of concept ideation. In this work, design constraints are modeled as the initial and boundary conditions of concept ideation. A new classification scheme is proposed to classify various design constraints into four categories: input internal constraint, system internal constraint, input external constraint, and system external constraint. A new concept ideation process is prescribed to generate more constraint-compliant concepts, through biologically inspired design. Some existing design methods, such as Domain Structure Matrix and Concept Map, are incorporated into the proposed process. A case study is presented to showcase how to follow the proposed method to redesign a robotic vacuum cleaner to make it more compliant with stricter design constraints. ¬© 2018 CIRP",10.1016/j.cirpj.2018.11.006,2019,CIRP Journal of Manufacturing Science and Technology,,Design methods,design_methods.csv,engineering_village|semantic_scholar,full,False,False,True,True,True,True,advance_criteria,True,"Studies design constraints in conceptual design, proposes a new classification scheme and differentiates/defines constraints versus objectives, plausibly satisfying C2 and C3.","The paper appears centrally concerned with conceptual design constraints and proposes a classification scheme for constraints, but the abstract truncation does not let us confirm whether this is a synthesis from prior work or an original definitional treatment, so full text is needed.",False,,,0,0,0,,False,0,,,,design knowledge; design expertise; design rationale; design pattern; design patterns; design principle; design principles; design guideline; design guidelines; design heuristic; design heuristics; design procedure; design procedures; design rule; design rules; design framework; design frameworks; design method; design methods; design theory,,0,Design methods,tfidf-svd,knowledge-type,kmeans,3,"architecture, landscape, ideation, constraint, article, concept, education, participatory",-6.2359014,5.8762984,0.6192386914678577,8,False,8,1,0.9620651214268241,"architecture, concept, conceptual, management, literature, field, landscape, technical",Design Methods,"This cluster focuses on Education / Learning, involving Designers, with contribution types coded as Artifact/System, Methodological, Theoretical.",Education / Learning,Designers,,,"Artifact/System, Methodological, Theoretical","[{'paper_id': '6e06768bb26b', 'title': 'Design as Research in Landscape Architecture', 'cluster': 3, 'distance': 0.8169744172333576}, {'paper_id': '49719118a4a0', 'title': 'Progressive collapse of structures ‚Äì review and outlook', 'cluster': 0, 'distance': 0.8827279698207828}, {'paper_id': '799b06403189', 'title': 'State of the Art on Robust Design Methods for Additive Manufacturing', 'cluster': 1, 'distance': 0.887511100763549}, {'paper_id': '885a1eee70e3', 'title': 'The Design of Business Models: What, How and Why', 'cluster': 0, 'distance': 0.8916625726659649}, {'paper_id': 'da2bb1488305', 'title': 'Rigor in MIS Survey Research: In Search of Ideal Survey Methodological Attributes', 'cluster': 6, 'distance': 0.8952694304594784}]"
b841f16ac5b3,Design methods for real time software,K. Jackson,"A definition of the term 'design' and its application to real time software, is given. A group of well known software design methods are analysed, including: Yourdon, SSADM, CORE, JSD, HOOD, MASCOT3. The author concludes that most design methods ignore architectural design, attempt to bypass it, or have just a single form of it. MASCOT and HOOD are the only two which address architectural design directly. Of these, HOOD provides only a limited subset of MASCOT. MASCOT itself has potential for enhancement to enable it to cope with the very largest of embedded real time systems.<>",,1990,,,Design methods,design_methods.csv,ieee|semantic_scholar,full,False,False,True,True,False,True,advance_criteria,True,"Defines the term 'design' and analyzes/compares a set of named software design methods, treating design methods as the topic of study and providing a definition.","This appears to discuss a user interface design methodology and its implications for systems design methods, with design methods as the topic, but the abstract only summarizes ongoing study findings and does not clearly show synthesis or explicit definitions.",False,,,0,0,0,,False,0,,,,design knowledge; design expertise; design rationale; design pattern; design patterns; design principle; design principles; design guideline; design guidelines; design heuristic; design heuristics; design procedure; design procedures; design rule; design rules; design framework; design frameworks; design method; design methods; design theory,,0,Design methods,tfidf-svd,knowledge-type,kmeans,7,"architectural, mascot, self, children, embodied, software, hood, creation",-4.2776265,8.166954,0.37144003042692564,1,True,1,2,0.9534116719083884,"architectural, virtual, understand, industry, building, challenges, artifacts, interactive",Design Methods,"This cluster focuses on architectural, mascot, involving Designers, with contribution types coded as Methodological, Artifact/System, Taxonomy/Review.",,Designers,,,"Methodological, Artifact/System, Taxonomy/Review","[{'paper_id': '8ade38cacb53', 'title': 'Architectural Design Method of Architectural Engineering', 'cluster': 7, 'distance': 0.5768757757227019}, {'paper_id': 'd330bde18c87', 'title': 'Languaging design methods', 'cluster': 7, 'distance': 0.8255869545747018}, {'paper_id': '799b06403189', 'title': 'State of the Art on Robust Design Methods for Additive Manufacturing', 'cluster': 1, 'distance': 0.8347404815209095}, {'paper_id': '9fbb38d67689', 'title': 'Analysis of methods of creating new technical systems', 'cluster': 7, 'distance': 0.8365706152425338}, {'paper_id': '7e095752d24c', 'title': 'Think-4-EmCoDe framework: Highlighting key qualities in embodied co-design techniques for children', 'cluster': 7, 'distance': 0.8548879597271055}]"
721f009574ce,On integration of interface design methods: Can debates be resolved?,Y. Lin; W. J. Zhang; R. J. Koubek; R. R. Mourant,"There have been many debates on how to design the human‚Äìcomputer interface (HCI). Often, one can find that different views in a debate are simply because these views are attached to different aspects which embody the same thing. In other words, prior to giving an effective judgment of a debate, one needs to establish an understanding of the ‚Äòtotal‚Äô aspects of a thing the debate is about. Following this line of thinking, in this paper, we propose an understanding of the ‚Äòtotal‚Äô aspects of designing HCI, which is called the total interface design framework. We then judge several debates under this framework with the purpose of exemplifying the judgment process for any other debate related to designing HCI. At the end, the debates used for exemplifying our judgment process can be resolved. The effectiveness of the total interface design framework for integrating the different HCI approaches is also demonstrated.",10.1016/j.intcom.2005.11.008,2006,,,Design methods,design_methods.csv,ieee|semantic_scholar,full,False,False,True,True,True,True,advance_criteria,True,"Proposes a 'total interface design framework' to integrate and reconcile HCI design method debates, synthesizing across views and offering its own framework definition.","Proposes a total interface design framework to integrate and judge debates among HCI design methods, suggesting synthesis of design-method perspectives, but whether it explicitly defines or adapts a design-knowledge construct is unclear from the abstract alone.",False,,,0,0,0,,False,0,,,,design knowledge; design expertise; design rationale; design pattern; design patterns; design principle; design principles; design guideline; design guidelines; design heuristic; design heuristics; design procedure; design procedures; design rule; design rules; design framework; design frameworks; design method; design methods; design theory,,0,Design methods,tfidf-svd,knowledge-type,kmeans,4,"novo, human centredness, debate, metric, understanding, proteins, views, interface",-3.8381069,6.737723,0.36162745524817164,2,True,2,5,0.6527182511766613,"value, field, product, practitioners, problems, existing, survey, industrial",Design Methods,"This cluster focuses on Education / Learning, with recurring attention to Interface, with contribution types coded as Methodological, Artifact/System.",Education / Learning,,,Interface,"Methodological, Artifact/System","[{'paper_id': 'f47226c43979', 'title': 'The Human-Centredness Metric: Early Assessment of the Quality of Human-Centred Design Activities', 'cluster': 4, 'distance': 0.78568522925897}, {'paper_id': '5ba50396ff25', 'title': 'What is a Convention in Interactive Narrative Design?', 'cluster': 7, 'distance': 0.8281675068982797}, {'paper_id': '5389fb1cc38b', 'title': 'Elements of a design method ‚Äì a basis for describing and evaluating design methods', 'cluster': 5, 'distance': 0.8812518551610253}, {'paper_id': '40a2d86cd488', 'title': 'Elements of a design method - a basis for describing and evaluating design methods', 'cluster': 5, 'distance': 0.8819210283974657}, {'paper_id': '9fbb38d67689', 'title': 'Analysis of methods of creating new technical systems', 'cluster': 7, 'distance': 0.8872494529682818}]"
f02904f836be,Universal Participatory Design: Achievements and Challenges,R. Bonacin; J√∫lio Cesar dos Reis; M. Baranauskas,"According to the principles of participatory design, a genuine democratic process requires effective participation of all affected people in the design process; this must include affected disabled users. However, user participation entails complex problems, which are aggravated by conditions of illiteracy and/or aging. This article presents the concept of Universal Participatory Design, a design philosophy and practice that aims to be inclusive during the design process, and which has a positive result for all. We first conducted a review of the literature to understand the limits of the relationships between participatory design and universal design. This paper then addresses some of the challenges to achieve Universal Participatory Design (UPD) by juxtaposing deficits observed in the literature with issues we experienced during two research projects. We discuss the key components of Participatory Design and its relationship to UPD, and establish a research agenda that aims to conceptualize and investigate participatory design with universal access. Our findings indicate the need for flexible design methods, adaptable artifacts, and positive designers‚Äô attitudes when encountering unexpected situations.",,2019,,https://www.semanticscholar.org/paper/06bb9a92fbf53b9d7a93c86acc244c380656fc1f,Design methods,design_methods.csv,semantic_scholar,full,False,False,True,True,True,True,advance_criteria,True,"Reviews participatory design literature and defines the concept of Universal Participatory Design, plausibly satisfying both C2 and C3; flagged to confirm in full text.","The paper introduces the concept of Universal Participatory Design and states that it first conducted a literature review, indicating both synthesis of prior work and an explicit conceptual definition/adaptation.",False,,,0,0,0,,False,0,,,,design knowledge; design expertise; design rationale; design pattern; design patterns; design principle; design principles; design guideline; design guidelines; design heuristic; design heuristics; design procedure; design procedures; design rule; design rules; design framework; design frameworks; design method; design methods; design theory,,0,Design methods,tfidf-svd,knowledge-type,kmeans,3,"architecture, landscape, ideation, constraint, article, concept, education, participatory",-6.152676,4.9232807,0.5303105551617562,4,False,4,4,0.9600922603809302,"service, complexity, methodology, related, usage, key, term, creation",Design Methods,"This cluster focuses on Education / Learning, involving Designers, with contribution types coded as Artifact/System, Methodological, Theoretical.",Education / Learning,Designers,,,"Artifact/System, Methodological, Theoretical","[{'paper_id': '55dc4ef842a6', 'title': 'IMPLEMENTATION OF THE BASIC PRINCIPLES OF FORMING THE ARCHITECTURE OF NON-FORMAL EDUCATION INSTITUTIONS', 'cluster': 3, 'distance': 0.7923055643591455}, {'paper_id': '6e06768bb26b', 'title': 'Design as Research in Landscape Architecture', 'cluster': 3, 'distance': 0.8157826969185822}, {'paper_id': '94347a49c12b', 'title': 'Using System Dynamics to Construct Design Theory for Community Information Systems', 'cluster': 6, 'distance': 0.8165403746084076}, {'paper_id': '1c04ffa25528', 'title': 'The implications of improvisational acting and role-playing on design methodologies', 'cluster': 3, 'distance': 0.8176845024528352}, {'paper_id': '799b06403189', 'title': 'State of the Art on Robust Design Methods for Additive Manufacturing', 'cluster': 1, 'distance': 0.8343718330011785}]"
